title,date,pros,cons,company,ticker,property_type,scrape_date,glassdoor_url,pros_raw,pros_cleaned,cons_raw,cons_cleaned,title_raw,title_cleaned,sentiment_positive,sentiment_negative,sentiment_neutral,sentiment_compound,sentiment_label,lm_positive_count,lm_negative_count,lm_net_score
"A Phenomenal Place to Work: Prologis, Leading the Future of Logistics Real Estate",2024-10-07,"Working at Prologis is an incredible experience! The company’s forward-thinking leadership is truly inspiring, with a clear vision of transforming the logistics real estate industry. Management here doesn’t just support—they actively encourage innovation, and every day you feel like you're part of something that's reshaping the future. If you're looking for a company where innovation meets opportunity, with a supportive team that genuinely cares, Prologis is the place to be. I couldn’t be more proud to contribute to a company that's constantly evolving and always leading from the front!","Its not for an average 9-5'er, Its a very high performing team. You will be pushed to grow, think outside of the box, accept change and be a champion of it - a way maker!","Prologis, Inc.",PLD,Industrial,2025-11-18,https://www.glassdoor.com/Reviews/Prologis-Reviews-E2631.htm,"Working at Prologis is an incredible experience! The company’s forward-thinking leadership is truly inspiring, with a clear vision of transforming the logistics real estate industry. Management here doesn’t just support—they actively encourage innovation, and every day you feel like you're part of something that's reshaping the future. If you're looking for a company where innovation meets opportunity, with a supportive team that genuinely cares, Prologis is the place to be. I couldn’t be more proud to contribute to a company that's constantly evolving and always leading from the front!",prolog incred forward think leadership truli clear vision transform logist real estat manag support activ encourag everi day feel part someth reshap look innov meet support team genuin prolog place proud contribut constantli evolv alway lead,"Its not for an average 9-5'er, Its a very high performing team. You will be pushed to grow, think outside of the box, accept change and be a champion of it - a way maker!",averag high perform push think outsid accept chang champion way,"A Phenomenal Place to Work: Prologis, Leading the Future of Logistics Real Estate",phenomen place lead futur logist real estat,0.12073615938425064,0.02080916427075863,0.858454704284668,0.09992699325084686,neutral,0,0,0.0
Over 2 decades of job satisfaction,2024-10-07,"I love the company culture, the benefits, and the fact that we are constantly leading the industry in how we operate and strive to keep our customers happy.","Part of being a leader in the industry means a lot of initiatives, change, testing and scrapping ideas, data collection -- it's a busy place!","Prologis, Inc.",PLD,Industrial,2025-11-18,https://www.glassdoor.com/Reviews/Prologis-Reviews-E2631.htm,"I love the company culture, the benefits, and the fact that we are constantly leading the industry in how we operate and strive to keep our customers happy.",love fact constantli lead industri oper strive keep custom,"Part of being a leader in the industry means a lot of initiatives, change, testing and scrapping ideas, data collection -- it's a busy place!",part leader industri mean lot test scrap data collect busi,Over 2 decades of job satisfaction,decad satisfact,0.12198083847761154,0.017921213060617447,0.8600978851318359,0.1040596216917038,neutral,0,0,0.0
"Not too good, Not too bad",2025-10-31,"Work-life balance is great, lots of PTO and holidays, rarely working a full 40 hours, great office location, and perks","Very lean company with lots of turnover, constant reshuffling of department structure, fast-paced, and very easy to get behind","Prologis, Inc.",PLD,Industrial,2025-11-18,https://www.glassdoor.com/Reviews/Prologis-Reviews-E2631.htm,"Work-life balance is great, lots of PTO and holidays, rarely working a full 40 hours, great office location, and perks",life balanc lot pto rare full great offic perk,"Very lean company with lots of turnover, constant reshuffling of department structure, fast-paced, and very easy to get behind",lean lot constant reshuffl depart fast easi behind,"Not too good, Not too bad",bad,0.09534461051225662,0.019919833168387413,0.8847355842590332,0.07542477548122406,neutral,0,0,0.0
Always something new to get involved in and be at the forefront of,2024-09-11,"Prologis offers a dynamic and inclusive work environment where innovation and collaboration are at the forefront of everything we do. The company provides ample opportunities for growth in and above your role, with a strong focus on professional development and career advancement. With a commitment to sustainability, community engagement, and employee well-being, Prologis fosters a culture that values both individual contributions and teamwork. There is a strong emphasis during the interview process on identifying candidates that make a good team and cultural fit to ensure collegiality and longevity of employment with the company - this is evident in how many people you speak with have been with the company 5, 10, 20 years. The company’s global reach and dedication to industry leadership make it an exciting place to build an impactful career and be at the forefront of a fast growing industry.",Workload can sometimes be very overwhelming,"Prologis, Inc.",PLD,Industrial,2025-11-18,https://www.glassdoor.com/Reviews/Prologis-Reviews-E2631.htm,"Prologis offers a dynamic and inclusive work environment where innovation and collaboration are at the forefront of everything we do. The company provides ample opportunities for growth in and above your role, with a strong focus on professional development and career advancement. With a commitment to sustainability, community engagement, and employee well-being, Prologis fosters a culture that values both individual contributions and teamwork. There is a strong emphasis during the interview process on identifying candidates that make a good team and cultural fit to ensure collegiality and longevity of employment with the company - this is evident in how many people you speak with have been with the company 5, 10, 20 years. The company’s global reach and dedication to industry leadership make it an exciting place to build an impactful career and be at the forefront of a fast growing industry.",prolog offer dynam inclus environ innov collabor forefront everyth provid ampl opportun growth strong focu profession develop career commit commun well prolog foster cultur valu individu contribut strong emphasi interview process identifi candid good team cultur fit ensur collegi longev employ evid mani speak global reach dedic industri leadership excit place build impact career forefront fast grow,Workload can sometimes be very overwhelming,workload sometim overwhelm,Always something new to get involved in and be at the forefront of,alway someth new involv forefront,0.3094169795513153,0.010905129835009575,0.6796779036521912,0.2985118627548218,neutral,3,0,0.05263157894736842
"Great culture, secret gem",2024-09-16,"The people are truly, genuinely great. Leadership is open to criticism, willing to change. Big ambitions in sustainability / reducing carbon footprint at scale. Real goals around equal pay, diversity and inclusion. Proactive, hard-working people.",Very fast-paced company. Some parts of the business are still very old school (it's real estate). Technology needs an upgrade -- employees have way too many disconnected tools and platforms.,"Prologis, Inc.",PLD,Industrial,2025-11-18,https://www.glassdoor.com/Reviews/Prologis-Reviews-E2631.htm,"The people are truly, genuinely great. Leadership is open to criticism, willing to change. Big ambitions in sustainability / reducing carbon footprint at scale. Real goals around equal pay, diversity and inclusion. Proactive, hard-working people.",genuin leadership open will big ambit sustain reduc carbon footprint real goal around equal divers hard,Very fast-paced company. Some parts of the business are still very old school (it's real estate). Technology needs an upgrade -- employees have way too many disconnected tools and platforms.,fast pace part busi still old school real estat technolog need upgrad employe way mani disconnect tool,"Great culture, secret gem",great secret gem,0.6311343312263489,0.01297392975538969,0.35589170455932617,0.6181604266166687,positive,0,0,0.0
Great Perks Heavy Work Load,2025-10-04,Company has lots of perks. Snacks lunches outings etc. Remote day.,Pretty unrealistic work load. They ask a lot of their employees and aren’t the best with training their leadership.,"Prologis, Inc.",PLD,Industrial,2025-11-18,https://www.glassdoor.com/Reviews/Prologis-Reviews-E2631.htm,Company has lots of perks. Snacks lunches outings etc. Remote day.,lot snack lunch outing remot,Pretty unrealistic work load. They ask a lot of their employees and aren’t the best with training their leadership.,pretti unrealist ask lot employe best train,Great Perks Heavy Work Load,great perk heavi load,0.08380001038312912,0.03469841554760933,0.8815016150474548,0.04910159483551979,neutral,0,0,0.0
Fantastic Company!,2025-04-21,Executive management is very proactive on being transparent to everyone on a frequent basis.,istent branding and processes across all regions and groups considering we are a global company. Offers great work and life balance and terrific office amenities.,"Prologis, Inc.",PLD,Industrial,2025-11-18,https://www.glassdoor.com/Reviews/Prologis-Reviews-E2631.htm,Executive management is very proactive on being transparent to everyone on a frequent basis.,execut manag proactiv transpar everyon frequent,istent branding and processes across all regions and groups considering we are a global company. Offers great work and life balance and terrific office amenities.,istent brand process across region group consid global offer great life balanc terrif offic,Fantastic Company!,fantast,0.06721614301204681,0.01266110222786665,0.9201227426528931,0.05455503985285759,neutral,0,0,0.0
Talented team and forward-thinking culture,2025-03-26,"I work with highly competent people who take pride in what they do. There’s a strong push to stay ahead of the technology curve, which keeps the work fresh and challenging. I’m consistently encouraged to develop new skills and explore innovative solutions—especially in the Microsoft ecosystem. Leadership is technically aware and open to modern approaches.","Inter-departmental communication could be stronger. Sometimes, alignment between teams takes longer than necessary and leads to duplicated efforts or unclear responsibilities. While the intention is good, some cross-team processes could be streamlined.","Prologis, Inc.",PLD,Industrial,2025-11-18,https://www.glassdoor.com/Reviews/Prologis-Reviews-E2631.htm,"I work with highly competent people who take pride in what they do. There’s a strong push to stay ahead of the technology curve, which keeps the work fresh and challenging. I’m consistently encouraged to develop new skills and explore innovative solutions—especially in the Microsoft ecosystem. Leadership is technically aware and open to modern approaches.",highli compet take pride strong push stay ahead technolog keep fresh consist encourag develop new skill explor innov solut especi microsoft leadership technic awar open modern,"Inter-departmental communication could be stronger. Sometimes, alignment between teams takes longer than necessary and leads to duplicated efforts or unclear responsibilities. While the intention is good, some cross-team processes could be streamlined.",inter department commun align team take longer necessari lead duplic effort unclear intent cross team process,Talented team and forward-thinking culture,talent team forward think cultur,0.32795849442481995,0.011801703833043575,0.6602398157119751,0.316156804561615,neutral,1,0,0.038461538461538464
Really impressed with this company,2025-09-08,"After spending a decade in big tech, I was surprised to find a company that takes many of the great attributes and leaves the negative aspects of many other big Silicon Valley corporations (in my experience since being here 1.5 years). From the comprehensive (and fun!) multi-day, in-person onboarding trainings, to company-wide volunteer days (IMPACT Day), social events that embrace different cultures and celebrate diversity - Prologis is a company that invests in its employees. I also appreciate that it routinely asks employees what it can do better, and listens. Teams are continually driving towards excellence - whether that’s finding a more effective process or implementing new technology to help teams work smarter. But in my experience, being “human” is still valued. People lead with kindness and empathy in a way that feels really genuine. The cascading effect creates a team dynamic that is pretty rare in my experience.","For those that love remote work, we’re currently in the office 3x/week (may vary based on the team). At least the snacks are good :)","Prologis, Inc.",PLD,Industrial,2025-11-18,https://www.glassdoor.com/Reviews/Prologis-Reviews-E2631.htm,"After spending a decade in big tech, I was surprised to find a company that takes many of the great attributes and leaves the negative aspects of many other big Silicon Valley corporations (in my experience since being here 1.5 years). From the comprehensive (and fun!) multi-day, in-person onboarding trainings, to company-wide volunteer days (IMPACT Day), social events that embrace different cultures and celebrate diversity - Prologis is a company that invests in its employees. I also appreciate that it routinely asks employees what it can do better, and listens. Teams are continually driving towards excellence - whether that’s finding a more effective process or implementing new technology to help teams work smarter. But in my experience, being “human” is still valued. People lead with kindness and empathy in a way that feels really genuine. The cascading effect creates a team dynamic that is pretty rare in my experience.",spend decad big surpris find take mani great attribut leav neg aspect mani big silicon valley corpor experi sinc year comprehens multi person onboard wide volunt day impact day social event embrac differ cultur celebr divers prolog invest appreci routin ask employe team continu drive toward excel whether find effect process implement new technolog help team human still lead kind empathi way feel realli cascad effect creat team dynam pretti rare,"For those that love remote work, we’re currently in the office 3x/week (may vary based on the team). At least the snacks are good :)",love remot current offic week may vari base team least snack good,Really impressed with this company,realli impress,0.17824600636959076,0.017167197540402412,0.8045867681503296,0.1610788106918335,neutral,0,0,0.0
Great place to work,2025-06-05,Love working at a large company that feels small!,Many people need to be involved in decision making,"Prologis, Inc.",PLD,Industrial,2025-11-18,https://www.glassdoor.com/Reviews/Prologis-Reviews-E2631.htm,Love working at a large company that feels small!,love larg feel,Many people need to be involved in decision making,mani need involv decis make,Great place to work,great place,0.09924307465553284,0.050572119653224945,0.8501847386360168,0.04867095500230789,neutral,0,0,0.0
Prologis is a great place to work!,2025-09-25,"I have only been here for a couple months but the culture at Prologis is amazing! It truly feels like a connected team and everyone is very willing to help/support each other. Given the scale and size of the company, the opportunities for growth or development are endless, especially if you have a natural curiosity to explore potential solutions. The benefits package far exceeds any of my previous employers.",Work from home is available and possible but given the need for significant team interaction and culture development there is limited work from home opportunities,"Prologis, Inc.",PLD,Industrial,2025-11-18,https://www.glassdoor.com/Reviews/Prologis-Reviews-E2631.htm,"I have only been here for a couple months but the culture at Prologis is amazing! It truly feels like a connected team and everyone is very willing to help/support each other. Given the scale and size of the company, the opportunities for growth or development are endless, especially if you have a natural curiosity to explore potential solutions. The benefits package far exceeds any of my previous employers.",coupl month cultur prolog truli feel connect team everyon will help support given scale size opportun growth develop especi natur curios explor potenti benefit packag far exce previou,Work from home is available and possible but given the need for significant team interaction and culture development there is limited work from home opportunities,home avail possibl given need signific team interact cultur develop limit home opportun,Prologis is a great place to work!,prolog great place,0.7892236709594727,0.009191105142235756,0.20158523321151733,0.7800325751304626,positive,2,0,0.07142857142857142
"High-speed, high-autonomy environment with the right balance of structure",2025-08-29,"A company where you can move fast, take ownership, and still count on solid support systems.",Fast-pace isn’t for everyone. Less hand-holding. Evolving processes can be tough to navigate. Workload balance can fluctuate. Not a fit for everyone.,"Prologis, Inc.",PLD,Industrial,2025-11-18,https://www.glassdoor.com/Reviews/Prologis-Reviews-E2631.htm,"A company where you can move fast, take ownership, and still count on solid support systems.",move take still count solid support,Fast-pace isn’t for everyone. Less hand-holding. Evolving processes can be tough to navigate. Workload balance can fluctuate. Not a fit for everyone.,fast pace less hand evolv process tough workload balanc fit,"High-speed, high-autonomy environment with the right balance of structure",high high autonomi environ right balanc structur,0.59464430809021,0.031369831413030624,0.3739858567714691,0.5632745027542114,positive,0,0,0.0
