title,date,pros,cons,company,ticker,property_type,scrape_date,glassdoor_url,pros_raw,pros_cleaned,cons_raw,cons_cleaned,title_raw,title_cleaned,sentiment_positive,sentiment_negative,sentiment_neutral,sentiment_compound,sentiment_label,lm_positive_count,lm_negative_count,lm_net_score
One of the Best Companies I've Ever Worked For,2024-09-13,"#1 is the culture at Prologis. People are kind and generally trying their best. We work hard but we pause to have fun. I also love that each region has their own sub-culture that makes it fun to visit, learn, and collaborate. Leadership has a vision for the company and genuinely cares about its people. The company is headed in the right direction. Some of the newer departments are still in startup mode figuring things out and can be messier, but there are a lot of things to be excited about and customers are overall happy with the products/services offered. Prologis is a company that practices what it preaches. We actually, seriously, care about ESG and reducing our impact on the environment, compared to other places I've been where it looks more like greenwashing. I feel well compensated for my work, and for the most part my work/life balance is fantastic. It helps that we get lots of vacation time (that I actually feel comfortable taking) and even a few days off per year to volunteer.","I would love to see more diversity in exec leadership roles (women, POC, and age) for fresh perspective. But I will say this has improved even in the few years that I've been here, and DEI is a newer group that has been established. As a global company, we have the challenge of communicating across geographies, time zones, and languages. We do a better job than even some smaller companies I've worked for, but still have some room to improve here.","Prologis, Inc.",PLD,Industrial,2025-11-18,https://www.glassdoor.com/Reviews/Prologis-Reviews-E2631.htm,"#1 is the culture at Prologis. People are kind and generally trying their best. We work hard but we pause to have fun. I also love that each region has their own sub-culture that makes it fun to visit, learn, and collaborate. Leadership has a vision for the company and genuinely cares about its people. The company is headed in the right direction. Some of the newer departments are still in startup mode figuring things out and can be messier, but there are a lot of things to be excited about and customers are overall happy with the products/services offered. Prologis is a company that practices what it preaches. We actually, seriously, care about ESG and reducing our impact on the environment, compared to other places I've been where it looks more like greenwashing. I feel well compensated for my work, and for the most part my work/life balance is fantastic. It helps that we get lots of vacation time (that I actually feel comfortable taking) and even a few days off per year to volunteer.",cultur kind gener tri hard paus love region sub cultur make fun leadership vision genuin care head right newer depart still startup mode figur thing lot thing excit custom overal happi product servic prolog practic care esg reduc impact compar place look feel well compens part life balanc help lot vacat actual feel comfort take even day per year,"I would love to see more diversity in exec leadership roles (women, POC, and age) for fresh perspective. But I will say this has improved even in the few years that I've been here, and DEI is a newer group that has been established. As a global company, we have the challenge of communicating across geographies, time zones, and languages. We do a better job than even some smaller companies I've worked for, but still have some room to improve here.",love see divers exec leadership role age fresh say improv even year dei newer group global challeng commun across better even smaller compani work still room improv,One of the Best Companies I've Ever Worked For,best compani ever work,0.12665675580501556,0.017010048031806946,0.8563331365585327,0.10964670777320862,neutral,0,0,0.0
Company culture has changed,2025-01-13,Great office views and fun people to work with,"Company culture has changed negatively, lots of budget cuts and management is not transparent","Prologis, Inc.",PLD,Industrial,2025-11-18,https://www.glassdoor.com/Reviews/Prologis-Reviews-E2631.htm,Great office views and fun people to work with,great offic view fun,"Company culture has changed negatively, lots of budget cuts and management is not transparent",cultur chang lot budget cut manag transpar,Company culture has changed,cultur chang,0.1591498851776123,0.01478435005992651,0.8260657787322998,0.14436553418636322,neutral,0,0,0.0
Great Place to Work,2025-07-16,"Very intentional about creating a culture of hardworking people that work well with others and fit the culture that has been created. There are a lot of opportunities for growth, as there are a lot of business units within our Industrial Real Estate business.","While Prologis industry leading and very intentional about diverse hiring while pursuing the most qualified individuals for the job, diversity is still low and is consistent with the industrial real estate industry.","Prologis, Inc.",PLD,Industrial,2025-11-18,https://www.glassdoor.com/Reviews/Prologis-Reviews-E2631.htm,"Very intentional about creating a culture of hardworking people that work well with others and fit the culture that has been created. There are a lot of opportunities for growth, as there are a lot of business units within our Industrial Real Estate business.",intent creat cultur hardwork well other fit cultur lot opportun lot busi unit within industri real estat,"While Prologis industry leading and very intentional about diverse hiring while pursuing the most qualified individuals for the job, diversity is still low and is consistent with the industrial real estate industry.",prolog industri lead intent divers hire pursu qualifi individu divers still low consist industri real estat,Great Place to Work,great place,0.10020094364881516,0.013158014044165611,0.8866410255432129,0.0870429277420044,neutral,0,0,0.0
Fun Real Estate Company,2024-09-11,Prologis takes care of its employees first and that goes a long way in so many ways.,You will worry on having a boring time at work because you won't have any.,"Prologis, Inc.",PLD,Industrial,2025-11-18,https://www.glassdoor.com/Reviews/Prologis-Reviews-E2631.htm,Prologis takes care of its employees first and that goes a long way in so many ways.,prolog take care employe first goe long way mani,You will worry on having a boring time at work because you won't have any.,worri bore,Fun Real Estate Company,fun real estat,0.07119708508253098,0.022957749664783478,0.9058451652526855,0.0482393354177475,neutral,0,0,0.0
Horrible Place to Work,2025-08-26,They promote people fast if you are a part of their clique. Good work life balance if they like you.,"I had the worst experience working here. I was blindsided with a poor performance review and given vague, unhelpful feedback that made no sense. My boss excluded me from meetings, spoke to me poorly, and held grudges whenever I made mistakes. Leadership encouraged me to “keep improving,” and offered to mentor me only to lay me off six months later. The VP was incompetent and openly said horrible things about her employees, while showing favoritism toward men in the office. Overall, leadership is a joke unprofessional, toxic, and completely lacking in accountability. I'm not sure how my boss thinks she is a good one. No diversity either and not accpeting of different kinds of people. I was told I don't fit in","Prologis, Inc.",PLD,Industrial,2025-11-18,https://www.glassdoor.com/Reviews/Prologis-Reviews-E2631.htm,They promote people fast if you are a part of their clique. Good work life balance if they like you.,promot fast part good life balanc,"I had the worst experience working here. I was blindsided with a poor performance review and given vague, unhelpful feedback that made no sense. My boss excluded me from meetings, spoke to me poorly, and held grudges whenever I made mistakes. Leadership encouraged me to “keep improving,” and offered to mentor me only to lay me off six months later. The VP was incompetent and openly said horrible things about her employees, while showing favoritism toward men in the office. Overall, leadership is a joke unprofessional, toxic, and completely lacking in accountability. I'm not sure how my boss thinks she is a good one. No diversity either and not accpeting of different kinds of people. I was told I don't fit in",worst experi blindsid poor perform given unhelp feedback made boss exclud spoke held grudg whenev made leadership encourag keep offer mentor lay six month vp incompet openli said horribl thing show favorit toward men leadership joke complet lack sure boss think good divers either accpet differ kind told fit,Horrible Place to Work,horribl place,0.07442789524793625,0.018795214593410492,0.9067768454551697,0.05563268065452576,neutral,0,0,0.0
Committed to excellence,2024-09-11,Strong commitment to walking the walk and being the best in class,Organizations can be a little silo'd with similar functions doing things differently,"Prologis, Inc.",PLD,Industrial,2025-11-18,https://www.glassdoor.com/Reviews/Prologis-Reviews-E2631.htm,Strong commitment to walking the walk and being the best in class,strong commit walk walk best class,Organizations can be a little silo'd with similar functions doing things differently,organ littl silo similar function thing differ,Committed to excellence,commit excel,0.192823588848114,0.017017444595694542,0.7901590466499329,0.17580614984035492,neutral,1,0,0.16666666666666666
Best Culture period. Purpose-Driven and People-First,2025-03-28,"Prologis has created a workplace that blends accountability with autonomy. The culture is hard to beat—fun, hardworking, down-to-earth, and rooted in doing the right thing. Everyone—from leadership to peers—genuinely cares about making a positive impact. We're encouraged to be ourselves, take smart risks, and support one another. It's fast-paced, but fun, and a shared sense of pride in leaving the world better than we found it. The global scope of the business adds exciting meaning to the work. You feel part of something much bigger than yourself, with real impact felt across communities.","Like any high-performing environment, things move quickly. Those who prefer a slower pace or a lot of handholding may find it challenging. You’ll thrive here if you’re self-motivated and collaborative.","Prologis, Inc.",PLD,Industrial,2025-11-18,https://www.glassdoor.com/Reviews/Prologis-Reviews-E2631.htm,"Prologis has created a workplace that blends accountability with autonomy. The culture is hard to beat—fun, hardworking, down-to-earth, and rooted in doing the right thing. Everyone—from leadership to peers—genuinely cares about making a positive impact. We're encouraged to be ourselves, take smart risks, and support one another. It's fast-paced, but fun, and a shared sense of pride in leaving the world better than we found it. The global scope of the business adds exciting meaning to the work. You feel part of something much bigger than yourself, with real impact felt across communities.",prolog creat workplac blend account cultur hard beat root right everyon leadership peer genuin care make posit encourag take smart support fast share sens pride leav world better found global scope busi add excit mean feel part someth much bigger real impact felt across,"Like any high-performing environment, things move quickly. Those who prefer a slower pace or a lot of handholding may find it challenging. You’ll thrive here if you’re self-motivated and collaborative.",high perform thing move prefer slower pace lot handhold may find thrive self motiv,Best Culture period. Purpose-Driven and People-First,best cultur purpos driven first,0.21992911398410797,0.014071950688958168,0.7659989595413208,0.20585715770721436,neutral,0,0,0.0
Great Employer!!,2024-10-09,The majority of people I’ve worked with are so knowledgeable and willing to collaborate. There’s always something new to learn and constant opportunities to develop my skillset.,Can be really fast paced. The business sometimes moves faster than accounting can adjust to their requests. Lack of communication between departments is a struggle.,"Prologis, Inc.",PLD,Industrial,2025-11-18,https://www.glassdoor.com/Reviews/Prologis-Reviews-E2631.htm,The majority of people I’ve worked with are so knowledgeable and willing to collaborate. There’s always something new to learn and constant opportunities to develop my skillset.,major work knowledg will alway someth new learn constant opportun develop,Can be really fast paced. The business sometimes moves faster than accounting can adjust to their requests. Lack of communication between departments is a struggle.,realli fast busi sometim move faster account adjust lack commun depart,Great Employer!!,great,0.31495440006256104,0.010868305340409279,0.6741772294044495,0.3040860891342163,neutral,0,0,0.0
Clique,2025-08-20,Good pay and nice offices,"people very cliquey, not kind","Prologis, Inc.",PLD,Industrial,2025-11-18,https://www.glassdoor.com/Reviews/Prologis-Reviews-E2631.htm,Good pay and nice offices,good pay nice offic,"people very cliquey, not kind",kind,Clique,cliqu,0.3332238793373108,0.09279511868953705,0.573980987071991,0.24042876064777374,neutral,0,0,0.0
Great stable company,2025-05-07,The stability of Prologis is one small piece of what makes this a great place to work.,"Very few cons, has great benefits.","Prologis, Inc.",PLD,Industrial,2025-11-18,https://www.glassdoor.com/Reviews/Prologis-Reviews-E2631.htm,The stability of Prologis is one small piece of what makes this a great place to work.,stabil prolog small piec make great place,"Very few cons, has great benefits.",great,Great stable company,great stabl,0.3851433992385864,0.00969315692782402,0.6051635146141052,0.3754502534866333,neutral,0,0,0.0
Nearly three years in,2024-09-11,- GREAT people - non-hierarchal mindset - interesting work - compensation / benefits - room to grow and move up,"Company is growing fast. Hope the inclusive, collaborative and supportive environment remains intact","Prologis, Inc.",PLD,Industrial,2025-11-18,https://www.glassdoor.com/Reviews/Prologis-Reviews-E2631.htm,- GREAT people - non-hierarchal mindset - interesting work - compensation / benefits - room to grow and move up,great non hierarch mindset interest compens benefit room grow move,"Company is growing fast. Hope the inclusive, collaborative and supportive environment remains intact",grow hope collabor support environ remain intact,Nearly three years in,nearli three year,0.7398978471755981,0.00897740013897419,0.2511247992515564,0.7309204339981079,positive,1,0,0.1
Industry Leader,2025-07-17,Great culture and innovative atmosphere,Understand your department wisely and career growth,"Prologis, Inc.",PLD,Industrial,2025-11-18,https://www.glassdoor.com/Reviews/Prologis-Reviews-E2631.htm,Great culture and innovative atmosphere,great cultur innov atmospher,Understand your department wisely and career growth,understand depart wise career growth,Industry Leader,industri leader,0.11310092359781265,0.01124562881886959,0.8756535053253174,0.10185529291629791,neutral,0,0,0.0
"Prologis is an innovative, rock solid place to work",2025-03-25,"We're constantly trying new things, pushing boundaries, learning new technologies, and looking for ways to automate. Additionally, the company is well positioned for the coming years. They also have a great working environment, nice people who are also highly intelligent, and excellent benefits.","The workload gets heavy at times. It's difficult to expand and grow teams at times, especially with local resources.","Prologis, Inc.",PLD,Industrial,2025-11-18,https://www.glassdoor.com/Reviews/Prologis-Reviews-E2631.htm,"We're constantly trying new things, pushing boundaries, learning new technologies, and looking for ways to automate. Additionally, the company is well positioned for the coming years. They also have a great working environment, nice people who are also highly intelligent, and excellent benefits.",constantli tri new push learn new look way well posit come great nice highli excel,"The workload gets heavy at times. It's difficult to expand and grow teams at times, especially with local resources.",workload get heavi difficult expand grow team especi local,"Prologis is an innovative, rock solid place to work",prolog rock solid place,0.17049042880535126,0.016940783709287643,0.8125688433647156,0.15354964137077332,neutral,0,0,0.0
"Great company for agile, hard-workers",2023-08-01,"Prologis is truly a world-class organization. The CEO and Founder, Hamid is a industry visionary, helping Prologis to become the global leader in industrial real estate. He leads with a confidence and thoughtfulness that inspires. On a more micro level, the individual support is excellent. The office community is friendly and helpful, with an excellent balance of hard work and fun. If you are a strong, hard-working person, you will succeed here. Folks who are not naturally driven would likely struggle.","Development work can be stressful, but that's an industry issue, not a company issue. The company is strongly focused on innovation. However, we tend to roll out initiatives before they're thoroughly tested. Instead of adopting feedback readily, it can be a painful process to provide feedback on a failed initiative during launch with leadership requesting that you ""prove your case"" instead of taking more formal note of feedback during early launch or testing. Too many of these processes add work without value and tasks to an already complicated workday.","Prologis, Inc.",PLD,Industrial,2025-11-18,https://www.glassdoor.com/Reviews/Prologis-Reviews-E2631.htm,"Prologis is truly a world-class organization. The CEO and Founder, Hamid is a industry visionary, helping Prologis to become the global leader in industrial real estate. He leads with a confidence and thoughtfulness that inspires. On a more micro level, the individual support is excellent. The office community is friendly and helpful, with an excellent balance of hard work and fun. If you are a strong, hard-working person, you will succeed here. Folks who are not naturally driven would likely struggle.",prolog truli world class ceo hamid industri help prolog becom global leader industri real lead confid thought micro individu support offic commun friendli excel balanc hard hard succeed folk natur driven like,"Development work can be stressful, but that's an industry issue, not a company issue. The company is strongly focused on innovation. However, we tend to roll out initiatives before they're thoroughly tested. Instead of adopting feedback readily, it can be a painful process to provide feedback on a failed initiative during launch with leadership requesting that you ""prove your case"" instead of taking more formal note of feedback during early launch or testing. Too many of these processes add work without value and tasks to an already complicated workday.",develop industri strongli focus tend roll initi thoroughli instead adopt feedback pain process provid feedback fail initi launch leadership request prove case instead take formal note feedback earli launch mani process add without valu task alreadi complic,"Great company for agile, hard-workers",great hard worker,0.16379128396511078,0.018254287540912628,0.8179544806480408,0.14553698897361755,neutral,0,0,0.0
Good company to work for,2025-01-12,Cares about employees well being and development,Little opportunity for upward mobility,"Prologis, Inc.",PLD,Industrial,2025-11-18,https://www.glassdoor.com/Reviews/Prologis-Reviews-E2631.htm,Cares about employees well being and development,care employe well develop,Little opportunity for upward mobility,littl opportun upward mobil,Good company to work for,good,0.3461100161075592,0.011664979159832,0.6422249674797058,0.3344450294971466,neutral,0,0,0.0
Walking the Walk with Culture and Values,2024-10-04,"- Incredibly kind, passionate people -Commitment and action related to ESG, as well as diversity, equity, inclusion and belonging - Focus on embracing change and doing things differently","- Leaders don't effectively model a healthy work-life balance - Health insurance options are surprisingly very limited given company size - The company lives by innovation, but at times decisions feel more influenced by leaders' personal preferences","Prologis, Inc.",PLD,Industrial,2025-11-18,https://www.glassdoor.com/Reviews/Prologis-Reviews-E2631.htm,"- Incredibly kind, passionate people -Commitment and action related to ESG, as well as diversity, equity, inclusion and belonging - Focus on embracing change and doing things differently",incred passion commit action relat well inclus belong focu embrac chang thing differ,"- Leaders don't effectively model a healthy work-life balance - Health insurance options are surprisingly very limited given company size - The company lives by innovation, but at times decisions feel more influenced by leaders' personal preferences",leader effect model healthi life balanc health insur option surprisingli limit given size live time decis feel influenc leader person prefer,Walking the Walk with Culture and Values,walk walk cultur valu,0.1689470261335373,0.015765130519866943,0.8152878284454346,0.15318189561367035,neutral,0,0,0.0
10/10 company to work for,2025-09-18,"Company culture, career advancement/upward mobility, seamless cross team communication, trust instilled in employees","None come to mind, truly a great place to work!","Prologis, Inc.",PLD,Industrial,2025-11-18,https://www.glassdoor.com/Reviews/Prologis-Reviews-E2631.htm,"Company culture, career advancement/upward mobility, seamless cross team communication, trust instilled in employees",career advanc upward seamless cross team trust instil employe,"None come to mind, truly a great place to work!",none come truli great place,10/10 company to work for,,0.06908513605594635,0.01332805585116148,0.9175868034362793,0.055757079273462296,neutral,0,0,0.0
"Great culture, teams run lean, growth opportunities limited",2025-11-06,Great culture - collaborative and generally good people Team runs lean so you get do own more but means hard work and long hours (potentially),"Growth opportunities limited, some managers need work","Prologis, Inc.",PLD,Industrial,2025-11-18,https://www.glassdoor.com/Reviews/Prologis-Reviews-E2631.htm,Great culture - collaborative and generally good people Team runs lean so you get do own more but means hard work and long hours (potentially),great cultur collabor gener good team run lean mean hard long hour potenti,"Growth opportunities limited, some managers need work",growth opportun manag need,"Great culture, teams run lean, growth opportunities limited",great team run growth opportun limit,0.4098680913448334,0.015145843848586082,0.5749860405921936,0.39472225308418274,neutral,0,0,0.0
"Great place to work, awesome culture, and innovative company",2024-09-04,"Prologis is a great place to work and leader in the industry. Our leadership team drives a thriving, focused culture to perform and meet / exceed market expectations","As with any company, remote and spread out working makes community harder but Prologis seeks to pull together virtually as best possible with initiatives like our IMPACT days.","Prologis, Inc.",PLD,Industrial,2025-11-18,https://www.glassdoor.com/Reviews/Prologis-Reviews-E2631.htm,"Prologis is a great place to work and leader in the industry. Our leadership team drives a thriving, focused culture to perform and meet / exceed market expectations",prolog great place leader leadership team drive focus cultur perform meet exceed market expect,"As with any company, remote and spread out working makes community harder but Prologis seeks to pull together virtually as best possible with initiatives like our IMPACT days.",remot spread make commun harder prolog seek pull togeth virtual best possibl initi impact,"Great place to work, awesome culture, and innovative company",great place awesom innov,0.18087220191955566,0.011800027452409267,0.8073278069496155,0.16907218098640442,neutral,0,0,0.0
Takes great care of employees,2024-09-05,"Lots of perks including great benefits, team building events, culture, etc","Since it is a global company, policies sometimes seem politically driven","Prologis, Inc.",PLD,Industrial,2025-11-18,https://www.glassdoor.com/Reviews/Prologis-Reviews-E2631.htm,"Lots of perks including great benefits, team building events, culture, etc",lot perk includ great team build etc,"Since it is a global company, policies sometimes seem politically driven",sinc global polici sometim seem polit driven,Takes great care of employees,take great care employe,0.8010784387588501,0.01219638530164957,0.1867251992225647,0.7888820767402649,positive,0,0,0.0
Excellent Company,2024-09-12,"Prologis provides employees with resources and trust to succeed. The people at Prologis are intelligent, approachable, and professional. Everyone cares about doing the right thing and has a competitive spirit for success.",The performance rating scale can be difficult to understand.,"Prologis, Inc.",PLD,Industrial,2025-11-18,https://www.glassdoor.com/Reviews/Prologis-Reviews-E2631.htm,"Prologis provides employees with resources and trust to succeed. The people at Prologis are intelligent, approachable, and professional. Everyone cares about doing the right thing and has a competitive spirit for success.",prolog provid employe resourc trust prolog everyon care right thing competit spirit,The performance rating scale can be difficult to understand.,perform scale difficult,Excellent Company,excel,0.07857097685337067,0.014402595348656178,0.9070263504981995,0.06416837871074677,neutral,0,0,0.0
