title,rating,date,pros,cons,company,ticker,property_type,scrape_date,glassdoor_url
Great,5.0,"Aug 1, 2025","Great coworkers, approachable upper management, plenty of social events.",Can't think of any negatives.,"American Healthcare REIT, Inc.",AHR,Health Care,2025-11-20,https://www.glassdoor.com/Reviews/American-Healthcare-REIT-Reviews-E7171082.htm
An Amazing Place to Work — Where Integrity Comes First,5.0,"May 8, 2025","American Healthcare REIT is truly an amazing place to work. The C-suite leadership team is approachable, genuinely interested in each employee, and consistently makes decisions rooted in integrity. They emphasize doing the right thing and ensuring our operating partners have the tools they need to prioritize resident care. A standout example is the EVP of Asset Management—my direct leader—who embodies these principles and has done so consistently throughout his 30+ year career. His leadership style reflects the company's broader culture: a balance of high expectations and accountability with kindness, support, and authenticity. I’ve been with the company for just over a year, and I can confidently say these values are not just aspirational—they are put into action every day. The positive culture at AHR is evident across every service line and flows directly from the top down. Leaders recognize individual employee strengths and make a concerted effort to set people up for success, both personally and professionally. It’s important to me to work for leaders who not only speak about principles and values but also stand firmly behind them. I can say with full conviction that American Healthcare REIT lives up to what it promises.","While no company is without its challenges, I have yet to encounter any significant shortcomings at AHR. The culture here is so strong and positive that it far outweighs any minor issues that may arise.","American Healthcare REIT, Inc.",AHR,Health Care,2025-11-20,https://www.glassdoor.com/Reviews/American-Healthcare-REIT-Reviews-E7171082.htm
Cultural is Great,4.0,"Sep 9, 2024",Cultural is Great & Supportive,"Not a Stable Job, Salary is low","American Healthcare REIT, Inc.",AHR,Health Care,2025-11-20,https://www.glassdoor.com/Reviews/American-Healthcare-REIT-Reviews-E7171082.htm
Stable Company with Friendly Employees,4.0,"Apr 15, 2024",Lots of opportunities to interact with colleagues. Opportunity for professional development. Stable work environment.,Some areas could have been improved by focusing on new approaches to business conditions and updated strategies.,"American Healthcare REIT, Inc.",AHR,Health Care,2025-11-20,https://www.glassdoor.com/Reviews/American-Healthcare-REIT-Reviews-E7171082.htm
Great Cultural,5.0,"Jul 12, 2023","Great cultural, good training, benefits",There’s a lot of stress during closing,"American Healthcare REIT, Inc.",AHR,Health Care,2025-11-20,https://www.glassdoor.com/Reviews/American-Healthcare-REIT-Reviews-E7171082.htm
Great company,5.0,"Apr 20, 2022","Inclusive, Good performance is rewarded",Mostly people are only in 2 days a week,"American Healthcare REIT, Inc.",AHR,Health Care,2025-11-20,https://www.glassdoor.com/Reviews/American-Healthcare-REIT-Reviews-E7171082.htm
AHR Review,4.0,"Dec 30, 2022",Company has very good culture,Company sometimes does not pay market rates,"American Healthcare REIT, Inc.",AHR,Health Care,2025-11-20,https://www.glassdoor.com/Reviews/American-Healthcare-REIT-Reviews-E7171082.htm
It is great working here,5.0,"Oct 27, 2025",The leadership group is well organized. It is worth to learn and growing here.,I have not found any cons so far.,Welltower Inc.,WELL,Health Care,2025-11-20,https://www.glassdoor.com/Reviews/Welltower-Reviews-E1166198.htm
Not Worth It,1.0,"Oct 30, 2025",Good Work Life Balance Most are friendly,"They don't know what they are doing. They worry about keeping things private even amongst employee They have restrictive practices in Technology, which even hinders one's work and many have said they don't have access to basic things required for their daily work. So, people have started cutting corners in how they work and what they do. Not much time before this starts becoming visible in their earnings too.",Welltower Inc.,WELL,Health Care,2025-11-20,https://www.glassdoor.com/Reviews/Welltower-Reviews-E1166198.htm
Work life balance,2.0,"Oct 18, 2025",A company with high growth potential and chance for development,Long hours often resulting in working weekends. Low work/life balance.,Welltower Inc.,WELL,Health Care,2025-11-20,https://www.glassdoor.com/Reviews/Welltower-Reviews-E1166198.htm
Toxic Environment and Limited Career Advancement,2.0,"Mar 10, 2025","The company offers a solid benefits package that promotes a healthy work-life balance. Leadership within my department and across the company values grit and initiative, recognizing those who go above and beyond. Executives are committed to the long-term success of the company and focus on sustainable growth. However, opportunities to collaborate with others are limited, and while there is a strong sense of inclusivity when discussing the company’s future, the lack of clear advancement paths and middle management improvements hinder the overall culture.","Unfortunately, I experienced second-class treatment under my manager. Despite my hard work, I was often sidelined with fewer opportunities for advancement and recognition compared to those in favor with management. The culture encouraged snitching, which, combined with favoritism, fostered a toxic work environment. Those who aligned with management were rewarded, leaving others feeling unsupported. The uneven workload, lack of transparency, and poor communication created an atmosphere of disrespect and disillusionment, making me feel undervalued and isolated.",Welltower Inc.,WELL,Health Care,2025-11-20,https://www.glassdoor.com/Reviews/Welltower-Reviews-E1166198.htm
Pros and Cons,5.0,"Jul 16, 2025","1. Excellent benefits & perks Employees consistently praise Welltower’s comprehensive benefits, including health coverage, PTO, wellness programs, and even pet benefits. 2. Smart, challenging environment Many highlight the opportunity to work alongside intelligent, driven colleagues on high-impact projects that offer visibility and growth indeed. 3. Strong organizational reputation As an S&P 500 healthcare-REIT with investment-grade credit ratings (BBB+, Baa1), Welltower offers stability, access to large-scale capital projects, and a respected position in the market Welltower Inc. 4. Development opportunities Interns report structured learning, mentorship, and weekly training sessions helpful for early career development.","1. Management inconsistency Reviews indicate variability in leadership quality across teams and regions. Complaints include limited transparency, favoritism, and micromanagement . 2. High workload and pace Welltower’s fast-paced, demanding culture can lead to long hours, stress, and work-life balance challenges—often with little recognition",Welltower Inc.,WELL,Health Care,2025-11-20,https://www.glassdoor.com/Reviews/Welltower-Reviews-E1166198.htm
"Yardi is an Innovative product, Welltower is a strategic organization",5.0,"May 16, 2025","1. Welltower's culture is to support its employees 2. Leadership values it's culture and works with employees to ensure there is job satisfaction and retention across the teams 3. Career opportunities are strong with designated pathways to grow 4. The Yardi product being deployed for properties is a huge game changer for front end and back end property operations 5. Welltower's approach to property management through leveraging this product is 6. Welltower provides sufficient information in the job requirements, the goals to be met in the position, and the autonomy to have your work style to reach them. 7. Diversity is valued here","Not applicable, currently the company is in a state of growth. No cons, the opportunity to develop would be challenging for each department, but growth isn't a bad thing.",Welltower Inc.,WELL,Health Care,2025-11-20,https://www.glassdoor.com/Reviews/Welltower-Reviews-E1166198.htm
Great Company,5.0,"Jul 9, 2025",The company has great benefits with an amazing team. Everyone is supportive and really want to see you succeed.,I do not have any cons.,Welltower Inc.,WELL,Health Care,2025-11-20,https://www.glassdoor.com/Reviews/Welltower-Reviews-E1166198.htm
Strong company and culture,4.0,"Jul 8, 2025",- Very strong performing culture - Ability to take on new tasks/initiatives - Very smart CEO and management team,- Very top down management - Can be heavy hours during busy periods,Welltower Inc.,WELL,Health Care,2025-11-20,https://www.glassdoor.com/Reviews/Welltower-Reviews-E1166198.htm
Great Company,5.0,"Jun 27, 2025",Pay is great; people are great,"They treat their employees good and expect them to work hard, which seems fair to me.",Welltower Inc.,WELL,Health Care,2025-11-20,https://www.glassdoor.com/Reviews/Welltower-Reviews-E1166198.htm
Good Company and care about employees,5.0,"Jun 3, 2025","Growing, opportunities, kind people, fun work product","Disorganized, care about the bottom line a lot, not as detailed",Welltower Inc.,WELL,Health Care,2025-11-20,https://www.glassdoor.com/Reviews/Welltower-Reviews-E1166198.htm
Great,5.0,"Jun 10, 2025",Great place to work with friendly people,"There are no offices or separate cubicles, it is an open environment",Welltower Inc.,WELL,Health Care,2025-11-20,https://www.glassdoor.com/Reviews/Welltower-Reviews-E1166198.htm
Good Company,5.0,"Jun 3, 2025",Better than avg pay Healthcare Giant - Great Reputation Very Flexible depending on direct supervisor,New processes needed Sometimes need long hour,Welltower Inc.,WELL,Health Care,2025-11-20,https://www.glassdoor.com/Reviews/Welltower-Reviews-E1166198.htm
Welltower,3.0,"May 14, 2025",Great benefits and bonus percentage is great overall.,Alot of traveling. Long hours process changes.,Welltower Inc.,WELL,Health Care,2025-11-20,https://www.glassdoor.com/Reviews/Welltower-Reviews-E1166198.htm
Visionaries,5.0,"Apr 22, 2025",Fast paced Remarkable professionals High standards Supportive teams Growth opportunities,Multiple reporting platforms Communication LOB silos,Welltower Inc.,WELL,Health Care,2025-11-20,https://www.glassdoor.com/Reviews/Welltower-Reviews-E1166198.htm
Pass,1.0,"Apr 21, 2025",- freedom to pursue any opportunity with little to no oversight,- toxic flat organization that does not allow for material advancement,Welltower Inc.,WELL,Health Care,2025-11-20,https://www.glassdoor.com/Reviews/Welltower-Reviews-E1166198.htm
Great Company,5.0,"Feb 6, 2025",Great working environment Great teams overall Incredible benefits Fast growing company,Growing pains due to fast growth Lack of individual development Lack of promotional ability,Welltower Inc.,WELL,Health Care,2025-11-20,https://www.glassdoor.com/Reviews/Welltower-Reviews-E1166198.htm
Toxic Office & Environment,1.0,"Dec 18, 2024",The direct deposit is decent. Employee stock purchase plan,Bad manager Bad higher level leadership Yells at employees References rude & inappropriate things during work In office environment is terrible severance type environment,Welltower Inc.,WELL,Health Care,2025-11-20,https://www.glassdoor.com/Reviews/Welltower-Reviews-E1166198.htm
Organization of dysfunction and toxcicity,1.0,"Sep 13, 2024",Decent healthcare plan Employee Stock plan,"Working in this organization was a deeply disappointing experience, marred by a complete lack of rationality and logical thinking within the decision-making process. The workplace culture is characterized by an alarming tendency to ignore expertise and embrace reactionary decision-making, leaving employees feeling undervalued and unsupported. One of the most glaring issues is the blatant disregard for the valuable insights provided by department managers. Some senior leaders consistently sideline their expertise, opting instead to heed decisions made by a select group of individuals who lack any relevant experience in the areas they are making decisions. This approach not only undermines the expertise of dedicated professionals but also leads to misguided choices that harm the organization in the long run. Promotions and significant raises, crucial aspects of career growth, are only awarded in select departments, and are not necessarily based on merit or skills, but on the basis of cronyism and favoritism. This nepotistic approach not only demoralizes employees who work hard and demonstrate exceptional skills but also fosters a toxic work environment where office politics reign supreme. Genuine talent is systematically ignored, leaving employees feeling insignificant and undervalued. Another alarming aspect of the workplace environment is the tendency to make sweeping cuts without fully understanding the ramifications. Impulsive cost-cutting measures are implemented without a comprehensive analysis, leading to decreased employee morale, increased workload, and overall dissatisfaction. These decisions have a domino effect on productivity and employee well-being, ultimately affecting the organization's overall performance. In conclusion, this workplace is a prime example of an organization where rationality, logic, and fair decision-making are sacrificed at the altar of favoritism, cronyism, and short-sightedness. Many employees are left disheartened and demoralized, leading to a toxic work environment that stifles creativity, innovation, and genuine professional growth.",Welltower Inc.,WELL,Health Care,2025-11-20,https://www.glassdoor.com/Reviews/Welltower-Reviews-E1166198.htm
Healthcare Reit,3.0,"Oct 29, 2024",wfh life balance if far enough away from building,It’s a pretty chaotic there.,Welltower Inc.,WELL,Health Care,2025-11-20,https://www.glassdoor.com/Reviews/Welltower-Reviews-E1166198.htm
Great Colleagues/Intense Workload,3.0,"Oct 10, 2024","Great benefits
Lots of vacation
Remote work","Shared assistants
Run lean on hiring creating frequent burnout",Welltower Inc.,WELL,Health Care,2025-11-20,https://www.glassdoor.com/Reviews/Welltower-Reviews-E1166198.htm
Review for welltower,4.0,"Sep 27, 2024","Good benefit, insurance options, and bonus","Lack of transparency, experience varies based on which team you are in",Welltower Inc.,WELL,Health Care,2025-11-20,https://www.glassdoor.com/Reviews/Welltower-Reviews-E1166198.htm
Good,5.0,"Sep 2, 2024",Flexible working enviornment with good managers,Corporate Jargon can disorient business direction,Welltower Inc.,WELL,Health Care,2025-11-20,https://www.glassdoor.com/Reviews/Welltower-Reviews-E1166198.htm
Great Company To Work For,5.0,"Jul 15, 2024",Great benefits and the people are nice.,None to list at this time.,Welltower Inc.,WELL,Health Care,2025-11-20,https://www.glassdoor.com/Reviews/Welltower-Reviews-E1166198.htm
Decent place to work,3.0,"Jun 24, 2024","They offered great benefits, the opportunity to travel, the facility was nice with a gym and cafe.",Management changes over the years affected the culture quite a bit.,Welltower Inc.,WELL,Health Care,2025-11-20,https://www.glassdoor.com/Reviews/Welltower-Reviews-E1166198.htm
The paycheck shows up on time,3.0,"Apr 25, 2024",I have a very supportive manager.,"Accounting team is much too small. As a result, property management takes on a lot of reviewing for Accounting. Also too much unnecessary middle management and inefficient communication processes.",Welltower Inc.,WELL,Health Care,2025-11-20,https://www.glassdoor.com/Reviews/Welltower-Reviews-E1166198.htm
Great company,5.0,"Jul 8, 2024",Great environment to learn and grow your career,can be intense at times,Welltower Inc.,WELL,Health Care,2025-11-20,https://www.glassdoor.com/Reviews/Welltower-Reviews-E1166198.htm
Average Company,3.0,"Jun 27, 2024",Flexible work schedule & good pay,"There is a good ole boys mentality, not very professional",Welltower Inc.,WELL,Health Care,2025-11-20,https://www.glassdoor.com/Reviews/Welltower-Reviews-E1166198.htm
Not what I expected,3.0,"Apr 27, 2023","Flexible, great benefits, great bonus.","Not enough communication from leadership. I have been in companies during transitions and by far the transition within this company has been far from smooth. Corporate pushing out new systems and programs prior to it being fully ready then retracting, and pushing out again to find more issues and so forth. Always being told to check P&P, however, No clear procedures even on website where employees are to go and find Policies & Procedures and a lot information is outdated. This makes it more challenging for newcomers. Be ready to do plenty of self research and more research to find answers. Lack of communication between departments. Very clique and favoritism is noticed. Negative comments about other co workers and past co workers from managers frequently. Certain departments get more leeway on deadlines while other are expected to always meet it. Almost no work/life balance. More cons, but these are the more significant ones.",Welltower Inc.,WELL,Health Care,2025-11-20,https://www.glassdoor.com/Reviews/Welltower-Reviews-E1166198.htm
Great Company,4.0,"Jan 16, 2024","Benefits, Pay, welcoming environment, diverse culture. Everyone I’ve ever encountered was pleasant and willing to help if needed.",The customer service dept is not work from home but the other employees are hybrid.,Welltower Inc.,WELL,Health Care,2025-11-20,https://www.glassdoor.com/Reviews/Welltower-Reviews-E1166198.htm
Great place to work,5.0,"Dec 7, 2023",Great Company to work for if you want to grow your career and learn,"It can be fast paced at times, which can be overwhelming to some",Welltower Inc.,WELL,Health Care,2025-11-20,https://www.glassdoor.com/Reviews/Welltower-Reviews-E1166198.htm
Great place to work,5.0,"Nov 21, 2023","Flexibility 
Transparency 
Variety of work
The people",Promotion process is not straightforward,Welltower Inc.,WELL,Health Care,2025-11-20,https://www.glassdoor.com/Reviews/Welltower-Reviews-E1166198.htm
Not as good as it used to be,3.0,"Mar 1, 2023","Great benefits such as generous PTO including time for senior care, 14 paid holidays, 5% 401K matching, excellent health insurance at low premiums, annual bonuses, employee stock purchase program, health incentive programs including gym cost reimbursement, great coworkers and managers.","Increased top down control on local processes, less connection and contact with tenants than we used to have, more bureaucracy, poorer organization and training. They are re-tooling the whole company to be more robotic, centralized and jerking around long term, loyal employees the whole way. Company culture is moving toward a more wokist-progressive mindset and they jump on every corporate bandwagon out there right now. Wage increases are not keeping pace with workload increases.",Welltower Inc.,WELL,Health Care,2025-11-20,https://www.glassdoor.com/Reviews/Welltower-Reviews-E1166198.htm
Fantastic workplace,5.0,"Aug 24, 2023",- good culture that emphasizes employee well-being and development - top institutional investment firm that provides cool insights into RE,- can sometimes be a little slow or boring - Pay could be better,Welltower Inc.,WELL,Health Care,2025-11-20,https://www.glassdoor.com/Reviews/Welltower-Reviews-E1166198.htm
Horrible work experience,1.0,"Oct 24, 2023",none. no pros horrible work environment,Everything! Benefits are so expensive. The management is toxic. Mico managers. Pay is crap. DONT WORK HERE,Welltower Inc.,WELL,Health Care,2025-11-20,https://www.glassdoor.com/Reviews/Welltower-Reviews-E1166198.htm
Tax Intern in Toledo,4.0,"Jul 19, 2023","It's pretty easy going for an intern, but the work runs out quickly.","In the tax department, a lot of your coworkers will not introduce themselves to you. Talking doesn't seem to be a thing.",Welltower Inc.,WELL,Health Care,2025-11-20,https://www.glassdoor.com/Reviews/Welltower-Reviews-E1166198.htm
"Dark cloud overhead, bad culture",2.0,"Jun 14, 2023",Benefits Pay People (not leaders) 401K Stock purchase,Culture CEO Lack of trust Not enough help No work life balance,Welltower Inc.,WELL,Health Care,2025-11-20,https://www.glassdoor.com/Reviews/Welltower-Reviews-E1166198.htm
"Karma - Enjoy NY, Tom.",1.0,"Sep 29, 2017",Unfortunately at this time the company has absolutely nothing going for it. On the outside it can look and feel glamorous but it's the complete opposite.,"Day one Tom DeRosa came into the company telling everyone how down to earth he was, that he was an employee advocate and so much more. Nothing could be farther from the truth. Tom has been anti-Toledo since day one. The University of Toledo was never good enough to hire graduates or interns from. All new employees should live in Ann Arbor because Toledo wasn't good enough for people of his caliber. As a proud graduate of the University of Toledo that was all so disappointing. Tom has finally gotten his way. He looks like the hero donating the building and property to the University of Toledo but in reality it was only done to get his way and that is out of Toledo. Management continued to lie to employees that the building they were constructing in NY was not meant for a new headquarters. While it may not be the headquarters now, Tom will be working out of that office. Mark my word, eventually the headquarters will be in NY and the hardworking employees that have held it out during the chaotic and stressful times will no longer have a job. To the current employees, don't be afraid to move on. While people say the grass isn't always greener on the other side, I can promise you that this time it will be.",Welltower Inc.,WELL,Health Care,2025-11-20,https://www.glassdoor.com/Reviews/Welltower-Reviews-E1166198.htm
Epic Fail,1.0,"Sep 27, 2017",It pays the bills. The corporate HQ was nice when Welltower owned it. The temperature in the building isn't too bad.,"This organization went from stellar to rock bottom in 12 months. Without ever addressing its new ""course of action"" with its employees, Welltower did a complete 180 and terminated about 30% of its workforce. It became a completely strange and confusing environment. Sadly, many important tasks aren't being completed due to the lack of staff. Current management is so focused on cutting compensation that they're not addressing the real struggles within the organization. Recently, Welltower donated its 100 acre Dorr Street (Toledo) campus to The University of Toledo. Nice save. The perfect opportunity to contradict all of the negative reviews that claim that the CEO doesn't live in Toledo nor does he care about the community. That job is done. This left the Toledo (Corporate HQ) based employees wondering what this means for their future in the company. Why would a real estate company give away a $30M piece of real estate if they plan to grow their HQ in Toledo? They don't. It's a slow kill, and it seems like this company is phasing its way out of the Toledo community. This will leave so many good, hard-working employees devastated. As for Welltower's claims that they are in the utmost compliance with regard to employee ethics, managers were instructed to grant nothing higher than a 3 rating on their reports' annual performance reviews. That means that Welltower has no intention of paying their employees based on performance. It's just a lure. What is ironic, is that Welltower only has a 2.6 rating on Glass Door. That's karma for you.",Welltower Inc.,WELL,Health Care,2025-11-20,https://www.glassdoor.com/Reviews/Welltower-Reviews-E1166198.htm
Great Company - Great Benefits,5.0,"Jun 9, 2023",- People are great to work wit,- Transparency of short term incentives to reach long term goals,Welltower Inc.,WELL,Health Care,2025-11-20,https://www.glassdoor.com/Reviews/Welltower-Reviews-E1166198.htm
Life at welltower,4.0,"Apr 3, 2023",The work freedom is amazing. No over bearing boss breathing down your back.,No room for mistakes and too serious.,Welltower Inc.,WELL,Health Care,2025-11-20,https://www.glassdoor.com/Reviews/Welltower-Reviews-E1166198.htm
Great place,5.0,"Mar 29, 2023","Honestly it's incredible. Cafeteria, super cool company, great people",Sometimes feels a bit lost and the organization is a bit top heavy.,Welltower Inc.,WELL,Health Care,2025-11-20,https://www.glassdoor.com/Reviews/Welltower-Reviews-E1166198.htm
Great company,5.0,"Apr 10, 2023",Treat employees well and rewarding.,Big learning curve for a complex business model.,Welltower Inc.,WELL,Health Care,2025-11-20,https://www.glassdoor.com/Reviews/Welltower-Reviews-E1166198.htm
