title,rating,date,pros,cons,company,ticker,property_type,scrape_date,glassdoor_url
Super place to learn medical billing,3.0,"Aug 8, 2022",Learning will be good and easy to get indepth knowledge if medical billing,No carrier growth and less growth,"Omega Healthcare Investors, Inc.",OHI,Health Care,2025-11-20,https://www.glassdoor.com/Reviews/Omega-Healthcare-Reviews-E326877.htm
Good place to start (FRESHERS) ... Place to get more than 30% hike (EXPERIENCED),4.0,"Feb 9, 2015","Good moral support from higher official. Good environment. Professionalism. Best support to employees from HR, Admin team.",Having excess manpower. Regular surveillance on employee.,"Omega Healthcare Investors, Inc.",OHI,Health Care,2025-11-20,https://www.glassdoor.com/Reviews/Omega-Healthcare-Reviews-E326877.htm
Great company for fresher,3.0,"Jul 5, 2015","Training , IJP,......etc.. They will kick you out if u fail in training,.",No cons so far i saw in tat company... failed in training they will kick you out.,"Omega Healthcare Investors, Inc.",OHI,Health Care,2025-11-20,https://www.glassdoor.com/Reviews/Omega-Healthcare-Reviews-E326877.htm
Good Corporate Experience.,5.0,"Mar 28, 2016",Good work Environment Good pay for best talent Good place to implement ideas,cons it dependents upon individual mind set,"Omega Healthcare Investors, Inc.",OHI,Health Care,2025-11-20,https://www.glassdoor.com/Reviews/Omega-Healthcare-Reviews-E326877.htm
Good Company to work,5.0,"Oct 21, 2018",Good place to get hands on experience. You can get the opportunity to explore all the aspect of facility & Infrastructure management.,Nothing as such to write to explain.,"Omega Healthcare Investors, Inc.",OHI,Health Care,2025-11-20,https://www.glassdoor.com/Reviews/Omega-Healthcare-Reviews-E326877.htm
knowledge,3.0,"May 29, 2020","knowledge can be gained here , u will be taught better","low salary for freshers, carrer growth may b there","Omega Healthcare Investors, Inc.",OHI,Health Care,2025-11-20,https://www.glassdoor.com/Reviews/Omega-Healthcare-Reviews-E326877.htm
Ok ok,3.0,"Mar 15, 2021",On time salary given to employees,Work pressure is more.we have to forgot personal life,"Omega Healthcare Investors, Inc.",OHI,Health Care,2025-11-20,https://www.glassdoor.com/Reviews/Omega-Healthcare-Reviews-E326877.htm
Good,3.0,"Aug 30, 2016",As a start up company it is perfect. Two days selection process is there. Fist written aptitude reasoning and APHE.,Everything is good. management could be more strict.,"Omega Healthcare Investors, Inc.",OHI,Health Care,2025-11-20,https://www.glassdoor.com/Reviews/Omega-Healthcare-Reviews-E326877.htm
Overall good place to work,5.0,"Jan 23, 2019","Can learn many new things , Early growth",Benefits is not upto the mark,"Omega Healthcare Investors, Inc.",OHI,Health Care,2025-11-20,https://www.glassdoor.com/Reviews/Omega-Healthcare-Reviews-E326877.htm
Good growth road map on software development,5.0,"Mar 9, 2019","Multiple Technology opportunities on .Net, JAVA and Python development",Not much Opportunities for freshers in software development,"Omega Healthcare Investors, Inc.",OHI,Health Care,2025-11-20,https://www.glassdoor.com/Reviews/Omega-Healthcare-Reviews-E326877.htm
Fast-Paced Growth but ineffective BCP,3.0,"Mar 10, 2022",Employees can get promoted as early as 3 months Good environment depending on the program Free Shuttle and Food,"Confusing BCP, Minimal Leadership Training","Omega Healthcare Investors, Inc.",OHI,Health Care,2025-11-20,https://www.glassdoor.com/Reviews/Omega-Healthcare-Reviews-E326877.htm
I'm happy working with omega. Have seen lot of promotions and gained lot of knowledge.,4.0,"Nov 22, 2022",Culture and freedom. Good training,Work space and salary. Management,"Omega Healthcare Investors, Inc.",OHI,Health Care,2025-11-20,https://www.glassdoor.com/Reviews/Omega-Healthcare-Reviews-E326877.htm
HIGHLY EDUCATIVE,5.0,"Mar 22, 2013",Top level Management is very kind and humane,Junior level Managers need to improve upon,"Omega Healthcare Investors, Inc.",OHI,Health Care,2025-11-20,https://www.glassdoor.com/Reviews/Omega-Healthcare-Reviews-E326877.htm
Quality Control Analyst,3.0,"Jun 12, 2015",Job location and Internal job postings,"Management, Admin facilities and Salary","Omega Healthcare Investors, Inc.",OHI,Health Care,2025-11-20,https://www.glassdoor.com/Reviews/Omega-Healthcare-Reviews-E326877.htm
career at omega,4.0,"Apr 6, 2017",place to learn lots of knowledge. people are very helpul and kind. trainer and leads are very friendly,nothing to share yet. may be in future.,"Omega Healthcare Investors, Inc.",OHI,Health Care,2025-11-20,https://www.glassdoor.com/Reviews/Omega-Healthcare-Reviews-E326877.htm
Medical coding,4.0,"May 27, 2017","This job is relivent to my education, I am interested in this field.",Medical coding & billings is the best of me & very suitable to my career,"Omega Healthcare Investors, Inc.",OHI,Health Care,2025-11-20,https://www.glassdoor.com/Reviews/Omega-Healthcare-Reviews-E326877.htm
for fresher its a good company to start up.,3.0,"Oct 7, 2019","People are nice in omega, you will get salary on time.",salary is very less and no growth.,"Omega Healthcare Investors, Inc.",OHI,Health Care,2025-11-20,https://www.glassdoor.com/Reviews/Omega-Healthcare-Reviews-E326877.htm
Good company to work with,4.0,"Nov 7, 2020","Good envinorment, nice people to work Work culture is nice good company for freshers to start their careers",Have to work irregular hours due to work load sometimes,"Omega Healthcare Investors, Inc.",OHI,Health Care,2025-11-20,https://www.glassdoor.com/Reviews/Omega-Healthcare-Reviews-E326877.htm
Good company,3.0,"Jun 9, 2021",Currently working as Quality analyst,Looking for more growth and explore more,"Omega Healthcare Investors, Inc.",OHI,Health Care,2025-11-20,https://www.glassdoor.com/Reviews/Omega-Healthcare-Reviews-E326877.htm
Helps You Grow,5.0,"Nov 8, 2021",Very friendly work culture and can balance work life and personal life. Management helps you grown in what you good at.,nothing really that i can think off.,"Omega Healthcare Investors, Inc.",OHI,Health Care,2025-11-20,https://www.glassdoor.com/Reviews/Omega-Healthcare-Reviews-E326877.htm
Good To Start My Carrer,4.0,"Jan 16, 2022","As a fresher , it is Good Environment To Learn And Update Our Skills , with low Work Pressure",There is No Downside in Working in Omega,"Omega Healthcare Investors, Inc.",OHI,Health Care,2025-11-20,https://www.glassdoor.com/Reviews/Omega-Healthcare-Reviews-E326877.htm
Ar associate,5.0,"May 25, 2022",Very confident and good communication skills Can handle critical situation and have good conveniening skills,None i learnt from my mistakes and i keep learning from my mistakes.,"Omega Healthcare Investors, Inc.",OHI,Health Care,2025-11-20,https://www.glassdoor.com/Reviews/Omega-Healthcare-Reviews-E326877.htm
I want to join as a medical coder in our company,5.0,"Sep 25, 2022",I want to work with our company.. one of the best for freshers,one of the best company.,"Omega Healthcare Investors, Inc.",OHI,Health Care,2025-11-20,https://www.glassdoor.com/Reviews/Omega-Healthcare-Reviews-E326877.htm
Good,4.0,"Nov 1, 2022",Good to enhance your learnings,"Company is doing a lot of things, but it's reach to its employees need to be monitored","Omega Healthcare Investors, Inc.",OHI,Health Care,2025-11-20,https://www.glassdoor.com/Reviews/Omega-Healthcare-Reviews-E326877.htm
omega healthcare,3.0,"Dec 29, 2015",Work timing is good. Provides othe facilities.,"Less salary, too much work load, very high target.","Omega Healthcare Investors, Inc.",OHI,Health Care,2025-11-20,https://www.glassdoor.com/Reviews/Omega-Healthcare-Reviews-E326877.htm
Omega Health care,5.0,"Dec 31, 2016",Good company for freshers to start there carrier .,The training given in omega is the best.,"Omega Healthcare Investors, Inc.",OHI,Health Care,2025-11-20,https://www.glassdoor.com/Reviews/Omega-Healthcare-Reviews-E326877.htm
Good in AR Medical Billing,4.0,"Sep 12, 2019",Good Training and knowledge provided best in industry,long distance if we miss the cab have to travel by own transport and no straight bus,"Omega Healthcare Investors, Inc.",OHI,Health Care,2025-11-20,https://www.glassdoor.com/Reviews/Omega-Healthcare-Reviews-E326877.htm
About medical billing,4.0,"Nov 19, 2019",It was great to be a part of omega. It will give enough knowledge to survive in this particular domain,There is an Salary issues.,"Omega Healthcare Investors, Inc.",OHI,Health Care,2025-11-20,https://www.glassdoor.com/Reviews/Omega-Healthcare-Reviews-E326877.htm
It was a great experience working in omega,4.0,"Oct 5, 2021","Best place to work, Team lead was a good and friendly person to interact with ..",Worked overtime to achieve my target ..,"Omega Healthcare Investors, Inc.",OHI,Health Care,2025-11-20,https://www.glassdoor.com/Reviews/Omega-Healthcare-Reviews-E326877.htm
IT Helpdesk Management,5.0,"Dec 9, 2021",1. Incident Management 2. Capacity Management 3. Assets Management 4. Change Management,Reports Publishing.. 1. Daily Trends Analysis 2. Weekly Dashboard 3. Monthly Trends Analysis and Dashboard,"Omega Healthcare Investors, Inc.",OHI,Health Care,2025-11-20,https://www.glassdoor.com/Reviews/Omega-Healthcare-Reviews-E326877.htm
Accounts Receivable at Omega Healthcare for 2 years.,4.0,"Jan 5, 2022",Best Environment and office space Best place to start career,Working hours may differ and some issues with management also.,"Omega Healthcare Investors, Inc.",OHI,Health Care,2025-11-20,https://www.glassdoor.com/Reviews/Omega-Healthcare-Reviews-E326877.htm
Company Review,5.0,"Feb 13, 2022","Wonderful place to work , good work culture and collaborative leaders","Health insurance befits, coverage amount is low and also need to include parents with out extra cost","Omega Healthcare Investors, Inc.",OHI,Health Care,2025-11-20,https://www.glassdoor.com/Reviews/Omega-Healthcare-Reviews-E326877.htm
AR-Exec,3.0,"Jan 11, 2023",-Focused training -Fast career growth -Quite high compensation,-Impossible to reach the required metrics/targets/quota per day.,"Omega Healthcare Investors, Inc.",OHI,Health Care,2025-11-20,https://www.glassdoor.com/Reviews/Omega-Healthcare-Reviews-E326877.htm
Not the best or the worst place to work,3.0,"Feb 20, 2014",The work we do is not tough. few ppl are friendly,management is not good. managers and team leads run over associates.,"Omega Healthcare Investors, Inc.",OHI,Health Care,2025-11-20,https://www.glassdoor.com/Reviews/Omega-Healthcare-Reviews-E326877.htm
Overall a best company,5.0,"May 4, 2015","Good or great place to work, Good or great place to work",Seniors to be taught to encourage the juniors.,"Omega Healthcare Investors, Inc.",OHI,Health Care,2025-11-20,https://www.glassdoor.com/Reviews/Omega-Healthcare-Reviews-E326877.htm
Not good or bad,3.0,"Nov 21, 2015",Good growing company No work pressure Hr is good Shift timing is convenient Good salary package for experienced coders,Facility's are less Scarcity of experienced coders Software is bad No feedback,"Omega Healthcare Investors, Inc.",OHI,Health Care,2025-11-20,https://www.glassdoor.com/Reviews/Omega-Healthcare-Reviews-E326877.htm
Senior AR executive,5.0,"Mar 29, 2016","Omega is one of the best medical billing company in India, there are so ways to improve our knowledge.",Identification of the employ is very slow.,"Omega Healthcare Investors, Inc.",OHI,Health Care,2025-11-20,https://www.glassdoor.com/Reviews/Omega-Healthcare-Reviews-E326877.htm
Medical coder,2.0,"May 2, 2017",A place to learn several things about medical coding and can improve yourself,Low salary. Hectic work environment. They won't let us to work in our own style.,"Omega Healthcare Investors, Inc.",OHI,Health Care,2025-11-20,https://www.glassdoor.com/Reviews/Omega-Healthcare-Reviews-E326877.htm
Good for freshers,5.0,"Oct 8, 2018",Good start for freshers but there is no growth,No ijp or something all depends on the management and other things,"Omega Healthcare Investors, Inc.",OHI,Health Care,2025-11-20,https://www.glassdoor.com/Reviews/Omega-Healthcare-Reviews-E326877.htm
Manger waste fellow,3.0,"Mar 27, 2019",Secure job.... Good environment to work,Good expect the manager called prakash... Worst manager ever...,"Omega Healthcare Investors, Inc.",OHI,Health Care,2025-11-20,https://www.glassdoor.com/Reviews/Omega-Healthcare-Reviews-E326877.htm
Office job system work,5.0,"Apr 12, 2019",I like the healthcare system at omega. So wish to learn the system.,I like the company,"Omega Healthcare Investors, Inc.",OHI,Health Care,2025-11-20,https://www.glassdoor.com/Reviews/Omega-Healthcare-Reviews-E326877.htm
Salary is too less in it.,3.0,"Jun 7, 2019",Team Members are good and Environment is Friendly.,Dealing with the Process Coach is nothing less than Challenge.,"Omega Healthcare Investors, Inc.",OHI,Health Care,2025-11-20,https://www.glassdoor.com/Reviews/Omega-Healthcare-Reviews-E326877.htm
Credit Balance Analyst,5.0,"Jun 14, 2019",Management is really good. Team players were amazing. Insurance coverage is good,"Cons is based on the team, I dont have any negative thoughts about company","Omega Healthcare Investors, Inc.",OHI,Health Care,2025-11-20,https://www.glassdoor.com/Reviews/Omega-Healthcare-Reviews-E326877.htm
I have been working at Apollo Group of Institution for more than 4 years,4.0,"Jul 13, 2019",Its good company to work,Career opportunity. Compensations & Ben-fits. Work of Life Balance. Culture & Values. Management Skills.,"Omega Healthcare Investors, Inc.",OHI,Health Care,2025-11-20,https://www.glassdoor.com/Reviews/Omega-Healthcare-Reviews-E326877.htm
"Cheap, Unhealthy and Injurious to health!!!",1.0,"Jul 22, 2019",You seriously think there's pros where you are not even paid enough to cover for your meals,"Office politics level: Game of Thrones Smokers paradise, even head Managers are high as kite on weed during duty","Omega Healthcare Investors, Inc.",OHI,Health Care,2025-11-20,https://www.glassdoor.com/Reviews/Omega-Healthcare-Reviews-E326877.htm
Awesome training,2.0,"Dec 1, 2020","cold office, awesome training, great materials, friendly staff and clean","favoritism, power tripper, incompetent managers, low salary, unfair labor practices","Omega Healthcare Investors, Inc.",OHI,Health Care,2025-11-20,https://www.glassdoor.com/Reviews/Omega-Healthcare-Reviews-E326877.htm
Good company for learning,5.0,"Mar 15, 2021","You can expect the different challenges in day-to-day operations, that will really impact our exposure positively",challenging environment if you not prepared,"Omega Healthcare Investors, Inc.",OHI,Health Care,2025-11-20,https://www.glassdoor.com/Reviews/Omega-Healthcare-Reviews-E326877.htm
Team composition,4.0,"Jun 16, 2021","Helping team members, though it was a small team.",Due to Covid and work from home never got a chance to meet the team members face to face.,"Omega Healthcare Investors, Inc.",OHI,Health Care,2025-11-20,https://www.glassdoor.com/Reviews/Omega-Healthcare-Reviews-E326877.htm
Experience with this company is good,4.0,"Dec 9, 2021",Everyone is supportive good opportunity to learn new things .,I dont find any cons till now and hope it will be good always.,"Omega Healthcare Investors, Inc.",OHI,Health Care,2025-11-20,https://www.glassdoor.com/Reviews/Omega-Healthcare-Reviews-E326877.htm
Very good platform to improve your excel skill in centralized mis team,5.0,"Jan 21, 2022",Friendly management... Nice place to work.,As usual little bit pressure,"Omega Healthcare Investors, Inc.",OHI,Health Care,2025-11-20,https://www.glassdoor.com/Reviews/Omega-Healthcare-Reviews-E326877.htm
Good,5.0,"Mar 11, 2022",Good Training what they provide is awesome as compared to any other company,Nyc experience for freshers as experience person salary is less,"Omega Healthcare Investors, Inc.",OHI,Health Care,2025-11-20,https://www.glassdoor.com/Reviews/Omega-Healthcare-Reviews-E326877.htm
Salary,5.0,"Jun 30, 2022","If u want to get deep knowledge of medical billing,join omega.","Salary is less,not better working environment for north side peoples","Omega Healthcare Investors, Inc.",OHI,Health Care,2025-11-20,https://www.glassdoor.com/Reviews/Omega-Healthcare-Reviews-E326877.htm
Excellent place to start your career,4.0,"Nov 9, 2022",Equally opportunities given to all the team members. You will be recognized for your contribution in team.,Salary is the only concern here.,"Omega Healthcare Investors, Inc.",OHI,Health Care,2025-11-20,https://www.glassdoor.com/Reviews/Omega-Healthcare-Reviews-E326877.htm
Training,1.0,"Dec 6, 2022",You will learn some basics info on healthcare during training.,•Power tripping supervisors •HR management so Bias. •Stressful environment. •I got my final pay and CEO after 1 year. The HR will make it difficult for you to get your final pay. You wont get it unless you ask assistance from DOLE Philippines. •Trust me you don't wanna be in this company.,"Omega Healthcare Investors, Inc.",OHI,Health Care,2025-11-20,https://www.glassdoor.com/Reviews/Omega-Healthcare-Reviews-E326877.htm
Great experience,3.0,"Jul 6, 2012",possible knowledge for medical billing companies,Salary is always very bad and the review system,"Omega Healthcare Investors, Inc.",OHI,Health Care,2025-11-20,https://www.glassdoor.com/Reviews/Omega-Healthcare-Reviews-E326877.htm
AR Associate,4.0,"Apr 11, 2017",Good place to work. Working environment is good. Friendly peoples.,Depends on your process. My Process was hell.,"Omega Healthcare Investors, Inc.",OHI,Health Care,2025-11-20,https://www.glassdoor.com/Reviews/Omega-Healthcare-Reviews-E326877.htm
Omega its a brand,5.0,"Jan 8, 2018",Get higher position very soon,Some locations work pressure is too high,"Omega Healthcare Investors, Inc.",OHI,Health Care,2025-11-20,https://www.glassdoor.com/Reviews/Omega-Healthcare-Reviews-E326877.htm
Knowledge gain,4.0,"Mar 22, 2019","We can gain lot of knowledge, mainly freshers from here can survive anywhere","Roster plan, if we take sick leave also we have to compensatevin some projects","Omega Healthcare Investors, Inc.",OHI,Health Care,2025-11-20,https://www.glassdoor.com/Reviews/Omega-Healthcare-Reviews-E326877.htm
Omega healthcare,5.0,"Aug 31, 2019",I'm Antony. Im studying bsc biotech 2nd Year.Apart from my know omega is the best company to work with ongoing degree.,No more downsides about omega,"Omega Healthcare Investors, Inc.",OHI,Health Care,2025-11-20,https://www.glassdoor.com/Reviews/Omega-Healthcare-Reviews-E326877.htm
Looking for Team lead role,4.0,"Sep 5, 2019",Omega is a good place to work. It allows you to manage work life balance.,Omega was restricted on salary part to lateral hires,"Omega Healthcare Investors, Inc.",OHI,Health Care,2025-11-20,https://www.glassdoor.com/Reviews/Omega-Healthcare-Reviews-E326877.htm
Test lead,3.0,"Sep 7, 2021",emerging company with lots of scope in development and testing,not using any paid tools like jira ALM,"Omega Healthcare Investors, Inc.",OHI,Health Care,2025-11-20,https://www.glassdoor.com/Reviews/Omega-Healthcare-Reviews-E326877.htm
very good learning platform,4.0,"Feb 5, 2022",very good platform for learning and develop our knowledge,salary not satisfied for freshers,"Omega Healthcare Investors, Inc.",OHI,Health Care,2025-11-20,https://www.glassdoor.com/Reviews/Omega-Healthcare-Reviews-E326877.htm
Good,4.0,"Apr 4, 2022",Best stuff in Training sessions with anatomy related process going to move and more support from management ...,Need more support from HR at the time of joining....,"Omega Healthcare Investors, Inc.",OHI,Health Care,2025-11-20,https://www.glassdoor.com/Reviews/Omega-Healthcare-Reviews-E326877.htm
Great place to work,5.0,"May 24, 2022",Omega Healthcare is employee friendly place with lot of growth opportunities,Weekend working as per client requirement,"Omega Healthcare Investors, Inc.",OHI,Health Care,2025-11-20,https://www.glassdoor.com/Reviews/Omega-Healthcare-Reviews-E326877.htm
"health care assistant,taking care of patients at home",4.0,"Dec 28, 2022","they are flexible, they pay good salary",the work is tidious with too much extra working time,"Omega Healthcare Investors, Inc.",OHI,Health Care,2025-11-20,https://www.glassdoor.com/Reviews/Omega-Healthcare-Reviews-E326877.htm
Great Experience,4.0,"Feb 8, 2023",Work Culture for WFH employees,"Nothing as Such But i would say no one is perfect, There must be a chance of improvement to grow Up everyone.","Omega Healthcare Investors, Inc.",OHI,Health Care,2025-11-20,https://www.glassdoor.com/Reviews/Omega-Healthcare-Reviews-E326877.htm
OVERALL GROWTH,4.0,"Feb 22, 2023","FRIENDLY & SUPPORTIVE COLLEAGUES,GOOD ENVIRONMENT","High pressure of work,Need to be very smart & hardworking to make life balance","Omega Healthcare Investors, Inc.",OHI,Health Care,2025-11-20,https://www.glassdoor.com/Reviews/Omega-Healthcare-Reviews-E326877.htm
Probably satisfied with the company,4.0,"Jul 22, 2012","Senior management staff is good, healthy work atmosphere, and pretty good personal growth.",salary is less compared to other companies in the city.,"Omega Healthcare Investors, Inc.",OHI,Health Care,2025-11-20,https://www.glassdoor.com/Reviews/Omega-Healthcare-Reviews-E326877.htm
Manager,3.0,"Jun 16, 2015",Good working environment! potential to handle to more challenges,Less authority for Managers. More accountability on client facing and less on decision making,"Omega Healthcare Investors, Inc.",OHI,Health Care,2025-11-20,https://www.glassdoor.com/Reviews/Omega-Healthcare-Reviews-E326877.htm
Proper place for freshers,4.0,"Dec 3, 2016","Training given that cannot be forgotten. Got talent, you will be promoted.",Co-workers always trying to pull you down.,"Omega Healthcare Investors, Inc.",OHI,Health Care,2025-11-20,https://www.glassdoor.com/Reviews/Omega-Healthcare-Reviews-E326877.htm
"Good environment, wrok friendly, good growth.",5.0,"Mar 14, 2019",Very good people around and good management,No negatives really work friendly,"Omega Healthcare Investors, Inc.",OHI,Health Care,2025-11-20,https://www.glassdoor.com/Reviews/Omega-Healthcare-Reviews-E326877.htm
Good for freshers,2.0,"Sep 25, 2019","If your good in bucketing, this is the right place for your career",Full of partiality and politics,"Omega Healthcare Investors, Inc.",OHI,Health Care,2025-11-20,https://www.glassdoor.com/Reviews/Omega-Healthcare-Reviews-E326877.htm
about work,2.0,"Oct 15, 2020","good environment, to start carreer in this company is best","very worst team, full partiallity , too much pressure to employees","Omega Healthcare Investors, Inc.",OHI,Health Care,2025-11-20,https://www.glassdoor.com/Reviews/Omega-Healthcare-Reviews-E326877.htm
Decent Company,4.0,"Mar 22, 2021","Good work ethic, Good work environment, Disciplined, Good Administration",Lower salary compared to market standards and bad socio political culture,"Omega Healthcare Investors, Inc.",OHI,Health Care,2025-11-20,https://www.glassdoor.com/Reviews/Omega-Healthcare-Reviews-E326877.htm
Good for starters,3.0,"Aug 15, 2021",Good place if you wanna start your career in medical billing,Can’t be here for more than 1-2 years no decent salary raise can be expected,"Omega Healthcare Investors, Inc.",OHI,Health Care,2025-11-20,https://www.glassdoor.com/Reviews/Omega-Healthcare-Reviews-E326877.htm
No appreciation only work. Management suck,2.0,"Sep 3, 2021",You will learn have good exposure to technical skills,Everything else ... Management and infrastructure is very poor,"Omega Healthcare Investors, Inc.",OHI,Health Care,2025-11-20,https://www.glassdoor.com/Reviews/Omega-Healthcare-Reviews-E326877.htm
Service quality,4.0,"Dec 4, 2021",Omega is a great platform for show our skills,Most of the team was working in night shift only it should be better if rotten,"Omega Healthcare Investors, Inc.",OHI,Health Care,2025-11-20,https://www.glassdoor.com/Reviews/Omega-Healthcare-Reviews-E326877.htm
Good place for freshers to learn different coding specialities,2.0,"Mar 5, 2022",Good place for freshers to learn different coding specialities,Management is worst and the annual appraisal is a joke,"Omega Healthcare Investors, Inc.",OHI,Health Care,2025-11-20,https://www.glassdoor.com/Reviews/Omega-Healthcare-Reviews-E326877.htm
how omega is??,5.0,"Mar 25, 2022",Omega is employee friendly and provide good working environment.,"As i am a beginner in omega, there is nothing to discuss here as cons.","Omega Healthcare Investors, Inc.",OHI,Health Care,2025-11-20,https://www.glassdoor.com/Reviews/Omega-Healthcare-Reviews-E326877.htm
Good Organization to learn basics,4.0,"Apr 30, 2022","Ample of learning opportunities, if you are interest to learn","Nothing as major, small aspect as usual. handle and get learnings from it..","Omega Healthcare Investors, Inc.",OHI,Health Care,2025-11-20,https://www.glassdoor.com/Reviews/Omega-Healthcare-Reviews-E326877.htm
Company Environment,4.0,"May 16, 2022",Very good infrastructure and working environment.,Less yearly appraisal and the amount of work is high compared to the salary,"Omega Healthcare Investors, Inc.",OHI,Health Care,2025-11-20,https://www.glassdoor.com/Reviews/Omega-Healthcare-Reviews-E326877.htm
Nice Place to work,5.0,"Jul 27, 2022",Company’s general reputation Key leaders’ reputation Admiration of products/services Admiration of other company initiatives Company’s culture and values Company’s growth/success,I dont think so too much,"Omega Healthcare Investors, Inc.",OHI,Health Care,2025-11-20,https://www.glassdoor.com/Reviews/Omega-Healthcare-Reviews-E326877.htm
Team Leader,4.0,"Sep 1, 2022","Nice Environment to work for freshers, Excellent Training",Promotions Recognitions Value towards Employees Timely hikes Night shift allowance,"Omega Healthcare Investors, Inc.",OHI,Health Care,2025-11-20,https://www.glassdoor.com/Reviews/Omega-Healthcare-Reviews-E326877.htm
