title,rating,date,pros,cons,company,ticker,property_type,scrape_date,glassdoor_url
Good Organization to work with,4.0,"May 16, 2024",Employee friendly and growth focused,nothing at this point of time,"Omega Healthcare Investors, Inc.",OHI,Health Care,2025-11-20,https://www.glassdoor.com/Reviews/Omega-Healthcare-Reviews-E326877.htm
About the company,4.0,"Apr 22, 2024",I joined omega healthcare on July 11th of 2023 right after graduating college it is a great place to work,The pay scale is very less,"Omega Healthcare Investors, Inc.",OHI,Health Care,2025-11-20,https://www.glassdoor.com/Reviews/Omega-Healthcare-Reviews-E326877.htm
Good,5.0,"May 12, 2024",Gives Best training and safety,Little Work pressure and partialities,"Omega Healthcare Investors, Inc.",OHI,Health Care,2025-11-20,https://www.glassdoor.com/Reviews/Omega-Healthcare-Reviews-E326877.htm
worst company,1.0,"Jul 5, 2024",Only micro-management and bad behaviour,I personally don't suggest any one to join this company.,"Omega Healthcare Investors, Inc.",OHI,Health Care,2025-11-20,https://www.glassdoor.com/Reviews/Omega-Healthcare-Reviews-E326877.htm
Very good company for freshers,4.0,"May 16, 2024",Good atmosphere in the company,I don't find anything bad,"Omega Healthcare Investors, Inc.",OHI,Health Care,2025-11-20,https://www.glassdoor.com/Reviews/Omega-Healthcare-Reviews-E326877.htm
,5.0,"May 16, 2024",Good place to work in billing industry,No cons as if now,"Omega Healthcare Investors, Inc.",OHI,Health Care,2025-11-20,https://www.glassdoor.com/Reviews/Omega-Healthcare-Reviews-E326877.htm
Good,4.0,"May 20, 2024",Less work pressure and good salary,No cons as of now,"Omega Healthcare Investors, Inc.",OHI,Health Care,2025-11-20,https://www.glassdoor.com/Reviews/Omega-Healthcare-Reviews-E326877.htm
Good Company,5.0,"May 6, 2024",High Salary Nice environment Nice Teammates and Bosses Approachable people Fixed weekend off,Additional workload but salary is stagnant,"Omega Healthcare Investors, Inc.",OHI,Health Care,2025-11-20,https://www.glassdoor.com/Reviews/Omega-Healthcare-Reviews-E326877.htm
Pathetic Manager,2.0,"May 19, 2024",There was very less to mention,No interested in mentioning anything,"Omega Healthcare Investors, Inc.",OHI,Health Care,2025-11-20,https://www.glassdoor.com/Reviews/Omega-Healthcare-Reviews-E326877.htm
Accounts receivable,4.0,"Apr 8, 2024","Good training on the basis of the job, structured OJT and highly knowledgeable SME & trainers",Target pressure and not listening to the concerns of the staffs.,"Omega Healthcare Investors, Inc.",OHI,Health Care,2025-11-20,https://www.glassdoor.com/Reviews/Omega-Healthcare-Reviews-E326877.htm
,4.0,"Apr 23, 2024",Good place to learn US healthcare,Working on week ends. No cab provided when work on weekends.,"Omega Healthcare Investors, Inc.",OHI,Health Care,2025-11-20,https://www.glassdoor.com/Reviews/Omega-Healthcare-Reviews-E326877.htm
It's awesome to work with them,5.0,"Apr 30, 2024","Good for beginners, All seniors are supportive",I don't find any cons,"Omega Healthcare Investors, Inc.",OHI,Health Care,2025-11-20,https://www.glassdoor.com/Reviews/Omega-Healthcare-Reviews-E326877.htm
good team and environment,4.0,"Apr 2, 2024",good environment team support consider individual perfomance,there is no variable pay even i work more than my targets and over time was not available only as per company requirements,"Omega Healthcare Investors, Inc.",OHI,Health Care,2025-11-20,https://www.glassdoor.com/Reviews/Omega-Healthcare-Reviews-E326877.htm
,3.0,"May 16, 2024",Good training free coupon s,Mostly night shift stress high,"Omega Healthcare Investors, Inc.",OHI,Health Care,2025-11-20,https://www.glassdoor.com/Reviews/Omega-Healthcare-Reviews-E326877.htm
Good place to work,4.0,"Apr 29, 2024",Good place to work and learn,Int pol is very high,"Omega Healthcare Investors, Inc.",OHI,Health Care,2025-11-20,https://www.glassdoor.com/Reviews/Omega-Healthcare-Reviews-E326877.htm
Omega,4.0,"Apr 24, 2024",Good opportunity to grow and earn if you're willing to adapt,Process could be a bit tough for freshers,"Omega Healthcare Investors, Inc.",OHI,Health Care,2025-11-20,https://www.glassdoor.com/Reviews/Omega-Healthcare-Reviews-E326877.htm
Coding,3.0,"May 6, 2024",Good working environment and good chance to learn more.,No proper bonus and appraisals,"Omega Healthcare Investors, Inc.",OHI,Health Care,2025-11-20,https://www.glassdoor.com/Reviews/Omega-Healthcare-Reviews-E326877.htm
Good for everyone,4.0,"Apr 24, 2024",Good working environment. Backend job.,Don't have incentive or any sort of. bonus.,"Omega Healthcare Investors, Inc.",OHI,Health Care,2025-11-20,https://www.glassdoor.com/Reviews/Omega-Healthcare-Reviews-E326877.htm
Work culture,3.0,"May 7, 2024",Best environment to work with,There are no major cons as such,"Omega Healthcare Investors, Inc.",OHI,Health Care,2025-11-20,https://www.glassdoor.com/Reviews/Omega-Healthcare-Reviews-E326877.htm
Best company for RCM,5.0,"Apr 2, 2024",Omega is equipped with lots of knowledge in the field of Medical billing,No downside seen so far,"Omega Healthcare Investors, Inc.",OHI,Health Care,2025-11-20,https://www.glassdoor.com/Reviews/Omega-Healthcare-Reviews-E326877.htm
Very Bad Management,1.0,"May 30, 2023","There is no pros for this company management. They like to blem employees only, even if employees don't have any fault. For their management issues they use to blem employees.",I was hired as service bench. They told me that you will get at least two interview opertunity from process management. First of I don't understand that if I am selected and if I am getting salary then what is the requirement for another interview. And after that I got only one interview opertunity from them. And they said they will not continue with me. The worst part is they did not provide me any system to update my attendance. After 75 day from my last working day I got my FNF payment. That was also with 29 days LOP. When I told them that I don't have any system to update my attendance. Then how can I update my attendance. They told me that whether you have a system or not it is your responsibility to update attendance. And they didn't pay for those days. I strongly recommend my friends to not to join Omega healthcare because of the management.,"Omega Healthcare Investors, Inc.",OHI,Health Care,2025-11-20,https://www.glassdoor.com/Reviews/Omega-Healthcare-Reviews-E326877.htm
good,4.0,"May 6, 2024",management was good and supportive,compensation is very bad for experienced,"Omega Healthcare Investors, Inc.",OHI,Health Care,2025-11-20,https://www.glassdoor.com/Reviews/Omega-Healthcare-Reviews-E326877.htm
Night Shift,3.0,"May 2, 2024","Cab
Night Shift Allowance
Friendly Staffs
Good TL
Good environment","Health issue
Work-life balance
High Target
Only US Holiday
Shift Extending","Omega Healthcare Investors, Inc.",OHI,Health Care,2025-11-20,https://www.glassdoor.com/Reviews/Omega-Healthcare-Reviews-E326877.htm
GOOD,4.0,"Mar 25, 2024",Good company as they helped me with my academy.,"workload, once youre done with your set of patients for the day, they would add more cause you finished before your time out.","Omega Healthcare Investors, Inc.",OHI,Health Care,2025-11-20,https://www.glassdoor.com/Reviews/Omega-Healthcare-Reviews-E326877.htm
,4.0,"May 3, 2024",Good pay for Trichy location,Night shift without dinner make tired,"Omega Healthcare Investors, Inc.",OHI,Health Care,2025-11-20,https://www.glassdoor.com/Reviews/Omega-Healthcare-Reviews-E326877.htm
Good workplace,5.0,"Apr 23, 2024",Very good supportive from Managers and management,Nothing much to share its good,"Omega Healthcare Investors, Inc.",OHI,Health Care,2025-11-20,https://www.glassdoor.com/Reviews/Omega-Healthcare-Reviews-E326877.htm
Fairly decent,3.0,"Apr 26, 2024","Co-workers and managers
Free snacks",Not much to be specific but not also the best,"Omega Healthcare Investors, Inc.",OHI,Health Care,2025-11-20,https://www.glassdoor.com/Reviews/Omega-Healthcare-Reviews-E326877.htm
Nice job,3.0,"Apr 22, 2024","Friendly atmosphere, Hike based on performance, Two way cab facilities,","Only night shift, no rotational shifts.","Omega Healthcare Investors, Inc.",OHI,Health Care,2025-11-20,https://www.glassdoor.com/Reviews/Omega-Healthcare-Reviews-E326877.htm
Nice,3.0,"Apr 14, 2024",It's been Good working experience.,"Needs to do more towards employee benefits like can facility, salary and good catering services.","Omega Healthcare Investors, Inc.",OHI,Health Care,2025-11-20,https://www.glassdoor.com/Reviews/Omega-Healthcare-Reviews-E326877.htm
Good,5.0,"Apr 19, 2024",Friendly environment and the team members are very helpful.,There is no proper canteen facilities.,"Omega Healthcare Investors, Inc.",OHI,Health Care,2025-11-20,https://www.glassdoor.com/Reviews/Omega-Healthcare-Reviews-E326877.htm
,4.0,"Apr 3, 2024",Gud company to work with,Very strict like schools and colleges,"Omega Healthcare Investors, Inc.",OHI,Health Care,2025-11-20,https://www.glassdoor.com/Reviews/Omega-Healthcare-Reviews-E326877.htm
Worst Job,1.0,"Jun 19, 2024",except canteen nothing is good,trainers are worst people in India.,"Omega Healthcare Investors, Inc.",OHI,Health Care,2025-11-20,https://www.glassdoor.com/Reviews/Omega-Healthcare-Reviews-E326877.htm
Good knowledge,3.0,"Apr 6, 2024",We can increase our knowledge based on their Training opportunity.,Nothing I have seen here as cons.,"Omega Healthcare Investors, Inc.",OHI,Health Care,2025-11-20,https://www.glassdoor.com/Reviews/Omega-Healthcare-Reviews-E326877.htm
Ar Caller,5.0,"Apr 6, 2024",It's very good and nice place to start career.,Nepotism and partiality always on high,"Omega Healthcare Investors, Inc.",OHI,Health Care,2025-11-20,https://www.glassdoor.com/Reviews/Omega-Healthcare-Reviews-E326877.htm
Great organization,4.0,"Apr 3, 2024","Good working atmosphere, friendly employers",I dont have any negative regards this organization,"Omega Healthcare Investors, Inc.",OHI,Health Care,2025-11-20,https://www.glassdoor.com/Reviews/Omega-Healthcare-Reviews-E326877.htm
Salary checking,4.0,"Feb 29, 2024",In this working station is ver comfortable in these city,Working hours will be extended with regular time but no benefits..,"Omega Healthcare Investors, Inc.",OHI,Health Care,2025-11-20,https://www.glassdoor.com/Reviews/Omega-Healthcare-Reviews-E326877.htm
Good to work,5.0,"Apr 12, 2024","Work from home
Team work
Professional enviornment","Work life balance
Low pay scale","Omega Healthcare Investors, Inc.",OHI,Health Care,2025-11-20,https://www.glassdoor.com/Reviews/Omega-Healthcare-Reviews-E326877.htm
Salary,3.0,"Apr 6, 2024",Subject gaining immediately select nice place friends collouges,Low salary high pressure no job guarantee pip,"Omega Healthcare Investors, Inc.",OHI,Health Care,2025-11-20,https://www.glassdoor.com/Reviews/Omega-Healthcare-Reviews-E326877.htm
Best company for freshers,4.0,"Jan 17, 2024","Experience person can get upto 40k and cab facility is there,and free unlimited tea and coffee but per person get 10rs worth snacks",Night shift fixed only Some Tl are rude with employees,"Omega Healthcare Investors, Inc.",OHI,Health Care,2025-11-20,https://www.glassdoor.com/Reviews/Omega-Healthcare-Reviews-E326877.htm
Depends on team,3.0,"Feb 15, 2024",They provide good package based on your experience,No work life balance Mostly toxic work environment but if manager is good then no issues,"Omega Healthcare Investors, Inc.",OHI,Health Care,2025-11-20,https://www.glassdoor.com/Reviews/Omega-Healthcare-Reviews-E326877.htm
Nice place,4.0,"Apr 2, 2024",good org & support for growth,None to talk about at the moment,"Omega Healthcare Investors, Inc.",OHI,Health Care,2025-11-20,https://www.glassdoor.com/Reviews/Omega-Healthcare-Reviews-E326877.htm
beaware,3.0,"Mar 1, 2024",no work pressure until u get client escalation,poor management they work based on their own not care about their downlines,"Omega Healthcare Investors, Inc.",OHI,Health Care,2025-11-20,https://www.glassdoor.com/Reviews/Omega-Healthcare-Reviews-E326877.htm
GREAT,5.0,"Mar 25, 2024",upgrading myself in all ways,no any negative I feel about our company,"Omega Healthcare Investors, Inc.",OHI,Health Care,2025-11-20,https://www.glassdoor.com/Reviews/Omega-Healthcare-Reviews-E326877.htm
Work environment,5.0,"Dec 3, 2023","they provide pick and drop cab facility remote job if we required, depends on project you work","It depends upon your manager, if manager good you won't feel kind of partiality at work and people management.","Omega Healthcare Investors, Inc.",OHI,Health Care,2025-11-20,https://www.glassdoor.com/Reviews/Omega-Healthcare-Reviews-E326877.htm
They will not pay you much for freshers,3.0,"Feb 23, 2024",Environment is good and leads or managers are friendly,Except what I have mentioned everything is not good and they will not keep thir promise.,"Omega Healthcare Investors, Inc.",OHI,Health Care,2025-11-20,https://www.glassdoor.com/Reviews/Omega-Healthcare-Reviews-E326877.htm
Omega Healthcare,3.0,"Apr 3, 2024","Good working environment, Good people",Salary is not competitive enough,"Omega Healthcare Investors, Inc.",OHI,Health Care,2025-11-20,https://www.glassdoor.com/Reviews/Omega-Healthcare-Reviews-E326877.htm
It will be helpful to career guidance,3.0,"Feb 12, 2024","It good working with the company. An awesome place to work, learn and grow.",The salary scale is lower compared to other companies. Some managers are difficult to work with.,"Omega Healthcare Investors, Inc.",OHI,Health Care,2025-11-20,https://www.glassdoor.com/Reviews/Omega-Healthcare-Reviews-E326877.htm
Good place to work,5.0,"Mar 6, 2024","decent yearly hike
work life balance
flexible working time",Nothing as of now for the last 2 years,"Omega Healthcare Investors, Inc.",OHI,Health Care,2025-11-20,https://www.glassdoor.com/Reviews/Omega-Healthcare-Reviews-E326877.htm
Good company,4.0,"Mar 21, 2024","Good Salary
5 day a week work","High work pressure
Full night shift","Omega Healthcare Investors, Inc.",OHI,Health Care,2025-11-20,https://www.glassdoor.com/Reviews/Omega-Healthcare-Reviews-E326877.htm
Pathetic,2.0,"Mar 19, 2024",Nothing to boast about the organisation,Minimum learning platform and poor management,"Omega Healthcare Investors, Inc.",OHI,Health Care,2025-11-20,https://www.glassdoor.com/Reviews/Omega-Healthcare-Reviews-E326877.htm
About,3.0,"Feb 25, 2024","Good to work and knowledge transfer are good , support seniors and shows good carrier path","Very bossive environment, partiality amongst their own creed","Omega Healthcare Investors, Inc.",OHI,Health Care,2025-11-20,https://www.glassdoor.com/Reviews/Omega-Healthcare-Reviews-E326877.htm
1 year review,3.0,"Mar 10, 2024",Great company to work and good corporate culture,Salary and incentives are not that great,"Omega Healthcare Investors, Inc.",OHI,Health Care,2025-11-20,https://www.glassdoor.com/Reviews/Omega-Healthcare-Reviews-E326877.htm
Work tining,2.0,"Jan 19, 2024",Noghing to say as pros,Should login by 8 sharply but log out time will be 10 pm.Even though we can log in early as it helps the team but you should not log out at the correct time,"Omega Healthcare Investors, Inc.",OHI,Health Care,2025-11-20,https://www.glassdoor.com/Reviews/Omega-Healthcare-Reviews-E326877.htm
Not that great,1.0,"May 19, 2024",I do not think so,Many cons are there here,"Omega Healthcare Investors, Inc.",OHI,Health Care,2025-11-20,https://www.glassdoor.com/Reviews/Omega-Healthcare-Reviews-E326877.htm
Good Company,4.0,"Mar 10, 2024","Work-life Balance, Flexible timings, Good culture","No Learning opportunity, No training, Internal Politics","Omega Healthcare Investors, Inc.",OHI,Health Care,2025-11-20,https://www.glassdoor.com/Reviews/Omega-Healthcare-Reviews-E326877.htm
worst company,1.0,"May 2, 2024",calories burn without Exercise learn how to be toxic,To care for employees worst company no value for work,"Omega Healthcare Investors, Inc.",OHI,Health Care,2025-11-20,https://www.glassdoor.com/Reviews/Omega-Healthcare-Reviews-E326877.htm
Normal,4.0,"Mar 11, 2024",Usual night shift calling speaking work,Nothing is there to tell as cons,"Omega Healthcare Investors, Inc.",OHI,Health Care,2025-11-20,https://www.glassdoor.com/Reviews/Omega-Healthcare-Reviews-E326877.htm
Omega work culture,5.0,"Sep 19, 2023","The company treat everyone fair with no discrimination based on the position they hold. People centric are the policies. Even in case of nonperformance, the organization give ample time to recoup and perform. This mean there is no undue pressure on the employee.",May be the frequency of interactions with the senior leadership team can be increased to understand the ground reality and take decision faster.,"Omega Healthcare Investors, Inc.",OHI,Health Care,2025-11-20,https://www.glassdoor.com/Reviews/Omega-Healthcare-Reviews-E326877.htm
Good culture & great opportunity to learn new things,4.0,"Feb 15, 2024",Good culture & great opportunity to learn new things,Hybrid mode to available for all projects,"Omega Healthcare Investors, Inc.",OHI,Health Care,2025-11-20,https://www.glassdoor.com/Reviews/Omega-Healthcare-Reviews-E326877.htm
Resource management,3.0,"Feb 26, 2024",Learning opportunity with complete environment,"Poor infrastructure, poor work culture","Omega Healthcare Investors, Inc.",OHI,Health Care,2025-11-20,https://www.glassdoor.com/Reviews/Omega-Healthcare-Reviews-E326877.htm
Medical coding fresher candidate,5.0,"Feb 11, 2024",Good company for Omega healthcare Achieve spot in omega,Good position in my work,"Omega Healthcare Investors, Inc.",OHI,Health Care,2025-11-20,https://www.glassdoor.com/Reviews/Omega-Healthcare-Reviews-E326877.htm
Summary,3.0,"Feb 15, 2024","No stress, simple process,easy to learn","No growth, no benefits,poor salary","Omega Healthcare Investors, Inc.",OHI,Health Care,2025-11-20,https://www.glassdoor.com/Reviews/Omega-Healthcare-Reviews-E326877.htm
Coder,5.0,"Feb 29, 2024",Overall Good to start a career,"nothing all in place, no cons","Omega Healthcare Investors, Inc.",OHI,Health Care,2025-11-20,https://www.glassdoor.com/Reviews/Omega-Healthcare-Reviews-E326877.htm
,5.0,"Feb 12, 2024","Very Good Company for Freshers, who want to work in a Medical Billing.",N o t h i n g.,"Omega Healthcare Investors, Inc.",OHI,Health Care,2025-11-20,https://www.glassdoor.com/Reviews/Omega-Healthcare-Reviews-E326877.htm
,3.0,"Feb 28, 2024",Salary is always on time,HR response is not good 👍,"Omega Healthcare Investors, Inc.",OHI,Health Care,2025-11-20,https://www.glassdoor.com/Reviews/Omega-Healthcare-Reviews-E326877.htm
Its really a good company with good environment,4.0,"Jan 27, 2024",Good manager for employees and my TL is really a good supporter.,no negative because i feel its good.,"Omega Healthcare Investors, Inc.",OHI,Health Care,2025-11-20,https://www.glassdoor.com/Reviews/Omega-Healthcare-Reviews-E326877.htm
Good company to start your career,5.0,"Feb 7, 2024","Salary for freshers
Free transport for women
Bonus and incentives
Salary hike",Transport and training period is too long,"Omega Healthcare Investors, Inc.",OHI,Health Care,2025-11-20,https://www.glassdoor.com/Reviews/Omega-Healthcare-Reviews-E326877.htm
Good,4.0,"Feb 21, 2024",Good environment to work with this company,Need good management .. not good management system,"Omega Healthcare Investors, Inc.",OHI,Health Care,2025-11-20,https://www.glassdoor.com/Reviews/Omega-Healthcare-Reviews-E326877.htm
,4.0,"Feb 26, 2024",Good Infrastuture & good Managment,Hybrid option not possible due some situation,"Omega Healthcare Investors, Inc.",OHI,Health Care,2025-11-20,https://www.glassdoor.com/Reviews/Omega-Healthcare-Reviews-E326877.htm
Good Company to start with,3.0,"Feb 18, 2024","1. Learning Opportunity 
2. Good Management",1. Sometimes need to work more,"Omega Healthcare Investors, Inc.",OHI,Health Care,2025-11-20,https://www.glassdoor.com/Reviews/Omega-Healthcare-Reviews-E326877.htm
Good Atmosphere,5.0,"Feb 19, 2024",Very good benefits as part of job,Long working hours is a negative.,"Omega Healthcare Investors, Inc.",OHI,Health Care,2025-11-20,https://www.glassdoor.com/Reviews/Omega-Healthcare-Reviews-E326877.htm
Good place for freshers,4.0,"Feb 19, 2024",Good environment to work with,"Nothing as such, except break time tea","Omega Healthcare Investors, Inc.",OHI,Health Care,2025-11-20,https://www.glassdoor.com/Reviews/Omega-Healthcare-Reviews-E326877.htm
omega,4.0,"Feb 21, 2024",free cab facility from your door,night shifts can be difficult to adjust,"Omega Healthcare Investors, Inc.",OHI,Health Care,2025-11-20,https://www.glassdoor.com/Reviews/Omega-Healthcare-Reviews-E326877.htm
Company Review,3.0,"Feb 7, 2024",you can work all night and weekend availability,you can only work in night and there is no Indian holidays,"Omega Healthcare Investors, Inc.",OHI,Health Care,2025-11-20,https://www.glassdoor.com/Reviews/Omega-Healthcare-Reviews-E326877.htm
Good working environment,3.0,"Feb 5, 2024",Work culture is good. Head will listen if we have stupid ideas too,Pay raise is not as expected,"Omega Healthcare Investors, Inc.",OHI,Health Care,2025-11-20,https://www.glassdoor.com/Reviews/Omega-Healthcare-Reviews-E326877.htm
It's a good place for work,5.0,"Jan 25, 2024",To grow up Knowledge about the process,Couldn't relocate there for continuing job,"Omega Healthcare Investors, Inc.",OHI,Health Care,2025-11-20,https://www.glassdoor.com/Reviews/Omega-Healthcare-Reviews-E326877.htm
Not good,1.0,"Apr 24, 2024",Learn new things in Omega,Work pressure is worst in Omega,"Omega Healthcare Investors, Inc.",OHI,Health Care,2025-11-20,https://www.glassdoor.com/Reviews/Omega-Healthcare-Reviews-E326877.htm
Production based word,3.0,"Jan 3, 2024",Good salary for freshers and training is upto the mark,Salary is based on production not about your effort you gave.... It lead to some hectic ...felt somewhat pressurized... Other than that no issues,"Omega Healthcare Investors, Inc.",OHI,Health Care,2025-11-20,https://www.glassdoor.com/Reviews/Omega-Healthcare-Reviews-E326877.htm
good,5.0,"Feb 4, 2024",good work experience and had great team members,There was no cons to this company,"Omega Healthcare Investors, Inc.",OHI,Health Care,2025-11-20,https://www.glassdoor.com/Reviews/Omega-Healthcare-Reviews-E326877.htm
Toxic Management,3.0,"Jan 9, 2024",Work from home but temporary,Management will keep on threatening you to work onsite once you are unable to meet their unrealistic expectations. No work-life balance,"Omega Healthcare Investors, Inc.",OHI,Health Care,2025-11-20,https://www.glassdoor.com/Reviews/Omega-Healthcare-Reviews-E326877.htm
Nice,4.0,"Feb 20, 2024","Good environment , salary, work culture","Nill, no cons nill nill","Omega Healthcare Investors, Inc.",OHI,Health Care,2025-11-20,https://www.glassdoor.com/Reviews/Omega-Healthcare-Reviews-E326877.htm
A school for medical billing,3.0,"Jan 23, 2024",Good place to learn and know more about the field,Less salary and no career growth,"Omega Healthcare Investors, Inc.",OHI,Health Care,2025-11-20,https://www.glassdoor.com/Reviews/Omega-Healthcare-Reviews-E326877.htm
AR associate,2.0,"Jan 22, 2024","my opinion ambiance is good and friendly colleagues, pre training before job is good. trainers are very good",in production floor everything politics and partiality unprofessional,"Omega Healthcare Investors, Inc.",OHI,Health Care,2025-11-20,https://www.glassdoor.com/Reviews/Omega-Healthcare-Reviews-E326877.htm
,2.0,"Feb 13, 2024","Fresher level , good to enter into corporate",Less pay as comorbidity to market value,"Omega Healthcare Investors, Inc.",OHI,Health Care,2025-11-20,https://www.glassdoor.com/Reviews/Omega-Healthcare-Reviews-E326877.htm
Don't go the company,1.0,"Feb 28, 2024",They can take freshers . So if u are fresher and u can prefer the company,They don't give a salary as they discussed with you. Hr and management are not helpful and friendly,"Omega Healthcare Investors, Inc.",OHI,Health Care,2025-11-20,https://www.glassdoor.com/Reviews/Omega-Healthcare-Reviews-E326877.htm
Good,3.0,"Jan 31, 2024",Good company to work. Good office environment,Not good hike. Only 750 for seniors who is worked more than years,"Omega Healthcare Investors, Inc.",OHI,Health Care,2025-11-20,https://www.glassdoor.com/Reviews/Omega-Healthcare-Reviews-E326877.htm
The experience was good,3.0,"Jan 27, 2024",Good company. Good atmosphere work life balance.,Night shifts. but copable. Need to cope up with our health.,"Omega Healthcare Investors, Inc.",OHI,Health Care,2025-11-20,https://www.glassdoor.com/Reviews/Omega-Healthcare-Reviews-E326877.htm
The Main Reason night shift,3.0,"Jan 26, 2024","you can learn commincation, the working environment is really good",sometimes they allocated over task to complete,"Omega Healthcare Investors, Inc.",OHI,Health Care,2025-11-20,https://www.glassdoor.com/Reviews/Omega-Healthcare-Reviews-E326877.htm
Medical coding,3.0,"Feb 8, 2024",Good company grow in medical coding field,Overall poor work life balance,"Omega Healthcare Investors, Inc.",OHI,Health Care,2025-11-20,https://www.glassdoor.com/Reviews/Omega-Healthcare-Reviews-E326877.htm
Good work environment,4.0,"Jan 11, 2024","Professional, good work place, hygienic canteen, management support","Less salary, target pressure, No rewards or recognition","Omega Healthcare Investors, Inc.",OHI,Health Care,2025-11-20,https://www.glassdoor.com/Reviews/Omega-Healthcare-Reviews-E326877.htm
One of the Best BPO Insurance,5.0,"Jan 8, 2024",Challenging environment with best people.,None so far actually because it is a healthy environment.,"Omega Healthcare Investors, Inc.",OHI,Health Care,2025-11-20,https://www.glassdoor.com/Reviews/Omega-Healthcare-Reviews-E326877.htm
About Omega Healthcare,4.0,"Dec 21, 2023",Working environment and HR policy,Worst behavior from team lead and Assistance manager they are treating users like a slave.,"Omega Healthcare Investors, Inc.",OHI,Health Care,2025-11-20,https://www.glassdoor.com/Reviews/Omega-Healthcare-Reviews-E326877.htm
