title,rating,date,pros,cons,company,ticker,property_type,scrape_date,glassdoor_url
Good Company,5.0,"Oct 10, 2025",Good company & a good team.,No complaints at this time.,"Essex Property Trust, Inc.",ESS,Residential,2025-11-20,https://www.glassdoor.com/Reviews/Essex-Property-Trust-Reviews-E3630.htm
Short-Term Thinking at the Top,1.0,"Nov 16, 2025",Kind people working in Property Operations,"My experience at this organization was defined by instability and constant disruption. Strategic direction shifted so frequently that it was difficult to understand what the company truly wanted to achieve. Major structural decisions were rolled out with confidence and then reversed not long after, leaving employees feeling like they were constantly rebuilding their foundation. Department changes, role reshuffling, and reorganizations happened so often that they began to feel like the norm rather than a response to actual business needs. These shifts rarely seemed to solve the challenges employees were facing, and instead added new layers of uncertainty and frustration. A strong push for positivity made it hard to have honest conversations about the impact of all this change. When concerns were raised, the response often emphasized personal resilience rather than addressing the underlying issues causing employee burnout and confusion. Over time, this approach felt more dismissive than supportive. The company talked a lot about growth, but the focus seemed to be on expanding the business rather than building the internal capacity required to support that expansion. In my experience, this led to heavier workloads, diminished work/life balance, and a noticeable strain on the quality of service employees were able to provide. Culturally, there was a clear disconnect between different parts of the organization. Corporate and Property Operations teams didn’t always feel aligned, and feedback from senior leaders often centered more on optics or messaging than on meaningful improvements to work quality. This created an environment that felt polished on the surface but lacked the genuine support employees needed day-to-day to grow and develop. Leadership frequently spoke about continuous improvement, but the endless cycle of restructuring and shifting priorities made it difficult to see any sustained progress. Instead, it created persistent change fatigue that made it hard to stay motivated or feel invested in the direction of the company. Overall, my time there left me feeling worn down and unsupported. The organization’s emphasis on rapid movement and financial outcomes seemed to outweigh the need for clarity, stability, and a healthy culture. Ultimately, the environment became too chaotic and discouraging for me to stay.","Essex Property Trust, Inc.",ESS,Residential,2025-11-20,https://www.glassdoor.com/Reviews/Essex-Property-Trust-Reviews-E3630.htm
Bait and Switch,1.0,"Oct 4, 2025",Cultivating a company in line with Essex’s true company culture and motivations.,"Essex Property Trust presents itself as a place of values and opportunity, but once inside, you quickly realize it is only a carefully crafted illusion. What feels like a promise of growth and community turns into a culture built on fear, silence, and betrayal. Leaders see mistreatment and refuse to act. HR and executives enable toxic behaviors instead of protecting employees. Disciplinary actions are handed out to silence voices rather than to fix real problems. Speaking up comes at the cost of your career, so most people learn to stay quiet and walk on eggshells every day. The focus is not on people but on numbers. Your loyalty, your effort, even years of service mean nothing if it does not serve the bottom line. Watching long-time, dedicated employees walk away is heartbreaking, yet leadership remains unmoved. This is not a company that values its people. It is a place where you are overworked, undervalued, and ultimately sacrificed for appearances. JUST TAKE TIME TO READ ALL THE PAST EMPLOYEE GLASSDOOR REVIEWS. If trust, respect, and culture matter to you, do not make the mistake of joining Essex.","Essex Property Trust, Inc.",ESS,Residential,2025-11-20,https://www.glassdoor.com/Reviews/Essex-Property-Trust-Reviews-E3630.htm
Solid company with great benefits,4.0,"Nov 13, 2025",401k match Fair pay for management positions Housing discounts Medical insurance Promotion possibilities Leadership programs,Non-management wages not great Frequent changes in SOP (in response to post-covid issues),"Essex Property Trust, Inc.",ESS,Residential,2025-11-20,https://www.glassdoor.com/Reviews/Essex-Property-Trust-Reviews-E3630.htm
Beyond draining,2.0,"Nov 6, 2025",fun coworkers and majority amazing managers (not sales),"you’re drained & sitting in front of a computer for 8+ hours, expected to get yelled at w no issue and no form of resolution as we’re not on site to truly assist","Essex Property Trust, Inc.",ESS,Residential,2025-11-20,https://www.glassdoor.com/Reviews/Essex-Property-Trust-Reviews-E3630.htm
RUN! ESSEX HATES THIER EMPLOYEES,1.0,"Jun 4, 2025","I would say the benefits, but as I shop other companies in the industry they offer the same IF NOT BETTER!","Let me start off by saying only work for this company if you hate yourself, You love to be over worked, underappreciated and work in a constant state of fear that you won’t have a job because upper management has no idea what they are doing but are so quick to write up people and fire them. You are more of a call center agent than a “leasing agent”. They evaluate you based on inaccurate reports and numbers. They do not care about the customer experience. You have 3 other departments that handle and/or have an impact on your applicants and when things go wrong within those departments and a lease cancel only the leasing agent is held accountable. When brought to management their response is “get more applications to make up for the canceled applicants” Every employee in every department is OVER WORKED AND STRESSED! Essex has “Core values” but really the only thing they stand by is running good employees into the ground and retaliating on those who speak up and call out the favoritism that happens ON ALL LEVELS! Essex is known for letting the higher ups hirer friends from former companies WHO HAVE NO IDEA WHAT THIS INDUSTRY IS AND HOW IT WORKS. UPPER MANAGEMENT DOESN’T HAVE THE SLIGHTEST IDEA WHAT THEY ARE DOING.","Essex Property Trust, Inc.",ESS,Residential,2025-11-20,https://www.glassdoor.com/Reviews/Essex-Property-Trust-Reviews-E3630.htm
Horrible Management,1.0,"Jun 30, 2025",Benefits package included in role,"Absolutely no support or empathy from managers. Other employees had to train new hires without extra pay. Managers took PTO whenever they wanted, came in late, left early, but had a problem with anyone else taking a day off, even with emergencies, they have zero empathy. Rules of the company are not explained but expected to be followed and you will be publicly shamed for it as a “reminder” even after one private talk, they’ll bring it up again. Absolutely zero training due to managers’ lack of knowledge themselves — even if you ask them a question, they’ll tell you to ask someone else but have performative proactive “teamwork” in front of their own higher ups. Managers play favorites and create a major toxic environment with the way they gossip nonstop about everyone instead of working, extremely unprofessional. HIGHLY discourage anyone from applying here, they will literally look for issues in you without doing any work themselves. Manager intentionally excludes others and doesn’t maintain professionalism with favorites.","Essex Property Trust, Inc.",ESS,Residential,2025-11-20,https://www.glassdoor.com/Reviews/Essex-Property-Trust-Reviews-E3630.htm
"Middle of the pack, not amazing, but not bad either. Also please don't remove my review this time",3.0,"Oct 16, 2025","- Good place to begin career
- Flexible work location","- Turnover seems high
- Industry is not exactly cutting edge","Essex Property Trust, Inc.",ESS,Residential,2025-11-20,https://www.glassdoor.com/Reviews/Essex-Property-Trust-Reviews-E3630.htm
Toxic toxic toxic,1.0,"Jul 4, 2025",Time off. Sick time. Housing discount.,"Where do I even begin? During my time there, I witnessed and experienced so much that I ultimately felt I had no choice but to leave. The environment was extremely toxic—riddled with favoritism and internal politics. Leadership was controlling, and it often felt like decisions were made unilaterally, with no room for collaboration or dissent. If you weren’t in the inner circle, your chances for advancement were slim to none. There were serious instances of unprofessional behavior that went completely unaddressed. One employee, visibly intoxicated at a public event, made an inappropriate comment to a senior team member—and faced no consequences. That same individual continues to receive benefits, including designated housing, despite not holding a position that qualifies for it. Additionally, there were troubling claims about a family member of leadership being fast-tracked for low-income housing. If the City of Santa Clara were made aware, it would raise serious concerns. In the end, I chose to walk away—even from a bonus—because staying simply wasn’t worth the toll it was taking. That should speak volumes.","Essex Property Trust, Inc.",ESS,Residential,2025-11-20,https://www.glassdoor.com/Reviews/Essex-Property-Trust-Reviews-E3630.htm
Company no longer cares about their employees,1.0,"Jul 24, 2025",Not many but there's healthcare and paycheck comes on time,"•Laying off lots of people but they keep buying new buildings •Overworking employees and piling on more work without increase pay •Work is added that is outside your position/role and they do not care and will not compensate •Management sucks •Petty incompetent managers that lack leadership skills or even basic human skills •Higher ups and managers allow workplace bullying •You cannot get a hold of HR through an email or phone call. You have to submit a ""service ticket"" and wait days or longer for a response. They avoid answering questions. The response will be a generic cold unhelpful response. If you ask them to elaborate or paraphrase in simpler words they will not. •Company culture rapidly declined after new CEO took over Angela Kleiman •Cheap, less raises, bonuses paid late, less company events •Terrible business practices for both employees and external parties •The list is endless","Essex Property Trust, Inc.",ESS,Residential,2025-11-20,https://www.glassdoor.com/Reviews/Essex-Property-Trust-Reviews-E3630.htm
Changed,1.0,"Oct 14, 2025",Co-workers are the only upside,"Everything is wrong with this company, especially management","Essex Property Trust, Inc.",ESS,Residential,2025-11-20,https://www.glassdoor.com/Reviews/Essex-Property-Trust-Reviews-E3630.htm
The culture has changed,1.0,"May 28, 2025",The benefits and my team,"The culture has shifted immensely since the turnover in our senior leadership. They are asking too much of managers that prevent them from being effective leaders and support for the teams. They have created an operating model with far too many hands in one pot and there is little to no effective communication between departments. There is an emphasis on customer sentiment, but what our customers are asking for is an on-site presence again. And that is the one thing we are not going to do for them. So our operations team continue to fight what feels like a losing battle. There appear to be too many egos involved in decision making and the focus on associate engagement has completely switched to profit, profit, profit.","Essex Property Trust, Inc.",ESS,Residential,2025-11-20,https://www.glassdoor.com/Reviews/Essex-Property-Trust-Reviews-E3630.htm
Great Place to Work,5.0,"Sep 3, 2025","Work life balance 
Events
Team",You’re pretty much on your own.,"Essex Property Trust, Inc.",ESS,Residential,2025-11-20,https://www.glassdoor.com/Reviews/Essex-Property-Trust-Reviews-E3630.htm
Toxic Mess,1.0,"Jul 14, 2025","You’ll likely build strong bonds with a few trusted colleagues—the kind of connection that forms when you're both sitting through yet another ""urgent"" coffee talk announcing sweeping changes and silently wondering, Is this normal? That shared glance might just spark a real friendship. This is also a place where you’ll stretch beyond your comfort zone—because you’ll have to. With frequent departures and minimal backfilling, it's common to inherit new responsibilities with little warning or training. The upside? You may uncover strengths or skills you didn’t know you had. The downside? Those added duties rarely come with a raise or the bandwidth to do them well. Still, the experience may serve you down the line, especially if you're looking to build a broader résumé.","The cultural decline has been noticeable—and fast. As the CEO advanced through the organization, the environment shifted dramatically and negatively. Over the past year, turnover has surged at every level, with an unsettling number of long-tenured leaders either quietly “retiring” or being replaced by individuals with little relevant experience. Key roles in operations, HR, and asset management and development have seen abrupt transitions, often filled by candidates whose backgrounds raise questions. A number of experienced people were forced out or left with weird changes at the top; HR leadership shifted from a respected people-first HR head to CAO with minimal change management experience who lacks an understanding of the human element of HR. Operational oversight is murky at best, with no clear leadership—and it shows. Operations leaders continue to disappear in emails described as more ""retirements"" and more operations people in the maintenance and day to day functions have departed or been fired. No one seems to be able to make a decision about how to best serve residents with the strategy in constant flux. In all functions, respected people up and down the corporate ladder keep departing and no one is asking why. Or no one cares to ask why since people know. The resulting instability has triggered a cascade of confusion. Departments are in a constant state of reorganization, institutional knowledge is rapidly disappearing, and employees—both corporate and onsite—are left guessing at basic processes. Communication is fragmented, and getting clear answers often feels like running in circles. Morale has declined sharply, especially among onsite teams who are left to manage resident frustration without adequate support. Longstanding mid-level contributors—the ones who actually understand the work—are leaving, either by choice or force. Meanwhile, decisions appear reactive and disconnected from operational reality. The internal atmosphere is tense. Open dialogue is discouraged, and there’s a widespread fear of speaking up, even over obvious dysfunction. It's a place where silence is the safest strategy and job hunting is a shared undercurrent. Many recent reviews echo the same sentiment: toxic, unstable, and disorienting.","Essex Property Trust, Inc.",ESS,Residential,2025-11-20,https://www.glassdoor.com/Reviews/Essex-Property-Trust-Reviews-E3630.htm
Best Recruiting experience,5.0,"Jul 9, 2025",Crystal Haylock went above and beyond with clear communication and represents the company very well. She is professional and sincere. She made my recruiting experience smooth and is an amazing recruiter to interact with.,There are no cons at this time,"Essex Property Trust, Inc.",ESS,Residential,2025-11-20,https://www.glassdoor.com/Reviews/Essex-Property-Trust-Reviews-E3630.htm
It gets better and better as time goes on while working here,4.0,"Jan 12, 2025",People that work in company are very professional yet personal in a good way as well. Hospitality when joining company is 5 stars. I very much appreciate the people I work with.,"I was told benefits were outstanding and top notch comparing to market but it really doesn't feel like it at all cus the prices they charge for benefits are very high and the company contribution is next to none, few cent on a the dollar at best. They just offer u alot of options and various type but you have to pay for them w/o company contributions, pretty much feel like they trying to sell u different types of benefits","Essex Property Trust, Inc.",ESS,Residential,2025-11-20,https://www.glassdoor.com/Reviews/Essex-Property-Trust-Reviews-E3630.htm
Retaliation,1.0,"Oct 18, 2024",Some team members are great,"Essex has become a place where there is a fear of leadership and speaking up. Instead of feedback being received by managers, you are essentially penalized for giving feedback. They took away “refresh days” due to staff complaining that the workload was too high to ever utilize them. Every manager, except maybe two I’ve encountered, is unprofessional with minimal skills in actually leading a team. Managers are afraid to speak up for their teams due to fear of retaliation from corporate. I’ve had team members break down and cry due to the increased workload. My advice to my coworkers who are struggling is to remember that this is just a job, and there are plenty of other companies that will treat you with respect and value work-life balance. The constant restructures always seem to cut frontline staff. It’s always been about profit, but now it feels like it’s profit over the well-being of seasoned employees. The compensation doesn’t even match the demands of the job. HR will probably respond to these reviews with ChatGPT-generated responses, which shows how little they care.","Essex Property Trust, Inc.",ESS,Residential,2025-11-20,https://www.glassdoor.com/Reviews/Essex-Property-Trust-Reviews-E3630.htm
Used to be a great company,1.0,"Oct 2, 2024",Great benefits and bonus structure.,"As a long-term employee it pains me to write this. Essex use to be a great company but it has dramatically declined over the past year. Essex embodies a dynamic and fast-paced work environment, requiring individuals to excel in multitasking and maintain peak performance. Decision-making is predominantly driven by strong top-down leadership; however, transparency regarding the rationale and anticipated outcomes is limited. The Vice Presidents often operate behind the scenes like the enigmatic figure of Oz, making decisions with limited receptivity to feedback and a tendency to assign blame swiftly in case of setbacks. In recent times, some of the most respected senior leaders have either resigned or been laid off, leaving behind a group of ""yes"" men who now run the show. These individuals often fail to work a full day or take accountability for their actions, yet they excel at talking a good game and maintaining appearances. This shift in leadership has further contributed to the top-down, opaque decision-making culture, creating an environment where genuine leadership and responsibility are increasingly rare.","Essex Property Trust, Inc.",ESS,Residential,2025-11-20,https://www.glassdoor.com/Reviews/Essex-Property-Trust-Reviews-E3630.htm
,4.0,"Aug 4, 2025",Good training and office environment,Dangerous community issues with homeless breaking in or gang activity,"Essex Property Trust, Inc.",ESS,Residential,2025-11-20,https://www.glassdoor.com/Reviews/Essex-Property-Trust-Reviews-E3630.htm
Great Place To Work!,5.0,"Oct 23, 2024","Essex has not only provided me with a platform to grow professionally but has also fostered a strong sense of community among its employees. The collaborative spirit and camaraderie that exist here make it a unique workplace. I’ve had the pleasure of mentoring new team members, helping them navigate their paths within the company, just as others did for me when I first started. The training programs and development initiatives at Essex are top-notch, ensuring that every employee has the resources and guidance needed to excel in their roles. I truly believe that the investment Essex makes in its people is what sets it apart from other companies in the industry. As I look toward the future, I am excited about the potential for growth and innovation within Essex. With the ever-evolving landscape of our industry, I am confident that the company will continue to adapt and thrive, providing us all with new challenges and opportunities to conquer. In conclusion, I would encourage anyone who is passionate about their career and seeks a supportive environment to join us at Essex. It has been an incredible journey for me, and I am eager to see where the next 16 years will take us!",No cons come to mind. 16 great years of service and looking forward to many more!,"Essex Property Trust, Inc.",ESS,Residential,2025-11-20,https://www.glassdoor.com/Reviews/Essex-Property-Trust-Reviews-E3630.htm
You suck,2.0,"May 21, 2025",Pay and benefits are ok,They don't care about you as a human. Want robots 🤖 to not have any opinions.,"Essex Property Trust, Inc.",ESS,Residential,2025-11-20,https://www.glassdoor.com/Reviews/Essex-Property-Trust-Reviews-E3630.htm
STAY AWAY,1.0,"Jul 29, 2025",Not a good company for a professional,"Biased, Unprofessional, Promises With No DELIVERY","Essex Property Trust, Inc.",ESS,Residential,2025-11-20,https://www.glassdoor.com/Reviews/Essex-Property-Trust-Reviews-E3630.htm
"New CEO, New Focus - Not what it used to be",2.0,"Mar 4, 2025","Benefits: Great benefits including incentives to lower premiums. Multiple options and ala carte selections Financial Stability: As a publicly traded company, Essex maintains a strong focus on financial performance. People: Many really great people within the organization","Poorly Managed Changes: During the pandemic, Essex implemented rapid changes without fully considering their impact or ensuring adequate resources. Leadership Shift Issues: The transition of the CFO to CEO resulted in a leadership style that prioritizes financial performance over company culture. Eroding Company Culture: The once collaborative and employee-focused environment has deteriorated. Layoffs & Increased Workload: A significant number of layoffs in the past year have left remaining employees overburdened and struggling with morale. Loss of Trust in Leadership: Employees feel a disconnect between leadership’s words and actions, leading to diminished trust in both senior and middle management.","Essex Property Trust, Inc.",ESS,Residential,2025-11-20,https://www.glassdoor.com/Reviews/Essex-Property-Trust-Reviews-E3630.htm
Essex Does Not Care About You,1.0,"Apr 24, 2025","Dental, Medical, FSA, Vision benefits. Also your team, you will have the best people working alongside you whether in sales, maintenance or resident relations. They are the ones on the floor working alongside you and supporting you.","Corporate is now numbers/metric driven. Which all companies are however it is now blinding their own company visions on Care About What Matters, Act With Integrity, etc, and expect their employees to follow their vision, when they don't follow it themselves. Ever since 2020 as well as when orignial CEO Mike Schall retired, Essex has drastically changed the way they treat their employees with unrealistic office conditions and relocations, reducing maintenance/office positions and not backfilling the positions in which support is needed, lack of support in departments that have roaming managers, There is no longer opportunities to grow, you are stuck in the department you are in and even the benefits of being a manager are not worth the stress or compensation. They even took away an additional incentive of extra PTO, their reasoning because many couldn't use it BECAUSE they were stressed on workload and taking time off meant things wouldn't get done. Employee housing/parking increases with little to no increase at the end of 2024. Other departments are being continuously pressured and questioned (micromanaging) to care about the spending of the communities whether it is repairs, projects, unit turnovers at the expense of the quality given to residents. There is no positive incentive to be a part of this company and many are looking elsewhere.","Essex Property Trust, Inc.",ESS,Residential,2025-11-20,https://www.glassdoor.com/Reviews/Essex-Property-Trust-Reviews-E3630.htm
,3.0,"Jun 7, 2025",Some good leaders and loyal co workers,Associates are not valued or compensated fairly.,"Essex Property Trust, Inc.",ESS,Residential,2025-11-20,https://www.glassdoor.com/Reviews/Essex-Property-Trust-Reviews-E3630.htm
Load of Politics,3.0,"Jun 6, 2025",Good pay and job stability,Had to deal with a lot of behind the scene politics,"Essex Property Trust, Inc.",ESS,Residential,2025-11-20,https://www.glassdoor.com/Reviews/Essex-Property-Trust-Reviews-E3630.htm
Seriously The Worst Company I've Ever Worked For,1.0,"May 26, 2025","Long company history, stable industry",Incredibly toxic culture driven by the CEO and her dysfunctional leadership team. HR is a joke. Company is just concerned with money at the expense of its people and communities.,"Essex Property Trust, Inc.",ESS,Residential,2025-11-20,https://www.glassdoor.com/Reviews/Essex-Property-Trust-Reviews-E3630.htm
