title,rating,date,pros,cons,company,ticker,property_type,scrape_date,glassdoor_url
Fired for reporting fraud,1.0,"Apr 9, 2023",I can't think of any ...,"I got fired after reporting three incidents where a colleague promoted properties through false advertising to collect commission fees. Even though my colleague didn't create the listings herself, she would mislead applicants by claiming that the properties where of different units, without actually scheduling any in-person visits. I had report this because my colleague was fully aware of the fraudulent process and was using it to keep applicants' applications open.","Essex Property Trust, Inc.",ESS,Residential,2025-11-20,https://www.glassdoor.com/Reviews/Essex-Property-Trust-Reviews-E3630.htm
"""Opportunity Knocks""",3.0,"Jan 17, 2018",Supportive and loyal associates. Benefits.,Lack of advancement opportunities beyond Community Manager.,"Essex Property Trust, Inc.",ESS,Residential,2025-11-20,https://www.glassdoor.com/Reviews/Essex-Property-Trust-Reviews-E3630.htm
Interesting transition,3.0,"Jun 29, 2022","Full benefits, stability, teamwork, self growth","The roll out of asset collection really upset a lot of people, they didn’t like the fact that we were left in the dark about what was going on and it felt like a sink or swim kind of a thing. The belief of taking Sundays off thinking it would be good for the company puts the company in a bit of a bind especially when workers don’t get 2 consecutive days off having split days doesn’t really allow for a full recharge and the fact that PTO is needed to take 2 days off is super frustrating. It’s been said amongst some of the people that are not in a leadership position that it seems like the time of people in leadership roles are more important than those that continue to work hard to ensure that things run smoothly. I feel like while the roll out of asset collection could have been a great thing and the heart was there, transparency is super important.","Essex Property Trust, Inc.",ESS,Residential,2025-11-20,https://www.glassdoor.com/Reviews/Essex-Property-Trust-Reviews-E3630.htm
Great company,5.0,"May 23, 2023",Good benefits and very stable work environment.,"Not much upwards mobility. If you want to grow in sales, this is not the place.","Essex Property Trust, Inc.",ESS,Residential,2025-11-20,https://www.glassdoor.com/Reviews/Essex-Property-Trust-Reviews-E3630.htm
Best company I've worked for,5.0,"Jun 6, 2023",Salary and benefits are good. Co workers are great to work with.,No cons that I can think of.,"Essex Property Trust, Inc.",ESS,Residential,2025-11-20,https://www.glassdoor.com/Reviews/Essex-Property-Trust-Reviews-E3630.htm
"Finally, work life balance exists in this industry!",5.0,"Jan 25, 2022","Essex has figured “It” out! Associates want to be empowered, teams want to be heard and managers want to lead. Happy people preform and as a Community Leader I am empowered and trusted to run my sector of the business by way of providing great service, innovation, collaboration, skill, meaning and laughter! But all seriousness if you have an entrepreneurial spirit this is a company for you to thrive! Be unapologetically YOU while improving and developing your skills which will translate into creating value for your teams, residents and shareholders. Essex truly cares about its associates and they really “put their money where their mouth is” in Q4 2021 with a week full of giving back to site teams.","If you are not professionally ready to turn the good, bad and ugly into success, opportunities and lessons learned rethink starting a career with Essex. We need self development, reflection and accountability to be a noticeable value which means getting comfortable with the not-so comfortable at times. You will be expected act with integrity no mater how challenging it may be. This is not a CON for me but it could for some so just throwing that out there.","Essex Property Trust, Inc.",ESS,Residential,2025-11-20,https://www.glassdoor.com/Reviews/Essex-Property-Trust-Reviews-E3630.htm
"Not a bad company to work for, but there are a few flaws.",4.0,"Jan 18, 2012",-Decent pay/commission based compensation structure. -Some flexibility with time off. If you need to take vacation you can ask employees from sister properties to cover for you. -Bonuses offered to lease longstanding vacant apartments. -Sense of team spirit. -Professional environment. -They reimburse you for laundry (Essex apparel only) -Good experience. -Job security (so long as you meet your goals of course),"They overwork employees. There is not enough staff. I refuse to believe they can't find people to hire. They just milk their employees and expect the same high level of work output with only 3/5th the staff. They hire and promote people who are related to or are friends with a current employees. Not a huge con but they do this a lot and then end up hiring relatively incompetent/under qualified people. Huge salary cuts recently, while, I'm sure upper management saw raises. They try to squeeze every last penny out of residents from their security deposit to make up for vacancy loss caused by their own ill model.","Essex Property Trust, Inc.",ESS,Residential,2025-11-20,https://www.glassdoor.com/Reviews/Essex-Property-Trust-Reviews-E3630.htm
Management,4.0,"May 25, 2023",Great leadership. does not micromanage. allow open door policy if needed to talk,offer more food/drinks on a weekly basis,"Essex Property Trust, Inc.",ESS,Residential,2025-11-20,https://www.glassdoor.com/Reviews/Essex-Property-Trust-Reviews-E3630.htm
Do not work here unless you have no self worth,1.0,"Sep 4, 2014",None...don't work here if you value your sanity.,"I have multiple degrees, but because I don't fit a certain ""look"", I've been passed up for promotions many times. My property outperforms other properties financially, and I have assisted other communities when there were position vacancies. However, my efforts were not rewarded financially or even with a 'Thank You'. The leasing staff is severely underpaid and the Essex bonus program is a joke compared to its competitors. My regional manager is obviously responsible for multiple communities, which prevents him/her from being able to visit every property weekly. However, my manager hasn't visited my property in 3 months. This means he/she doesn't know what is going on at the community, and he/she doesn't have a pulse on what's needed for the community. It's extremely difficult to get support to hire staff, which leaves a heavier burden on current staff to do more work with no additional pay.","Essex Property Trust, Inc.",ESS,Residential,2025-11-20,https://www.glassdoor.com/Reviews/Essex-Property-Trust-Reviews-E3630.htm
They have a bad rep for a reason!,1.0,"Dec 3, 2015","Good employee housing discount, fun company events, good benefits.","I worked for a short time for BRE before the company was bought out by Essex. Throughout the merge there was slim to no training on the new applications, no support from the Essex team and a HUGE cut in most employees income. I've had a negative experience from the start of the merge with Essex. Unless you're close with someone in the corporate office it's very unlikely that you will get promoted. The pay isn't great because if you go just about anywhere else they will offer you not only more hourly but pay more for commission which is where us leasing consultants actually make our money. The new employees were trained very poorly and had no idea what to do or how to use any applications once on site. They basically spend a day or two with the new hires and then send them out with no knowledge of how to use basic computer applications and no clue how to lease an apartment. Now that I have experienced what it's like to work for a company that actually takes pride in their employees and has training designed to teach and benefit their new employees I realize what a negative experience it was to work for Essex. Also they critique your every move and when you score a great score on a secret shop you receive no recognition nor any incentive. Change isn't always a bad thing but when you're working blindly and have no support from the corporate team it makes it extremely difficult to do your job. What a shame!","Essex Property Trust, Inc.",ESS,Residential,2025-11-20,https://www.glassdoor.com/Reviews/Essex-Property-Trust-Reviews-E3630.htm
You will be treated like pond scum!,1.0,"Jul 25, 2014",They offer benefits. There are alot of employees that will feel the same way as you will. There is very little pros about this company.,They do not give competitive wages. You will be overlooked for raises and will constantly be reminded how much money they are making but they won't share it with you. They do not provide training! They like to hire managers who don't want to work and could care less about their properties. The little people work the hardest but corporate doesn't care enough to research it for themselves because they are money hungry and forgot it's the little people who make the difference. If you complain about your mistreatment everyone will know about it and it will be turned against you. They are losing employees left and right because they do not value them at all and don't try and keep them either or find out why thet are leaving.,"Essex Property Trust, Inc.",ESS,Residential,2025-11-20,https://www.glassdoor.com/Reviews/Essex-Property-Trust-Reviews-E3630.htm
Overworked and Undervalued,1.0,"Nov 3, 2017",Benefits are really the only thing that Essex has to offer. The company functions a couple times a year don't really do much to create a sense of community but it is a little something to look forward to.,"The entire system is broken. So many fragmented departments and nobody has answers for on site staff so it is almost impossible to genuinely provide efficient customer service. Associates are so overworked, enjoyment in the workplace is non-existent and you can forget about really having the time to build connections with residents because of the never ending deadlines and inefficient systems. Constant turnover because of unhappy employees and it is detrimental to the properties and residents. Upper management is hands off and condescending and pride themselves in ruling through fear. Corporate talks of empowering their onsite staff but really that is code for overworking them. Regional Managers have been witnessed being flat out disrespectful and abrasive to vendors and managers in front of their teams. It's a disorganized and hostile environment that needs to be addressed. For such a high profile company to run this way is shocking. The dress code is also archaic especially when you note how the corporate staff dresses for work.","Essex Property Trust, Inc.",ESS,Residential,2025-11-20,https://www.glassdoor.com/Reviews/Essex-Property-Trust-Reviews-E3630.htm
Great place to work,5.0,"Apr 20, 2023","Strong management, team mentality, builds leadership, suports work life balance",none that I can think of,"Essex Property Trust, Inc.",ESS,Residential,2025-11-20,https://www.glassdoor.com/Reviews/Essex-Property-Trust-Reviews-E3630.htm
Grateful,5.0,"Apr 12, 2023","Essex Supports work life balance, career development, associate appreciation, and they constantly looks for way to improve the employee and customer experience",I have none to share,"Essex Property Trust, Inc.",ESS,Residential,2025-11-20,https://www.glassdoor.com/Reviews/Essex-Property-Trust-Reviews-E3630.htm
Wonderful Company,5.0,"May 11, 2023","Growth, benefits, compensation, team comradery, technology.",There are no cons at this time,"Essex Property Trust, Inc.",ESS,Residential,2025-11-20,https://www.glassdoor.com/Reviews/Essex-Property-Trust-Reviews-E3630.htm
One of the best REITs,5.0,"May 21, 2020","I’m fortunate to work with some of the most amazing people who care deeply about doing the right thing and making a great experience for our residents. Essex fosters a strong team environment. I have a supportive Regional Manager who empowers her associates to make the best business decisions for their properties. I have a talented peer group that reaches out to each other with questions, to brainstorm or just make plans for happy hour. If there is an issue in an apartment or with our buildings, we fix the issue and not just bandaid it. We are rolling out new technologies like SmartRent and Sightplan to be more efficient and create a better experience for our residents. During the pandemic we have adapted and offer self guided tours, FaceTime or zoom tours and virtual tours through our website. My salary is competitive and the bonus program is helpful especially now that it’s paid on a quarterly basis. I’ve worked with other large REITS, small start ups and privately held management companies and this is one of my favorite jobs.","Things move fast and you must be prepared to think on your feet, adapt and move quickly and it’s not the right environment for everyone. If your building is underperforming, be prepared to work long hours and weekends until it is.","Essex Property Trust, Inc.",ESS,Residential,2025-11-20,https://www.glassdoor.com/Reviews/Essex-Property-Trust-Reviews-E3630.htm
Leasing Specialist,3.0,"Mar 26, 2018","Essex offers a great and pleasant work environment. Very nice co-workers ( for the most part). Benefits package is good and they also have a few perks through the company, like discounted movie tickets. They also have special events to recognize their employees such as, a picnic, awards gala and if you do something above and beyond the norm, you earn company points that you can use with some large retailers or even Amazon! They also offer their employees' lots of training! I love the culture of the company! I have worked for a lot of big companies throughout the years and Essex is in the top 3!","I hate that corporate makes us wear uniforms! I find it antiquated and too stuffy. They do give you $400 worth of free clothes per year, but I can help but feel uniform reminds me of a target employee! (no offense to Target) For god sakes people, this is the 21'st century! The pay is ok if you negotiate well when being hired, but if not they will lowball you. But I think this would be any company, not just Essex!","Essex Property Trust, Inc.",ESS,Residential,2025-11-20,https://www.glassdoor.com/Reviews/Essex-Property-Trust-Reviews-E3630.htm
Essex Cares,4.0,"Mar 3, 2023","Great support, clear policies, structured company with inclusivity and work/life balance near the top of their list for employees.","In adjusting to Sunday closures company-wide, split days off have become an issue, taking away from work-life balance, tremendously.","Essex Property Trust, Inc.",ESS,Residential,2025-11-20,https://www.glassdoor.com/Reviews/Essex-Property-Trust-Reviews-E3630.htm
Great growth opportunities and caring company!,5.0,"Mar 4, 2023",Work life balance Compensation/benefits Great management team,"Not many downsides, pay could be better compared to competitors but overall it’s great.","Essex Property Trust, Inc.",ESS,Residential,2025-11-20,https://www.glassdoor.com/Reviews/Essex-Property-Trust-Reviews-E3630.htm
Feeling Valued,5.0,"Dec 20, 2021",I love working for a company like Essex!! Being part of the team for 10 years I have not stopped being surprised about the way they care about what matters. What matters most to Essex is the people that work for them. 2020 and 2021 were though years for all of us and Essex stepped up to the plate and never stopped making sure the associates stayed safe. I could worry about a lot of things but my employment was not something I worried about. Essex has adapted to the fast changing environment and is now more than ever providing all of us with new career paths. Always moving forward and pushing their associates to grow with the company is one of the many things I love about Essex!,"If I had to share a downside about Essex, it would be lack of talent assessment current associates go through. Yes, we have meeting and yearly assessments with our immediate managers, but we aren't given clear and consistent path to get to where we want. Upcoming opportunities are not communicated to the current employees first, if you are not constantly looking at the open position report, you may miss an opportunity you are waiting for.","Essex Property Trust, Inc.",ESS,Residential,2025-11-20,https://www.glassdoor.com/Reviews/Essex-Property-Trust-Reviews-E3630.htm
Great Leadership,5.0,"Apr 12, 2023",Motivates and encourages associates to reach and exceed their full potential.,Minimal positions open for current and new employees.,"Essex Property Trust, Inc.",ESS,Residential,2025-11-20,https://www.glassdoor.com/Reviews/Essex-Property-Trust-Reviews-E3630.htm
No communication,2.0,"Apr 9, 2023",Lots of People to work with,"Pay is low, communication with residents is low, communication with employees is low","Essex Property Trust, Inc.",ESS,Residential,2025-11-20,https://www.glassdoor.com/Reviews/Essex-Property-Trust-Reviews-E3630.htm
Like rats off of a sinking ship,2.0,"Jun 23, 2014","The residents can become lifelong friends. Most of your coworkers are going to be some amazing people. This is the perfect company if you hate having a moment to finish a project or pee. I'm genuinely so busy that I forget that I have to pee. There are opportunities to move up with enough experience. That is, if you can last long enough without having a mental breakdown.","They expect the work of 3 people for the price of 0.8 people. They under staff their properties and then get angry when the properties don't meet expectations. Rules and management change weekly. You are constantly being pulled in a million different directions, but there is never enough time to finish half of the projects that you've started. You end up coming in early and staying late everyday even though they don't offer overtime (They discourage this, but sometimes it's the only way to finish a project). It takes 2 hours to write a simple email. I don't even make enough to live at any of our properties.","Essex Property Trust, Inc.",ESS,Residential,2025-11-20,https://www.glassdoor.com/Reviews/Essex-Property-Trust-Reviews-E3630.htm
Lease,4.0,"Mar 4, 2023",Environment is great within the company.,"Pay structure and employee housing discount 20% for most, from market rates also must pay parking rates.","Essex Property Trust, Inc.",ESS,Residential,2025-11-20,https://www.glassdoor.com/Reviews/Essex-Property-Trust-Reviews-E3630.htm
THIS is THE Place To Grow Your Career,5.0,"Jan 6, 2022","This is a company that invests in its associates, and truly appreciates the people they employ. If you're looking to grow your career this is the company that will give you the tools and resources to make it happen! They have taken an innovative approach and leading the industry in todays new world with the business models they run creating and expanding opportunities to enhance and grow your career all while being mindful of equity and diversion all while understanding that work/life balance is so important to us all. They take a real interest in helping their workforce live a healthy balanced life while ensuring their associates know they are appreciated and valued.",The only downside would be in some positions Saturday work schedules are needed - but some people do like these options freeing up a day in the week to be off. Many of us would like the option of a 4 day week with 10 hour days - hopefully that may be in the pipeline somewhere.,"Essex Property Trust, Inc.",ESS,Residential,2025-11-20,https://www.glassdoor.com/Reviews/Essex-Property-Trust-Reviews-E3630.htm
Great experience,5.0,"Apr 4, 2023","Pay, people, work and culture",Not full time remote as an option,"Essex Property Trust, Inc.",ESS,Residential,2025-11-20,https://www.glassdoor.com/Reviews/Essex-Property-Trust-Reviews-E3630.htm
Good job,4.0,"Apr 7, 2023",Good company to work for,Stressful handling customer complaints and practices,"Essex Property Trust, Inc.",ESS,Residential,2025-11-20,https://www.glassdoor.com/Reviews/Essex-Property-Trust-Reviews-E3630.htm
Strong Leadership - Evolving Systems,4.0,"Apr 7, 2013","Well placed assets within their target markets. Most of the senior management is experienced, fair, and insightful. Good overall experience with the company and I enjoyed my time there.","Not many. I came into the company at a difficult time with some significant changes in the senior management which made it challenging, but must say that the reorganization was a function of needed changes and tremendous growth. There is a tendency within the leadership to allow ""management encroachment"" into other operational disciplines where some of the senior management is less experienced (e.g., non-REIT fund management oversight of Capital and Maintenance), and that encroachment was the reason for my decision to leave the company. It was unfortunate, because I really enjoyed working with the team there. Good assets, good people, and I expect that eventually, there will be better defined organizational roles and responsibilities.","Essex Property Trust, Inc.",ESS,Residential,2025-11-20,https://www.glassdoor.com/Reviews/Essex-Property-Trust-Reviews-E3630.htm
Essex is Revolutionazing the Property Management Model,5.0,"Apr 8, 2022","Essex Property Trust has taken a huge leap into the future by implementing a new way of operating our communities and overall business needs. Asset Collections is the name, and it has created specialized positions within our organization that assign staff to do what they are best at. Our communities are being grouped and staff assigned to manage specific tasks in a larger scale, allowing us to focus on what we are all good at and avoid being pulled in a hundred different directions as the traditional way of managing assets goes. Essex has also taken a great step in upgrading their compensation package. Through Asset Collections, a new pay structure has given us a more lucrative and competitive pay scale that show their appreciation for the employees. In 2022, Essex also pushed their life/work balance model to impressive levels, closing all offices on Sundays, providing us with additional time off, a National Parks Annual Pass and bonuses. Essex is taking pride in being a company driven by employee satisfaction. I welcome anyone to experience the future of Property Management with Essex.","Health insurance coverage has taken a few steps in the wrong direction, with premiums and copays going up.","Essex Property Trust, Inc.",ESS,Residential,2025-11-20,https://www.glassdoor.com/Reviews/Essex-Property-Trust-Reviews-E3630.htm
Great Workplace Culture that foster communication between teams and departments.,5.0,"Jun 22, 2020","-Great place to work and office encourages communication and team building between Accounting and other departments. -I was able to work in a great team that support each other and allow for flexible schedule when needed. -Management is adaptable. Adequate response during the Covid. Started with extra PTO for high risk employees and pre-planning work from home so that the disruption to work from home for office employees is minimal. -Annual award and team building events to help foster a closer working relationship with each other. -Office events like bagel Friday, monthly birthday celebration are great and allow me to interact with people from different departments. -They are working on documenting a lot of work process to help new hires. While it wasn't quite there when I joined, there is constant efforts to make improvements.","-Echoing another review, the compensation I think is quite competitive and there is annual growth in your wages. However, they are mostly incremental. But there is room for promotion and I have seem it happen quite often. But can take a while so make sure you give a fair assessment of your salary when you join and not undersell yourself.","Essex Property Trust, Inc.",ESS,Residential,2025-11-20,https://www.glassdoor.com/Reviews/Essex-Property-Trust-Reviews-E3630.htm
Inexperienced staff,2.0,"Mar 21, 2023","Decent pay, office is clean.",Disorganized leadership and inexperienced staff. Poor quality.,"Essex Property Trust, Inc.",ESS,Residential,2025-11-20,https://www.glassdoor.com/Reviews/Essex-Property-Trust-Reviews-E3630.htm
Don't care about people on site,1.0,"Aug 23, 2016","If you have the right boss, this is a great company to grow. - Managers and Supervisors agree that the best RPMS are the supportive ones that still hold accountable like Elizabeth Meadows, Christine Aiello, Joe Carpenter, Nick Allen and Lisa Scroggin. I had very good manager but she had no support and had to deal with crazy property on her own.  My RPM blame her instead of help her.  Properties everywhere Pays bills and keeps up with projects","-They change bonus structure in the middle of the year and most properties arent meeting budgets cause they base it on last year growth.  It's their way of not paying their hard workers. My RPM has the worse reputation among managers. He yells, throws under the bus, and sends mixed signals. He only responds to requests and issue if something his boss cares about.  HR is aware of so many complaints and they do nothing.  I had one of the best managers and I see her dealing with how he treats her. When you leave a RPM like that, you lose money.  No one is motivated to work hard for him.  He had a nice property and no managers that work for Essex want to go there because of him so he has to hire inexperienced only.  With no manager, and bad treatment, his properties will continue to lose money.","Essex Property Trust, Inc.",ESS,Residential,2025-11-20,https://www.glassdoor.com/Reviews/Essex-Property-Trust-Reviews-E3630.htm
