title,rating,date,pros,cons,company,ticker,property_type,scrape_date,glassdoor_url
Horrible,2.0,"Nov 8, 2021","People , experience, that is all","Pay, no promoting, you have pto but can’t use it, work every weekend even if staffing needs don’t call for it, no respect, corporate office has no experience onsite","Essex Property Trust, Inc.",ESS,Residential,2025-11-20,https://www.glassdoor.com/Reviews/Essex-Property-Trust-Reviews-E3630.htm
Property Manager,1.0,"Aug 17, 2016",Great technology and procurement,Bad management and weak HR system. No one cares about front lines employees,"Essex Property Trust, Inc.",ESS,Residential,2025-11-20,https://www.glassdoor.com/Reviews/Essex-Property-Trust-Reviews-E3630.htm
Good Company,5.0,"Jun 23, 2021","Great benefits, good management, organized company","Being where I wanted to be in the company was not possible, so unfortunately I had to move on. If you are not in Palo Alto, and want to be higher up in corporate, then you either have to move there or find a new job.","Essex Property Trust, Inc.",ESS,Residential,2025-11-20,https://www.glassdoor.com/Reviews/Essex-Property-Trust-Reviews-E3630.htm
Upper management does not care about employees! No matter what they say or represent to you.,1.0,"Jun 28, 2014",Small corporate environment no one knows what anyone is doing and how they matter to the bottom line.,Low pay. No one listens or wants your input. No one speaks to each other or cares about their work and if you contribute to the big picture. Overworked people that do not enjoy the work.,"Essex Property Trust, Inc.",ESS,Residential,2025-11-20,https://www.glassdoor.com/Reviews/Essex-Property-Trust-Reviews-E3630.htm
Just as good the second time around,5.0,"May 5, 2020","Supportive management, great colleagues, positive environment. Essex Property Trust team members are the best! I returned to Essex after a long hiatus and I am glad I did!",None that I can think of.,"Essex Property Trust, Inc.",ESS,Residential,2025-11-20,https://www.glassdoor.com/Reviews/Essex-Property-Trust-Reviews-E3630.htm
Essex Company Review,4.0,"Jul 11, 2021",Essex is a good company to work for because they are good with supporting their employees goals and promote from within.,"There is room to improve on annual raises, especially, for long term employees who are very dedicated to the company.","Essex Property Trust, Inc.",ESS,Residential,2025-11-20,https://www.glassdoor.com/Reviews/Essex-Property-Trust-Reviews-E3630.htm
Most progressive company I have worked for,5.0,"Aug 29, 2013",-Essex Training Academy -Great employees and positve atmosphere -Room for growth -Great mentorship program -Company picnics and awards ceremony -Lync-company IM system,- Hiring Process takes longer than most companies- too many open positions that cause stress on onsite team,"Essex Property Trust, Inc.",ESS,Residential,2025-11-20,https://www.glassdoor.com/Reviews/Essex-Property-Trust-Reviews-E3630.htm
It was so-so,3.0,"Aug 9, 2018",Loved the people I worked with. Paid holidays off,Pay wasn’t great. A lot of favoritism when it comes to “awards” and bonuses,"Essex Property Trust, Inc.",ESS,Residential,2025-11-20,https://www.glassdoor.com/Reviews/Essex-Property-Trust-Reviews-E3630.htm
Great Place to Work,5.0,"Apr 6, 2020","During this hectic and crazy time, Essex is doing right by its employee's. No one has been laid off and our jobs are currently secure while others may be faced with uncertainty. There have been clever viable solutions to make this happen.",I appreciate the efforts taken during these times,"Essex Property Trust, Inc.",ESS,Residential,2025-11-20,https://www.glassdoor.com/Reviews/Essex-Property-Trust-Reviews-E3630.htm
INCREDIBLE COMPANY,5.0,"Mar 18, 2021","Essex is an incredible company, there is opportunity to grow, inclusion, diversity and amazing benefits. This company really cares about their employees and does their best to be fair and give the best to their customers and employees. Very happy to be a part of this team.",I have no complaints about the company!,"Essex Property Trust, Inc.",ESS,Residential,2025-11-20,https://www.glassdoor.com/Reviews/Essex-Property-Trust-Reviews-E3630.htm
"Good, Well intentioned company",4.0,"Dec 16, 2021","Stable, small, willing to hear feedback and adapt to changes. Technology innovation in multi family real estate industry. Strong senior leadership. Open communication from senior leadership",Improve quality of property level management. Too directive and not supportive enough.,"Essex Property Trust, Inc.",ESS,Residential,2025-11-20,https://www.glassdoor.com/Reviews/Essex-Property-Trust-Reviews-E3630.htm
Essex Cares,5.0,"Dec 16, 2021",Essex has innovated programs made especially for it's employee's that shows they really care about them and the future.,"That the option to work from home will be no more in 2022, outside of the set hybrid schedule. With everyone going back on the exact same days seems like an outbreak waiting to happen.","Essex Property Trust, Inc.",ESS,Residential,2025-11-20,https://www.glassdoor.com/Reviews/Essex-Property-Trust-Reviews-E3630.htm
The Future Looks Good,5.0,"Feb 3, 2022",Essex is changing the way REITs do business. They are a progressive company focused on associates and their career growth. Senior leadership consistently continues to listen to feedback and works towards viable and innovative solutions. This is the place to be if you want to grow.,No comment at this time.,"Essex Property Trust, Inc.",ESS,Residential,2025-11-20,https://www.glassdoor.com/Reviews/Essex-Property-Trust-Reviews-E3630.htm
Great work life balance and room for growth,5.0,"Jun 15, 2022","Promotes work life balance, amazing benefits, competitive pay, cares about their associates, directs team to ""do what's right"", housing discounts, team outings, great place to meet good people!",I look forward to Essex's growth as a company and new positions that offer even more opportunity for growth!,"Essex Property Trust, Inc.",ESS,Residential,2025-11-20,https://www.glassdoor.com/Reviews/Essex-Property-Trust-Reviews-E3630.htm
Good Place,5.0,"Jun 22, 2020","Stable company with solid culture in place Knowledgeable people across the teams who I constantly learn from Dynamic and diversified company, great place to gain experience Company is trying to improve benefits, such as recent 401K match increase",No downsides as of now,"Essex Property Trust, Inc.",ESS,Residential,2025-11-20,https://www.glassdoor.com/Reviews/Essex-Property-Trust-Reviews-E3630.htm
Great and fun company to work at!,5.0,"Jun 30, 2020","People, Benefits, Wages, Rewarding Work.","Working weekends, great PTO for those very important weekends you need off!","Essex Property Trust, Inc.",ESS,Residential,2025-11-20,https://www.glassdoor.com/Reviews/Essex-Property-Trust-Reviews-E3630.htm
Great company to work for,5.0,"Jul 29, 2021",I've worked at other property management companies and so far Essex has a better work culture and environment than I've experience. They have several events for employees. Regional managers and senior leadership are supportive. Great pay and benefits. Lots of opportunity for career growth.,Couldn't think of any cons,"Essex Property Trust, Inc.",ESS,Residential,2025-11-20,https://www.glassdoor.com/Reviews/Essex-Property-Trust-Reviews-E3630.htm
It's an ok entry job. Hard to get promoted,4.0,"Aug 18, 2021",Easy work physically and flexible schedule. You learn on the job and have benefits. Positive environment.,The pay is pretty low for the work you are doing. You have to be on call 24 hours for emergencies and have to constantly deal with very upset residents.,"Essex Property Trust, Inc.",ESS,Residential,2025-11-20,https://www.glassdoor.com/Reviews/Essex-Property-Trust-Reviews-E3630.htm
Learning and Development,3.0,"Sep 28, 2022",Good leadership from the top Long-term employees,"A little organizationally disorganized There wasn't a strong company culture, mission, or reason for existing that could create a sense of belonging.","Essex Property Trust, Inc.",ESS,Residential,2025-11-20,https://www.glassdoor.com/Reviews/Essex-Property-Trust-Reviews-E3630.htm
Great Company.,4.0,"Mar 31, 2021","You will love the people you work with, the systems and processed are easy to use. there is plenty of opportunity for growth.","It can be difficult to work in property management when residents are struggling, at times you have to separate your heart from your mind.","Essex Property Trust, Inc.",ESS,Residential,2025-11-20,https://www.glassdoor.com/Reviews/Essex-Property-Trust-Reviews-E3630.htm
Excellent Company with Long Term Growth,5.0,"Apr 22, 2021","Exceptional COVID-19 management, true passion for their associates, care about health and wellness, and invested in long-term growth. Essex provides a rewarding environment and a warm generous culture. It has been a wonderful journey and I look forward to continued growth.",Nothing that comes to mind.,"Essex Property Trust, Inc.",ESS,Residential,2025-11-20,https://www.glassdoor.com/Reviews/Essex-Property-Trust-Reviews-E3630.htm
I love coming to work because of the family we created,2.0,"Oct 27, 2021",My Leaders always encourage me and acknowledge my hard work. Great work environment and work life balance,Not enough commission compared to the competitors. Not enough staff. We are all being overworked.,"Essex Property Trust, Inc.",ESS,Residential,2025-11-20,https://www.glassdoor.com/Reviews/Essex-Property-Trust-Reviews-E3630.htm
Big changes to come,3.0,"Jun 19, 2014",great options for growth if you do your job well know the right people. Good work/life balance as long as you don't live onsite.,Compensation is on the lower end across property management for many positions with caps for office/maintenance positions. Unmotivated commission structure,"Essex Property Trust, Inc.",ESS,Residential,2025-11-20,https://www.glassdoor.com/Reviews/Essex-Property-Trust-Reviews-E3630.htm
A Company Who Cares,5.0,"Apr 29, 2020","Essex has a culture of care for their employees, their residents and their communities. There is opportunity to learn, to grow and to challenge yourself.They offer a comprehensive benefits package, covering from medical to 401(k) benefits.",None that I can think of.,"Essex Property Trust, Inc.",ESS,Residential,2025-11-20,https://www.glassdoor.com/Reviews/Essex-Property-Trust-Reviews-E3630.htm
Growth and development,5.0,"Aug 1, 2021",This is a good company to grow with a lot of opportunity for movement.This is a good company to grow with a lot of opportunity for movement.,Lacks training and support to the onsite team. It would be helpful to have training programs for all positions.,"Essex Property Trust, Inc.",ESS,Residential,2025-11-20,https://www.glassdoor.com/Reviews/Essex-Property-Trust-Reviews-E3630.htm
Amazing company to work for!,5.0,"Jun 10, 2022",Strong sense of relationship building and a healthy work-life balance Friendly and outgoing team Well built training programs and initiatives,There are no cons so far!,"Essex Property Trust, Inc.",ESS,Residential,2025-11-20,https://www.glassdoor.com/Reviews/Essex-Property-Trust-Reviews-E3630.htm
Leadership is not Trustworthy,1.0,"Oct 1, 2015",Associates are great and work really hard. They have a need for connection to their leaders and want to excel.,Executive leaders are unprofessional and can not be trusted. They will undermine associates and are boastful about how great they think they are.,"Essex Property Trust, Inc.",ESS,Residential,2025-11-20,https://www.glassdoor.com/Reviews/Essex-Property-Trust-Reviews-E3630.htm
Great Company,4.0,"Apr 10, 2020","Essex is a fantastic place to work that has transparent leadership and an incredible company culture. The senior leadership team cares for their employees, always putting us first. Each day brings a new and exciting challenge. The focus on work life balance is incredible.",Different departments can communicate more effectively.,"Essex Property Trust, Inc.",ESS,Residential,2025-11-20,https://www.glassdoor.com/Reviews/Essex-Property-Trust-Reviews-E3630.htm
Couldn't be happier,5.0,"Nov 13, 2020","embraces change appropriately transparency is improving alignment to goals and values network of well-intended people wanting what is best for the organization, associates and residents alike",communication across cross-functional boundaries is lacking in pockets,"Essex Property Trust, Inc.",ESS,Residential,2025-11-20,https://www.glassdoor.com/Reviews/Essex-Property-Trust-Reviews-E3630.htm
"Women in leadership positions are extremely uninviting, judgmental, and create hostile environments",2.0,"May 25, 2021","Good benefits, fun culture, good pay","Not a lot of room for growth, they pride themselves on being fun compared to other companies in the area - but they should look at their leadership team as to whos representing the company.","Essex Property Trust, Inc.",ESS,Residential,2025-11-20,https://www.glassdoor.com/Reviews/Essex-Property-Trust-Reviews-E3630.htm
Work a lot not enough pay,2.0,"Sep 24, 2021",Meet some cool people. If you can afford their properties they are pretty nice.,Commission pay not great. Discount on rent is ok but their properties are pricey. Understaffed a lot!,"Essex Property Trust, Inc.",ESS,Residential,2025-11-20,https://www.glassdoor.com/Reviews/Essex-Property-Trust-Reviews-E3630.htm
Not Recommended - Company Does NOT Care About Employees!,1.0,"Dec 14, 2022",Employment was not jeopardized during the pandemic.,"Simply put Essex does not care about their employees, the only concern the company has is ""flipping delinquency"". Essex does not care about their employees mental health! Essex pay is low, employees are not properly compensated for the work they do! Essex does not pay enough or provide a sufficient housing discount for the current rental market. The company is all about making and recouping money.","Essex Property Trust, Inc.",ESS,Residential,2025-11-20,https://www.glassdoor.com/Reviews/Essex-Property-Trust-Reviews-E3630.htm
Community Manager,3.0,"Feb 21, 2016","Good benefits, upper management is accessible.","Company has grown very quickly and too many expectations are being put on staff at the property level. This is the most crucial area and causes a big disservice to the most key factor of the business, the customer.","Essex Property Trust, Inc.",ESS,Residential,2025-11-20,https://www.glassdoor.com/Reviews/Essex-Property-Trust-Reviews-E3630.htm
,5.0,"Feb 22, 2017",Great company to work for and promises of growth from within. I'm trying to get a bachelors degree and hope I can transfer or build my way up within the company.,Not much that is negative.,"Essex Property Trust, Inc.",ESS,Residential,2025-11-20,https://www.glassdoor.com/Reviews/Essex-Property-Trust-Reviews-E3630.htm
Great place to work,5.0,"Sep 6, 2018",Plenty of support and they care about work life balance.,Big company that is always changing. In most cases it is for the good of the team and their residents.,"Essex Property Trust, Inc.",ESS,Residential,2025-11-20,https://www.glassdoor.com/Reviews/Essex-Property-Trust-Reviews-E3630.htm
This Company is Top Notch!,5.0,"Apr 27, 2020","Essex has a great benefits package that includes 401k match, dental, medical, vision, and so forth. Great PTO structure and employee acknowledgements. The company supports its associates and helps them grow for advancement.",There are not any cons that stand out at this time.,"Essex Property Trust, Inc.",ESS,Residential,2025-11-20,https://www.glassdoor.com/Reviews/Essex-Property-Trust-Reviews-E3630.htm
Comfortable,3.0,"Feb 3, 2022","Good housing discount for living on-site or at a sister community, decent benefits. Company just closed all offices on Sundays, so many people either work M-F or T-S now. Plenty of PTO.",I feel like the pay could be a little bit better. Commission pay-out could be improved as well.,"Essex Property Trust, Inc.",ESS,Residential,2025-11-20,https://www.glassdoor.com/Reviews/Essex-Property-Trust-Reviews-E3630.htm
Former Employee,4.0,"Apr 11, 2018",Working at Essex I felt empowered and challenged. It was a great Company to work for. Good benefits and pay. I enjoyed the people that I worked with and miss them very much.,I do not have any cons.,"Essex Property Trust, Inc.",ESS,Residential,2025-11-20,https://www.glassdoor.com/Reviews/Essex-Property-Trust-Reviews-E3630.htm
Wonderful Since the Beginning and FANTASTIC NOW!,5.0,"May 1, 2020","Supportive, Informative, Passionate, Growth Focused!",Do not have any at this time.,"Essex Property Trust, Inc.",ESS,Residential,2025-11-20,https://www.glassdoor.com/Reviews/Essex-Property-Trust-Reviews-E3630.htm
amazing,5.0,"Mar 29, 2021","Everything, I loved working for them and my boss was amazing. They implemented technology that cut out all the extra work to simplify my job and I was able to do my job better",Based on the west coast only and I needed to relocate to FL.,"Essex Property Trust, Inc.",ESS,Residential,2025-11-20,https://www.glassdoor.com/Reviews/Essex-Property-Trust-Reviews-E3630.htm
Love it here!,5.0,"Apr 27, 2021","- Other employees/teams are very helpful and willing to help - Benefits/other great employee programs like Vitality - Have several forms of showing appreciation for employees (award program, excellence rewards, etc.)","- Claim to have competitive wages, but they pay less than other companies in the industry.","Essex Property Trust, Inc.",ESS,Residential,2025-11-20,https://www.glassdoor.com/Reviews/Essex-Property-Trust-Reviews-E3630.htm
Great People,5.0,"Sep 22, 2021","The Associates are great, open, friendly and helpful. They work with you to solve your concerns or problems. You can always find someone to help you.",The pandemic has made everyone feel a bit overwhelmed.,"Essex Property Trust, Inc.",ESS,Residential,2025-11-20,https://www.glassdoor.com/Reviews/Essex-Property-Trust-Reviews-E3630.htm
Changes,4.0,"Jul 30, 2022",The company recently implemented a new change by permanently closing the doors to residents and prospects. This allows for more time to assist more people and helps when it comes to preventing coming in contact with people who have COVID.,No cons to report at this time,"Essex Property Trust, Inc.",ESS,Residential,2025-11-20,https://www.glassdoor.com/Reviews/Essex-Property-Trust-Reviews-E3630.htm
Great company,5.0,"Jan 17, 2023",Essex cares about the employees overall wellbeing. It's a company where you can stay and grow. The company is also doing great in its DEI journey.,"Essex is headed in the right direction. And, I'd like to see the management continue to help our employees thrive.","Essex Property Trust, Inc.",ESS,Residential,2025-11-20,https://www.glassdoor.com/Reviews/Essex-Property-Trust-Reviews-E3630.htm
Property accountant,2.0,"Nov 5, 2014",People are friendly. They will try to you if you have any problems.,"They prefer male than female. If you are male, you will get promotion very quick. If you are female, it will take forever to get promotion.","Essex Property Trust, Inc.",ESS,Residential,2025-11-20,https://www.glassdoor.com/Reviews/Essex-Property-Trust-Reviews-E3630.htm
A “Ok”,3.0,"Dec 4, 2018","401K, Medical, Dental, and Vision Benefits, Work/Life Balance, Abundance of Essex Communities","Minimal Housing Discount, Growth Opportunity, “Competitive” Pay, Employee Training","Essex Property Trust, Inc.",ESS,Residential,2025-11-20,https://www.glassdoor.com/Reviews/Essex-Property-Trust-Reviews-E3630.htm
You get what you put in,5.0,"Jun 4, 2021",Essex Property trust has been the first company I have worked for that has given me clear goals AND the tools needed to achieve those goals. The company acknowledges and rewards your efforts.,None that come to mind at the moment.,"Essex Property Trust, Inc.",ESS,Residential,2025-11-20,https://www.glassdoor.com/Reviews/Essex-Property-Trust-Reviews-E3630.htm
Good to gain experience,3.0,"Aug 9, 2021","Experience is great here, especially for young professionals starting. If thinking about a corporate about entry level position.",Have to be in a very corporate structure. Lots of headaches with a corporate structure but some positives if you need experience.,"Essex Property Trust, Inc.",ESS,Residential,2025-11-20,https://www.glassdoor.com/Reviews/Essex-Property-Trust-Reviews-E3630.htm
Change is good,5.0,"Apr 16, 2021",Interdepartmental Transparency Collaborative Meaningful Work Actions tied directly to goals,some missed opportunities some siloed thinking is still encouraged,"Essex Property Trust, Inc.",ESS,Residential,2025-11-20,https://www.glassdoor.com/Reviews/Essex-Property-Trust-Reviews-E3630.htm
Great company to work for.,5.0,"Jan 6, 2021","Great People, decent pay, and good perks.",Some politics among community and district managers.,"Essex Property Trust, Inc.",ESS,Residential,2025-11-20,https://www.glassdoor.com/Reviews/Essex-Property-Trust-Reviews-E3630.htm
Entry Level Company,3.0,"Dec 18, 2021","Great to learn the property management business, great training, and amazing residents.","Middle - senior management is closed minded, career growth based on favoritism, and shady promotions.","Essex Property Trust, Inc.",ESS,Residential,2025-11-20,https://www.glassdoor.com/Reviews/Essex-Property-Trust-Reviews-E3630.htm
not competitive in pay,2.0,"Jun 8, 2022","company hires people with little to no experience. great for those who want to get their foot in the door, however, once experience is gained, very hard to get promoted unless you play the game.","pay is not competitive, hardly any opportunity for growth.","Essex Property Trust, Inc.",ESS,Residential,2025-11-20,https://www.glassdoor.com/Reviews/Essex-Property-Trust-Reviews-E3630.htm
Lots of amazing growth opportunities!,3.0,"Sep 11, 2015",Nice co-workers and customer service is amazing !,Upper mgmt is still learning to listen with both ears. They ask for feedback... But don't really listen as well as they think they do.,"Essex Property Trust, Inc.",ESS,Residential,2025-11-20,https://www.glassdoor.com/Reviews/Essex-Property-Trust-Reviews-E3630.htm
Take better care of your employees,3.0,"Feb 16, 2023",Diverse leadership and decent benefits,They will pay you as little as they can and increase your responsibilities while pressuring you to increase productivity,"Essex Property Trust, Inc.",ESS,Residential,2025-11-20,https://www.glassdoor.com/Reviews/Essex-Property-Trust-Reviews-E3630.htm
Corporate Property Accountant,5.0,"Apr 23, 2016",Multiple Residential Unite 95-97% Occupancy,Employee pettiness and low commitment to tasks at hand.,"Essex Property Trust, Inc.",ESS,Residential,2025-11-20,https://www.glassdoor.com/Reviews/Essex-Property-Trust-Reviews-E3630.htm
Great Place to Work,5.0,"May 19, 2020",Great leader in the Multifamily industry,Need teams to work more cross functionally between different depts.,"Essex Property Trust, Inc.",ESS,Residential,2025-11-20,https://www.glassdoor.com/Reviews/Essex-Property-Trust-Reviews-E3630.htm
Best Experience doing what I like!,5.0,"Aug 20, 2021","Well paid job, great schedule, excellent retirement plan (401K) , paid vacation, all benefits, great job environment, opportunity to grow within the company, opportunity to study and prepare for the next level.",I have not experienced any.,"Essex Property Trust, Inc.",ESS,Residential,2025-11-20,https://www.glassdoor.com/Reviews/Essex-Property-Trust-Reviews-E3630.htm
Stay away,2.0,"Mar 1, 2022",There is some room for growth.,"They are only looking to cut $ and budges. They will squeeze all the juice from you, then ask for more.","Essex Property Trust, Inc.",ESS,Residential,2025-11-20,https://www.glassdoor.com/Reviews/Essex-Property-Trust-Reviews-E3630.htm
"Excellent people, great company!",5.0,"Apr 27, 2018",Leadership believes in what they say.,"Like anything, it's work but we're well compensated and we are encouraged to have a good work like balance.","Essex Property Trust, Inc.",ESS,Residential,2025-11-20,https://www.glassdoor.com/Reviews/Essex-Property-Trust-Reviews-E3630.htm
Great company,5.0,"Jul 23, 2019",A lot of room for growth and development. Great culture and values. Motivated employees that want to impact change and provide great service.,Some people experience salary increase restrictions if in the same position for a long period of time.,"Essex Property Trust, Inc.",ESS,Residential,2025-11-20,https://www.glassdoor.com/Reviews/Essex-Property-Trust-Reviews-E3630.htm
What has your company done for you lately?,5.0,"Apr 22, 2020","Flexibility, Vacation/Sick PTO combined, diversity, work life balance, you are a voice that gets heard.","The Corporate office can be too quiet, but that can also be a positive.","Essex Property Trust, Inc.",ESS,Residential,2025-11-20,https://www.glassdoor.com/Reviews/Essex-Property-Trust-Reviews-E3630.htm
Essex Review,4.0,"Apr 28, 2020","Sustainable growth for the company, Technology adopter, Learning and Development opportunities, Recognition and Rewards for employees.","Need to learn the many new technologies implemented, Unstructured Career paths.","Essex Property Trust, Inc.",ESS,Residential,2025-11-20,https://www.glassdoor.com/Reviews/Essex-Property-Trust-Reviews-E3630.htm
Amazing Company To Work For!!,5.0,"Jun 2, 2020",The company has many different great training programs. They really help with career growth. Essex is always looking at ways to become more innovative and to be better than our competitors.,Only located in the West Coast.,"Essex Property Trust, Inc.",ESS,Residential,2025-11-20,https://www.glassdoor.com/Reviews/Essex-Property-Trust-Reviews-E3630.htm
Response during tough times speaks volumes of Company and its Management,5.0,"Jun 17, 2020",Company has responded in ways that makes me proud to be a Essex team member.,To early for any negative comments.,"Essex Property Trust, Inc.",ESS,Residential,2025-11-20,https://www.glassdoor.com/Reviews/Essex-Property-Trust-Reviews-E3630.htm
