title,rating,date,pros,cons,company,ticker,property_type,scrape_date,glassdoor_url
Great company for the right person at the right property in the right situation,4.0,"Nov 6, 2019","Great leadership, tools to learn, good perks, no evenings, opportunities for growth IF you want to stay on the sales career path.",-Some of the properties are older which makes it more difficult to earn high commissions. -The hourly pay is not enough in comparison to the amount of work you do and what you sacrifice. -Working weekends -Not much opportunity to explore other avenues or departments if you are in sales.,"Essex Property Trust, Inc.",ESS,Residential,2025-11-20,https://www.glassdoor.com/Reviews/Essex-Property-Trust-Reviews-E3630.htm
Great Growth Opportunities,5.0,"Jan 4, 2022","I have met some of the most talented people during my time at Essex, I have been fortunate to work side by side with these amazing people. The Management Team is great at finding internal talent and helping you grow, I have been promoted several times and there is no stopping, there are endless opportunities. The company offers great benefit packages (401k, medical, vision, dental, housing discounts) During the Pandemic Essex adapted to the fast-changing environment. The management team kept open communications ensuring the safety of the employees",I don't have any cons at this time.,"Essex Property Trust, Inc.",ESS,Residential,2025-11-20,https://www.glassdoor.com/Reviews/Essex-Property-Trust-Reviews-E3630.htm
No growth,2.0,"Dec 11, 2021",Excellent training tools and technology software.,They advertise they like to grow within the company but that's only if your willing to brown nose your way up. They do not promote even when your skills match the background for a promoted spot. Essex like to keep you where you are as long as it beneficial to management.,"Essex Property Trust, Inc.",ESS,Residential,2025-11-20,https://www.glassdoor.com/Reviews/Essex-Property-Trust-Reviews-E3630.htm
Solid company but undergoing major changes,3.0,"Mar 16, 2022",Good benefits. Good hours. Employee housing discount available.,You really need to get to know a lot of different people in order to move up. There isn't many opportunities to move up without having to uproot. Company is restructuring and the higher ups are very secretive about what's changes they are making. They haven't brought back their training classes to get techs certified in various fields,"Essex Property Trust, Inc.",ESS,Residential,2025-11-20,https://www.glassdoor.com/Reviews/Essex-Property-Trust-Reviews-E3630.htm
Make sure your onsite management knows their processes,2.0,"Feb 6, 2015",Beautiful properties that they don't hesitate to spend money on. Centrally located. Lots of properties so a lot of opportunity for growth.,"Unorganized property processes. For a company this big, the directive needs to be clear and consistent. My training was lackluster because my manager was lackluster. She did not know company processes, and as a relatively new employee I struggled to get reliable, consistent information. I was told to reach out to strangers, other managers, most not in my region, to find answers to my questions; but if you know what it is to be a manager, you know sometimes, you just don't have time to answer other people's questions so the dynamic of me having to find answers to pertinent, legal based questions through harassing other people was awkward to me. The company is not focussed on the dynamics onsite, which leads to a different experience from property to property. I was unable, due to the strange and overly competitive dynamic onsite, to rely on my subordinates to execute delegated tasks reliably. This is an important aspect of property management in my opinion; teamwork. I was terminated when they were fully aware I had no appropriate training, due to the fact that the pm who hired me went out on maternity leave less than two weeks after I started (I wasn't aware she was pregnant and would've stayed at the A+ property I was at prior to working for Essex if I wouldve known I was walking into a shaky management situation) and the woman they decided to place as temp PM did not have any idea of what she was doing- she couldn't/wouldn't post money, create notices or speak to residents and the staff onsite and residents truly disliked her. It is unfortunate, because I recognise I would have been an asset to the company if I would have worked with my original manager or have received the proper training.","Essex Property Trust, Inc.",ESS,Residential,2025-11-20,https://www.glassdoor.com/Reviews/Essex-Property-Trust-Reviews-E3630.htm
,1.0,"Sep 21, 2017","In terms of benefits , I think they are one of the best. I have only seen Michael Schall from company events but never had the chance to introduce myself, i truly feel he is a great man, good vibe, positive attitude.","Upper honchos do not know what truly transpire in each community and how employees are being treated by their RPM/CM and most especially how some residents treat the employees as if they are a piece of nothing and your RPM will only say ""suck it up"" as if they are ""Gods""!","Essex Property Trust, Inc.",ESS,Residential,2025-11-20,https://www.glassdoor.com/Reviews/Essex-Property-Trust-Reviews-E3630.htm
Glad to be a part of the Essex team!,5.0,"Apr 1, 2021","Base pay was great starting, received a raise after one year with the company. Commission rates are fair and gives a great opportunity to earn good pay. The employees are wonderful to work with and so helpful. The properties are managed well and maintenance teams are great. During COVID, my job felt very secure and safe. Overall, a great company to work for with wonderful benefits and team members!",No complaints at this time.,"Essex Property Trust, Inc.",ESS,Residential,2025-11-20,https://www.glassdoor.com/Reviews/Essex-Property-Trust-Reviews-E3630.htm
Areas of improvement,3.0,"Sep 17, 2018",The company is a growing company. They are very flexible when it comes to needing time off. They really care for the residents. The company does try to do things for employees like events.,"The company does not train their employees at all. Essex has leasing agents go through one course at the start of their time with them. Essex for some reason thinks this is sufficient training for employees. Which is unacceptable. Maintenance is never trained on how to manage their time, admin, customer service, team work and so much more. But yet Essex wonders why they can't find or keep maintenance. They don't train assistant managers properly. Yeah it is great that they train them on process but they don't ever train them on time management, leadership, customer service, conflict resolution and so much more. I hear a lot in this company that they don't favor people or gossip and then those same people turn around and do that exact thing. They say they have standards but what I see is it is a free for all. Employees are promoted when they are not ready. They are promoted based off who they know not what value they bring the company. I have seen managers live on property and do things that we wouldn't allow residents to do but for some reason we don't hold employees to a hire standard. The company integrity is not were it should be. I have seen them roll out challenges but in the end didn't full fill on giving out the prize due to their lack of preparations. Managers need to be trained on what it means to be leader. I have only saw a few managers in the company that I would consider leaders.","Essex Property Trust, Inc.",ESS,Residential,2025-11-20,https://www.glassdoor.com/Reviews/Essex-Property-Trust-Reviews-E3630.htm
Excellent Company - I'm truly proud to work here,5.0,"Apr 15, 2020","Upper management is great, opportunities for advancement are good, stable company with job security, true concern for employees and residents as well as investors, work/life balance is important",The size of the company still leads to a lot of communication challenges between departments and between corporate and the properties,"Essex Property Trust, Inc.",ESS,Residential,2025-11-20,https://www.glassdoor.com/Reviews/Essex-Property-Trust-Reviews-E3630.htm
Just an okay work environment.,3.0,"Jun 2, 2020","If you are looking to grow in Property Management then you have the opportunity to do so at Essex. Health Benefits are decent, I enjoy FlexSpending.",High turnover rate with employees so you are constantly understaffed or pulled to help other communities out but you are still expected to perform the same. Constant process and procedure change with little guidance. They spent so much money on their political agenda they couldn't afford holiday gatherings for two years now.,"Essex Property Trust, Inc.",ESS,Residential,2025-11-20,https://www.glassdoor.com/Reviews/Essex-Property-Trust-Reviews-E3630.htm
Great Place to Start a Long-Term Career,5.0,"Jul 18, 2020","Essex goes through great lengths to make you feel connected and part of the team. I was a newcomer to this industry, but I received a lot of support from my coworkers, and from the in-person and online training that Essex provided. They also offer competitive benefits and opportunities for internal promotion - I can see myself working for Essex for a while!","If you're starting out as a leaser, working weekends is a requirement. You'll have to work your way up the ladder for a weekend day off and/or two consecutive days off in a row.","Essex Property Trust, Inc.",ESS,Residential,2025-11-20,https://www.glassdoor.com/Reviews/Essex-Property-Trust-Reviews-E3630.htm
"Great People, Great Career, Great Experience",5.0,"Aug 5, 2020","As someone who has truly grown up with Essex, the company has allowed me the work-life balance a person strives for. I've had the pleasure to work for a company for over 10 years that has been so supportive of my work goals and also allowed me to focus on my personal growth.",Improved recruiting and onboarding to create highly qualified individuals.,"Essex Property Trust, Inc.",ESS,Residential,2025-11-20,https://www.glassdoor.com/Reviews/Essex-Property-Trust-Reviews-E3630.htm
Essex is a great place to work ! 12 years and counting :),4.0,"Apr 11, 2022",I thoroughly enjoyed my employment with Essex! They care deeply for the team and you as an individual. great benefits!,Changing things that already work well. property info not updated regularly (site team) Properties do not answer the phone,"Essex Property Trust, Inc.",ESS,Residential,2025-11-20,https://www.glassdoor.com/Reviews/Essex-Property-Trust-Reviews-E3630.htm
"It was walking on egg shells each day at work, Horrible Atmosphere.",1.0,"Feb 18, 2020","Holiday Pay, Paid time off, Regular pay check","One sided management, who does not want to help you grow. They tell you to do tasks without clear instructions, but blames you for the mistakes afterwards. Holiday parties are not fun, and a mandatory event, where you are judged by your regional manager based on what you wear and how you present yourself. They don't care about skillset, it's a clique here, if you aren't friends with the group, you are excluded and they will not inform you of important company rules and procedures. No coaching, and you only get mandatory coaching when you are honest in your on-boarding surveys, this alerts managers and give them a heads up.","Essex Property Trust, Inc.",ESS,Residential,2025-11-20,https://www.glassdoor.com/Reviews/Essex-Property-Trust-Reviews-E3630.htm
Meh!,3.0,"Jun 27, 2021","Good coworkers, solid financial firm","Lack of advancement opportunities; not enough staff in office or maintenance; micromanaging. Essex created SR Managers & Maintenance Supervisors to oversee multiple properties, leaving fewer manager & supervisor opportunities, making short-staffing a company policy with not enough time in the day for staff to do their jobs. find this a very difficult philosophy post-pandemic, especially as complaints from residents increase. No real oversight of regional managers and no one to assist when issues with the regionals arise.","Essex Property Trust, Inc.",ESS,Residential,2025-11-20,https://www.glassdoor.com/Reviews/Essex-Property-Trust-Reviews-E3630.htm
Rewarding,5.0,"Feb 9, 2018",Rewarding work and the competitive nature of the industry is definitely a driver for success. The benefits and opportunities at Essex are there if you are willing to work hard. I’m aware of many instances where the company has promoted from within and has recognized staff through a recognition program.,Fast-paced environment but being on a great team makes the challenges worth pushing through. Everyone I know at corporate are friendly and considerate.,"Essex Property Trust, Inc.",ESS,Residential,2025-11-20,https://www.glassdoor.com/Reviews/Essex-Property-Trust-Reviews-E3630.htm
Maintenance Tech,3.0,"Mar 9, 2017",Wonderful staff and diverse community made up of people from all over the world. Electric carts provided for staff. Benefits package and training. Company strives to support its people.,"Essex goes for properties in high tech markets which means high cost of living but the wages they pay do not compare to what is needed to live in these areas. This is not a problem unique to working for Essex though, but consider it if you want to work for them. They do offer a rent reduction if you live on site but you are than expected to be available as first responders in an emergency. The older properties they have inherited in the Seattle area have been poorly maintained and remodeled so there is a very high volume of work orders which is increased by the damage the residents inflict on the property themselves. They also have many section 8 people living on site receiving rent subsidies and there is a strong correlation between sec8 and damage to the property/units along with higher criminal behavior and mental illness.","Essex Property Trust, Inc.",ESS,Residential,2025-11-20,https://www.glassdoor.com/Reviews/Essex-Property-Trust-Reviews-E3630.htm
Essex is the Career of growth!,5.0,"Apr 12, 2022","-Working at Essex has been enjoyable, beyond any other company I've worked for! -They have the best work / life balance, were understandable during Covid-19 with my children's school schedules! -Communication with everyone is extremely easy and they understand it is key to running every property efficiently. -Getting the help you need for anything is always accessible to all! -I've worked for a total of 3 other companies in this industry in the past 14 years and Essex is my favorite!",-I have worked for Essex for close to 3 years and don't have anything to complain about yet.,"Essex Property Trust, Inc.",ESS,Residential,2025-11-20,https://www.glassdoor.com/Reviews/Essex-Property-Trust-Reviews-E3630.htm
Best Company to work for circ 2013,5.0,"Oct 14, 2022","There was an excellent VP and even better regionals during the time I was there back in 2013. It felt like family and the support, training and fun was there. I learned so much as a leader and made the best of friends","When the company merged with BRE, there was a great shift in the company and the culture shifted and the executives' made changes that effected the company. Long term employees did not feel heard and eventually good employees left. It is all part of the process","Essex Property Trust, Inc.",ESS,Residential,2025-11-20,https://www.glassdoor.com/Reviews/Essex-Property-Trust-Reviews-E3630.htm
Leasing,5.0,"Jan 20, 2022",I have worked as a leasing specialist at our Redmond Hill location for 6 1/2 years and love my job! Helping people find their new home and providing exceptional customer service are my favorite things to do. Management is always very open to new ideas and they listen to and support us very well. Corporate associates are very supportive as well. The pay and benefits are very competitive. We say teamwork makes the dreamwork and it is true at Essex!,We now have Sundays off - no cons to report here!,"Essex Property Trust, Inc.",ESS,Residential,2025-11-20,https://www.glassdoor.com/Reviews/Essex-Property-Trust-Reviews-E3630.htm
Best company to work for! Extraordinary leadership! Great work-life balance!,5.0,"Nov 15, 2022","I have worked for Essex Property Trust for over 25 years! I am beyond grateful for the opportunity that Essex has given me to help build my career throughout the years. I have been honored to be involved in piloting many programs, be part of many different committees and work at several communities throughout the organization. With the recent rollout of Asset Collections within our company, this has allowed us to be able to focus on what we do best! During the rollout, I was able to meet so many in our organization from PNW all the way down to San Diego. Throughout the years, colleagues have turned into friends and family. Our company is lead by many extraordinary leaders and that makes us successful and wanting to do more! For our President and CEO to personally take the time to get to know employees, know me by name and ask about my family when I see him, is very special to me and shows we are not just a number. To be excited to go to work is an indication that Essex is an amazing company! They believe in a work-life-balance and care about all employees which is very important. When we speak up...they listen. The benefits they offer are far more than you could ever expect in a company. They even gave us all Sundays off, so that we can spend one weekend day with our family and friends. As a hiring manager, this is definitely something others in the industry want....and we got it! We get paid basically for working out and staying healthy! This is AMAZING!! I thank Essex Property Trust for the past 25 years and I look forward to many more to come.",I don't have any cons,"Essex Property Trust, Inc.",ESS,Residential,2025-11-20,https://www.glassdoor.com/Reviews/Essex-Property-Trust-Reviews-E3630.htm
Lowest paying Leasing Agents in Los Angeles Market,3.0,"Jan 26, 2016","schedule flexibility, health benefits, tuition reimbursement, slight employee discount on housing, opportunity to promote","communication, operations, organization, leasing structure, low commission, low hourly rate, housing discount is less in comparison to smaller companies, high rent costs.","Essex Property Trust, Inc.",ESS,Residential,2025-11-20,https://www.glassdoor.com/Reviews/Essex-Property-Trust-Reviews-E3630.htm
The Essex Culture,4.0,"Apr 9, 2020","I LOVE OUR CEO-He is the sweetest man on earth...if he sees your hands full trying to open the door, he'll hold the door for you with a smile and he and actually knows my name! He acknowledges your presence and is just overall amazing. I love my team and their spunky energy. The office is beautiful, well maintained, with great vendors to be there on the spot when you request them. There's coffee bars in every corner to keep you going throughout the day, they'll even stock the ladies room with feminine napkins. There's refrigerators to store your lunch, microwaves, and toaster ovens too. Friendly & Genuine staff, for the most part. Everyone is your friend wherever you turn. Everyone loves everyone (at least that's what it mostly feels like). We are a family. Easy going vibe. Sometimes you'll see an executive in their gym clothes with a handful paperwork, so you know it's a health inspired environment. Did I mention, there's also a little gym as an added amenity to burn off that extra energy on your break or lunch? There's even a mommy room too! There are copy rooms in each area so work flow maintains a steady pace. If you seek help, everyone always extends a helping hand so you'll never fall behind. There's a strong support in team effort on that part. You will NEVER get a cold shoulder turned on you. There's an open door policy, so you can literally walk up to your executive, director, or manager for anything. I have a strong support from my direct manager also, she's terrific and I love her so much. Paid Holidays and Benefits are a plus. There's monthly events that bring the team together, so that's nice also. There is a cash perk for recruiting friends. You get commission if you work onsite. Company major gatherings are held a couple times a year, so that's nice also for mingling and building your network. I love my job. I love my job-I LOVE MY JOB! I have made the best of friends here and enjoy working with them and being in their presence. I actually go to work, SO excited to go.","Dental plan is really bad...but you can choose between Kaiser or your own health provider. While considerably our apartments are the best in the market, the customer care turnaround response time is quite terrible to be honest. People these days are not patient to wait 48 hours until their questions are answered, where they expect an answer right then and there...and that isn't the case here. We forward them to an automated voicemail system...which is unheard of in the customer service industry alone. You can call anywhere and at least someone will pickup the phone and help you, you may be transferred a gazillion times, but at least you'll be transferred to a live person. We're a lot slower to progression than most companies out there so expect a delay when you want something done to help the company expand and grow, or even if you're expecting a review for something such as a raise and for that to actually take place or happen at all. You want a raise? Expect a year and a half for it to keep being pushed out because they're ""too busy"" to consider your request to really embark in your career. It doesn't matter how much you love it here, or what position you're in. That's just the sad truth. Know your market before coming in and be ready for .......an......extended..........delay.......to your requests, whatever it may be. It's not about what you know-but who you know. HR has a big pull from Executives, so if you have an issue with them, or their admin below them... expect that they will not get written up for their hostility towards you and they will literally get away with anything no matter how bad. It will be brushed off as if nothing happened, not even a warning or write-up. It's the nature here, so the best thing is to stay to yourself and bite your tongue when a snarky remark or comment is thrown at you. Speak up in confidentiality, it won't stay confidential, and whoever you speak up about will find out somehow, retaliate against you and make your life a living hell...and of course, get away with it while they're at it. Quit...and you let them win. Will it get better if you leave? No, because that horrible person will still be there...just because of WHO they are representing and working directly under. And you can't choose not to work with them nor can you avoid them either because they'll find a way to get in the mix of YOUR job too. Yes hostility exists here and there is no practice of justice for it, that's how weak our HR system is. Think of it as a mirage. That's what it can feel like at times. You just have to make the best of it on your own. I probably made this sound like a terrible place to work, and I'm sorry if you're considering a position here. In honesty, it is a great place and environment, just certain people can make it extremely difficult. So if it happens to you, that you're the chosen one to be bullied, know that you're not alone and you're not a pushover-It's everywhere, I presume. And though write-ups aren't quite a thing here and there actually is a high tolerance for promoting bad behavior (even though when you sign your contract it says there's a zero tolerance for it), you are actually supported from your direct manager...and they will lookout for your general well-being...even speak up on your behalf. So there's that. Is that the greatest solution? No. But it does help ease the tension to have a friend on your side and actually be your manager. It can be cut throat, because EVERYONE is passionate about their job and position they hold, so there will be butting heads, a lot actually, but if you are mentally strong and don't let harsh words hurt you or bring you down, you'll succeed and get ahead. Call it a love-hate relationship. Where you hate the people you work with (of course not everyone) so much that you love them because in the end, you realize we're all family. We don't just work with each other...you spend an entire day with each other spending more time with colleagues moreso your actual real family at home. So yes, the reality hits the fan from time to time. You've got to decide how you're going to take it and handle it and choose if this is the place that's for you. If it is-great. More power to you coming in to know what to expect. If not, don't worry-It's not for everyone, just putting it out there to give you a perspective of the real work environment at ESSEX.","Essex Property Trust, Inc.",ESS,Residential,2025-11-20,https://www.glassdoor.com/Reviews/Essex-Property-Trust-Reviews-E3630.htm
Grow you career with Essex,5.0,"Nov 5, 2020","Essex seeks associates that WANT to grow their careers. I have been with the company for 9.5 years, I started from the ""bottom"" as an entry level Leasing Associate and grew my career to be a Multi-Site Community Manager. Effort and hard work is rewarded in this organization and that's visible in the number of current associates who have been part of the Essex Family for 10+ years in a variety of roles.","It's impossible to make everyone happy all of the time, but I can not think of any fundamental cons with Essex.","Essex Property Trust, Inc.",ESS,Residential,2025-11-20,https://www.glassdoor.com/Reviews/Essex-Property-Trust-Reviews-E3630.htm
