title,rating,date,pros,cons,company,ticker,property_type,scrape_date,glassdoor_url
Poor treatment of employees,1.0,"Oct 2, 2022",I cannot speak to any pros at this company.,We were acquired by Healthcare Realty who said it was a true acquisition that would make the company stronger—I believed their empty words. Their actions showed they had no interest in getting to know the people at Healthcare Realty and they just fired employees regardless of skill set and experience. Extremely disappointing and if they can treat current employees this way they will treat any employee in such a manner. Run—do not walk—away from this company!,Healthcare Realty Trust,HR,Health Care,2025-11-20,https://www.glassdoor.com/Reviews/Healthcare-Realty-Reviews-E1047.htm
"Great place to work, people are friendly",5.0,"Feb 5, 2019","Great work/life balance , health benefits, fast paced learning environment.","Dress code needs to change it is 2019. More up to date working schedule, ie..working remotely on occasion.",Healthcare Realty Trust,HR,Health Care,2025-11-20,https://www.glassdoor.com/Reviews/Healthcare-Realty-Reviews-E1047.htm
Happy to be here,4.0,"Jun 6, 2022",Local management actually cares about you as people. There is a lot more flexibility than at other places. The work is challenging and never the same day to day.,"As with any REIT it is hard to get approval to add more positions. With corporate office in Nashville, Seattle prices are always a sticker shock.",Healthcare Realty Trust,HR,Health Care,2025-11-20,https://www.glassdoor.com/Reviews/Healthcare-Realty-Reviews-E1047.htm
Great Company with Great People,5.0,"Jun 17, 2019",Great promotion opportunities within the company. Great experience can be gained dealing with the many facets of corporate accounting. Great Job!,"My only complaint, isn't really a complaint just a suggestion, Casual Fridays would be awesome.",Healthcare Realty Trust,HR,Health Care,2025-11-20,https://www.glassdoor.com/Reviews/Healthcare-Realty-Reviews-E1047.htm
Good place to start,4.0,"Jul 10, 2022","When you work with a good team, good outcome fallows. It took some time to build a team and it works.",salary is not so good. little micromanagement benefits are mediocre,Healthcare Realty Trust,HR,Health Care,2025-11-20,https://www.glassdoor.com/Reviews/Healthcare-Realty-Reviews-E1047.htm
"Growth, culture, opportunities",5.0,"Sep 14, 2020","Smart, hard-working people who want to do the right things for tenants, fellow employees and share holders. Culture is encouraging and hands-off. Intellectual curiosity is valued.",Analysis is paramount and sometimes overrides qualitative decisions.,Healthcare Realty Trust,HR,Health Care,2025-11-20,https://www.glassdoor.com/Reviews/Healthcare-Realty-Reviews-E1047.htm
"It's not good or not bad, take that as you will.",3.0,"Jan 23, 2023",Pleasant co workers and some opportunities to work remotely.,work/life balance does not exist. Nice words on inclusion and diversity with no action.,Healthcare Realty Trust,HR,Health Care,2025-11-20,https://www.glassdoor.com/Reviews/Healthcare-Realty-Reviews-E1047.htm
Overall Great Culture,5.0,"Feb 28, 2022",Great Culture and Office experience. Healthcare Realty is an enjoyable place to work.,Work can be slow at times due to the general nature of the real estate space.,Healthcare Realty Trust,HR,Health Care,2025-11-20,https://www.glassdoor.com/Reviews/Healthcare-Realty-Reviews-E1047.htm
Great place to work,4.0,"Jun 17, 2019","Work life balance, friendly staff, and opportunity for growth.",No option to work from home part of the week. Not many team building opportunities.,Healthcare Realty Trust,HR,Health Care,2025-11-20,https://www.glassdoor.com/Reviews/Healthcare-Realty-Reviews-E1047.htm
Working at healthcare realty,5.0,"Feb 24, 2022","It is an awesome place to work. It comes with challenges, which help you learn.",A lot of the work is done independently.,Healthcare Realty Trust,HR,Health Care,2025-11-20,https://www.glassdoor.com/Reviews/Healthcare-Realty-Reviews-E1047.htm
Great Place to Work,5.0,"Feb 27, 2020",I loved working at Healthcare Realty for all of the below reasons: Flexibility Atmosphere Great co workers,I can’t think of any cons.,Healthcare Realty Trust,HR,Health Care,2025-11-20,https://www.glassdoor.com/Reviews/Healthcare-Realty-Reviews-E1047.htm
Good Company,5.0,"Nov 16, 2020","Process oriented, competitive pay, and promote from within",Hours are not super flexible,Healthcare Realty Trust,HR,Health Care,2025-11-20,https://www.glassdoor.com/Reviews/Healthcare-Realty-Reviews-E1047.htm
Not a terrible place to work,3.0,"Oct 9, 2020",Small office with schedule flexibility.,Unorganized leadership and not many advancement opportunities.,Healthcare Realty Trust,HR,Health Care,2025-11-20,https://www.glassdoor.com/Reviews/Healthcare-Realty-Reviews-E1047.htm
Great Company,4.0,"Jan 31, 2022","Steady pay, great team to work with.","Limited upward mobility, communications from corporate are not timely and or always current/accurate.",Healthcare Realty Trust,HR,Health Care,2025-11-20,https://www.glassdoor.com/Reviews/Healthcare-Realty-Reviews-E1047.htm
Great place to work,5.0,"Dec 28, 2020",open to work life balance for each employee,could use some direction with diversity and inclusion,Healthcare Realty Trust,HR,Health Care,2025-11-20,https://www.glassdoor.com/Reviews/Healthcare-Realty-Reviews-E1047.htm
Great workplace,5.0,"Oct 11, 2021",Feels like family. They is a good work/life balance,It can feel a little overwhelming at times.,Healthcare Realty Trust,HR,Health Care,2025-11-20,https://www.glassdoor.com/Reviews/Healthcare-Realty-Reviews-E1047.htm
administrative assistant,5.0,"Jan 26, 2023",great growth opportunities to grow from within,Not many people in the office throughout the work day,Healthcare Realty Trust,HR,Health Care,2025-11-20,https://www.glassdoor.com/Reviews/Healthcare-Realty-Reviews-E1047.htm
Overworked with good benefits,4.0,"Mar 31, 2022","Good salary
Good benefits
Friendly work culture","Overworked team
Minimal training
Work-life balance is minimal to none",Healthcare Realty Trust,HR,Health Care,2025-11-20,https://www.glassdoor.com/Reviews/Healthcare-Realty-Reviews-E1047.htm
Good company,4.0,"Nov 10, 2022",Good business model and leadership,Corporate finance office is boring,Healthcare Realty Trust,HR,Health Care,2025-11-20,https://www.glassdoor.com/Reviews/Healthcare-Realty-Reviews-E1047.htm
Heartless and mass confusion,1.0,"Nov 14, 2022",Money is no object for property improvement.,Unorganized. No help. Information overload and over load of responsibility to staff. Staffing is sparse.,Healthcare Realty Trust,HR,Health Care,2025-11-20,https://www.glassdoor.com/Reviews/Healthcare-Realty-Reviews-E1047.htm
