title,rating,date,pros,cons,company,ticker,property_type,scrape_date,glassdoor_url
Hostile Work environment,1.0,"Apr 20, 2022",good benefits. COVID regulations are ok. Bonuses are nice.,"High turnover meaning job responsibilities overlap. favoritism is real, meaning that management won't take you serious when you are being treated badly by other employers. You will see that HR may respond to this review stating that employers are encouraged to contact when in fact we are actually shushed away by ""warnings"" so if you speak up against abuse you will be reprimanded instead. Pay is not worth it for the treatment you get here. The job itself is very overwhelming because they expect you to do your job while doing the job of others (in this case management) In my time here, I had seen two employers had breakdowns and walk out the job. When you mention this to management all they say is ""okay"" and then side with the abuser. It's important to build paper-trail if you want to work for this company.",JBG SMITH,JBGS,Diversified,2025-11-21,https://www.glassdoor.com/Reviews/JBG-SMITH-Reviews-E1747097.htm
High Recommend!,5.0,"Mar 15, 2022",JBGS promotes a high level of work/life balance. They encourage their employees to take much needed time off while still meeting goals and deadlines. JBGS is one of the few or maybe even the only property management company to offer unlimited PTO to their corporate employees as well as a flexible schedule of 3 days in the office and 2 days of telework each week. I feel like JBGS leadership really listens to your feedback and takes it seriously. I really enjoying knowing that I am contributing to the overall great good of the organization.,Don't have any serious cons in my overall personal experience in my 2.5 years with the company.,JBG SMITH,JBGS,Diversified,2025-11-21,https://www.glassdoor.com/Reviews/JBG-SMITH-Reviews-E1747097.htm
Fantastic Entry-Level Job,5.0,"Aug 25, 2020","Corporate has an awesome atmosphere, everyone is motivated, energetic, and ambitious. Great learning opportunities, and obvious room for growth/promotion since the company is rapidly growing/expanding. Coming from a company with a weak HR department, it's also refreshing to see that HR is responsive/actively reaches out to ensure that your transition is going well (for example, they have sent everyone 2 gift-baskets in the last 2 months during WFH!) Benefits/pay are also wonderful. Stock discount/401K matching is competitive, and healthcare/dental/vision is very affordable. Tuition reimbursement is also one of the highest in DC, plus the new office is unbelievable. Note to individuals considering JBG Smith: please remember that many of these reviews are from property staff, not from corporate staff. Not to discount property staff's experiences working for JBG Smith, but the corporate work experience is obviously going to be different than the property staff work experience. I almost didn't accept my position because of some of the comments posted on Glassdoor, but a few months in, I'm so glad I accepted my offer.","So far there hasn't been a lot of company social events, but of course, we're in the middle of COVID-19. Supposedly there's an annual booze cruise in October, but I'm guessing that is cancelled due to the pandemic. Either way, it could be nice if the company offered smaller virtual social events to get to know fellow co-workers/individuals in different departments since we aren't returning to the office until Spring. The only real ""con"" is that unlike other major REITS in the DC area (Avalon Bay Communities, etc.), JBG Smith does not offer an employee rent discount on company owned properties (but I can also see why so this isn't a real con and more of a wish). That said, with DC housing prices skyrocketing, I could easily see myself jumping to a REIT that offers such a program in the future if such an opportunity arose (just since rent is so expensive/huge part of any person living in DC's budget)",JBG SMITH,JBGS,Diversified,2025-11-21,https://www.glassdoor.com/Reviews/JBG-SMITH-Reviews-E1747097.htm
Great Company!,5.0,"Mar 28, 2022",Innovation and expansion are the name of the game with JBGS! Lots of opportunity for growth if you are successful in your role because of this. The company focuses heavily on customer service excellence to be an industry leader. They are also very generous with paid time off.,"Recruiting for all of the opportunities has been challenging the past few years. Much of this is likely pandemic-related, but not sure what efforts have been made internally to alter recruitment strategies in the new climate. This has lead to some properties being short-staffed for extended periods. With much more in the pipeline hopefully there is focus on this.",JBG SMITH,JBGS,Diversified,2025-11-21,https://www.glassdoor.com/Reviews/JBG-SMITH-Reviews-E1747097.htm
Major Upset After JBG/Vornado Merge,3.0,"Feb 8, 2018",Keeping the same benefits as JBG,"Vornado upper management making unnecessary policy changes that make the job more difficult and frustrating. As a former JBG employee we were once independent and self sufficient, now we're being controlled as well as confused by the lack of communication and plain ignorance for what we were once and still are capable of achieving.",JBG SMITH,JBGS,Diversified,2025-11-21,https://www.glassdoor.com/Reviews/JBG-SMITH-Reviews-E1747097.htm
Great company to work for!,5.0,"Jan 14, 2022","This is my first full-time job out of college and I love working here! The employees are friendly, approachable, and always willing to help and be a resource. The company culture here is incredible! They really value your work/life balance, training, and growth.","Not a company con, but Covid-19 has affected all workplaces. JBG Smith has taken numerous measures to ensure the health and well-being of its staff. With work from home days, on-site company testing, free access to the Calm app, and constant email updates on the ever-changing Covid-19 mandates, I can tell that the company really cares about its employees physical and mental health.",JBG SMITH,JBGS,Diversified,2025-11-21,https://www.glassdoor.com/Reviews/JBG-SMITH-Reviews-E1747097.htm
Company,3.0,"Aug 23, 2015",JBG is lax about their standards so you have an opportunity to make the community your own and they are willing to spend the money on their employees.,"There doesn't seem to be a concrete level of organization. The Regional Manager is not the best person in her position an the side of empathy, building employees and doesn't know how to handle people effectively. She is amazing when it comes to processes and procedures. Teachers have to teach students differently, and so do managers. They need to adapt to their employees.",JBG SMITH,JBGS,Diversified,2025-11-21,https://www.glassdoor.com/Reviews/JBG-SMITH-Reviews-E1747097.htm
Favoritism and politics infested company.,2.0,"Dec 2, 2016",Good company to get your experience level up to par then move on to a more reputable source.,"Too many suck ups that don't deserve to be promoted are all over the company, not to mention terrible regional managers with stuck up attitudes and a portfolio manager that likes to argue and be rude to people below her.",JBG SMITH,JBGS,Diversified,2025-11-21,https://www.glassdoor.com/Reviews/JBG-SMITH-Reviews-E1747097.htm
"Good people in general, good benefits",4.0,"Jan 2, 2018","Clearly defined job responsibilities (this IS important). Leasing bonuses are paid on time and are fairly generous. Little contact with senior management, so the local manager is the manager you get for good or ill.","Companies of this size must necessarily have set policies, but this can lead to a rather robotic ""check these boxes"" experience, especially when it comes to disciplinary measures.",JBG SMITH,JBGS,Diversified,2025-11-21,https://www.glassdoor.com/Reviews/JBG-SMITH-Reviews-E1747097.htm
Best In The Biz,5.0,"Mar 2, 2019","I started with JBG Companies as a concierge and after 4 years I left JBG Smith as an Assistant Community Manager. I have been given the opportunity to work at some of the most beautiful Class A multifamily assets in the DMV area, and the experience/skills I've gained has made me a highly sought after candidate in the PM job market. There is PLENTY of room for advancement, the benefits are great, the company is structured and professional, and for the most part they seek out the best talent.",The pay is not so great. Everything else was trivial...,JBG SMITH,JBGS,Diversified,2025-11-21,https://www.glassdoor.com/Reviews/JBG-SMITH-Reviews-E1747097.htm
"Great Experience, Great People, Lots of Work",5.0,"Jun 10, 2021","- The people and community are great. There are plenty of fun personalities in and outside of the corporate office, of all different ages and stripes. It is a very welcoming place. - The work is challenging but fulfilling. There is a lot of opportunity to learn on unique properties, and you are encouraged to take projects and run with them. You will get a ton of good experience in the industry. - The office is beautiful and its amenities are amazing. Brand new in late 2019. - Senior Management did a fantastic job steering the company through COVID. Matt Kelly is a great leader. - The company is growing which has both pros and cons. A major pro is that it is a very interesting company on an exciting trajectory (Amazon/VT, etc).","- JBGS is still emerging from the IPO/merger in 2017, so there are growing pains in terms of some of the processes. Things have gotten a lot better over the last few years but there are still some things that need work. Within accounting, they are implementing new software that should make close more efficient and free up some time, however: - Regardless of how efficient they get, it seems expected that you will still have to work a ton to meet your deadlines. Throughout busy season, you'll have at least a couple of late nights per week on average, and will have to work on some weekends in order to meet close deadlines. - The accounting department has grown so much that advancement is becoming a bit more difficult. However that could change if there is any major post-COVID turnover.",JBG SMITH,JBGS,Diversified,2025-11-21,https://www.glassdoor.com/Reviews/JBG-SMITH-Reviews-E1747097.htm
"Great Company, Brilliant Minds, Great Intentions!!",5.0,"Aug 10, 2021","Great minds, highly motivated, genuine leaders/people with great intentions. Head and shoulders above the competition in terms of a dedicated approach to diversity and inclusion. There is a lot of commitment to giving back to our extended communities, and opportunities for associates to volunteer on the clock.",New technology is taken on at a pace that the average person finds difficult to absorb and implement.,JBG SMITH,JBGS,Diversified,2025-11-21,https://www.glassdoor.com/Reviews/JBG-SMITH-Reviews-E1747097.htm
I love working for JBG SMITH,5.0,"Apr 14, 2022","In my experience, JBG is an honest company and my morals align closely with their Core Values. I love that they are actively working to make housing affordable for those in need and they support other groups through JBG Cares. As a Residential employee, I really enjoy working with my direct supervisor and believe they would go to bat for me in just about any situation. I want to perform at a higher level because of them. JBG SMITH put a lot of thought and effort info how they operated through the pandemic. They took a conservative approach to re-opening which was difficult at times, but was ultimately for the health and wellbeing of its employees and customers. JBG paid team members that worked on site ""Hazard Pay"" in relation to COVID for about a year. All JBG employees working at the property level were eligible and we were automatically paid $3.50/hr in addition to their hourly wage. This was almost a 20% raise for many front line employees in a very uncertain time. The benefits package is very solid. JBG contributes 50% of what I contribute toward my 401k -- up to 3%. I feel that my PTO and mental health are prioritized at JBG SMITH. We now have a Cultural Reflection day each year that can be used as an additional personal day with no questions asked. JBG was on top of Juneteenth becoming a Federal Holiday and within hours of the presidential announcement, we were notified that offices would be closed the following Monday in observance of this Holiday. JBG Residential gave site team members two extra personal days to use between 1/1/22 and 2/28/22 citing that the teams working on site had been resilient through the pandemic and they wanted us to take time to mentally prepare for the upcoming season. JBG SMITH sent employees multiple care packages throughout the pandemic with food/snacks, board games, and a notes from the executive team. Matt Kelly (CEO) created weekly videos and sent them to the entire company to talk to us about new things happening at JBG to keep the entire company clued into how things were going. He often encouraged team members to stay healthy and stay home as our health was most important. Health/Dental takes care of practically wherever I want to go (including Georgetown MedStar). I cannot say enough about how great JBG SMITH has been as an employer.",Residential Property Management is an industry that I personally believe should see some salary increases across the board.,JBG SMITH,JBGS,Diversified,2025-11-21,https://www.glassdoor.com/Reviews/JBG-SMITH-Reviews-E1747097.htm
Understaffed. Corporate culture. Good benefits,3.0,"May 27, 2019","Pay and benefits are competitive. In 2015, JBG offered CareFirst Blue Cross Blue Shield.","Understaffed and chaotic office with overlapping job responsibilities. High turnover. Inadequate company procedure to address bedbugs and other pests, meaning angry residents and helpless staff. Many corporate platitudes, but little genuine responsiveness to employee frustrations.",JBG SMITH,JBGS,Diversified,2025-11-21,https://www.glassdoor.com/Reviews/JBG-SMITH-Reviews-E1747097.htm
An interesting introduction into Property Management,3.0,"Aug 6, 2021",You will receive all of your benefits after the first full month working with the company. There is great health insurance and flexible leave. There is a wide variety of opportunities within the company if you don't necessarily like where you are currently.,Every property operates differently and you have to be quick to adapt to those specific differences. Essentially a residential management position as you are expected to fill many hats with an average starting pay.,JBG SMITH,JBGS,Diversified,2025-11-21,https://www.glassdoor.com/Reviews/JBG-SMITH-Reviews-E1747097.htm
All talk and no change,3.0,"Jul 22, 2019","They have good benefits, different departments are better than others.",I’ve stayed because I’ve been there for a few years. Things haven’t always been bad sadly since the merger there is little valve put on individuals. They will say there is but they don’t actually deliver. The environment is very cliquey and they seem to be hiring more young people and weeding out tenured staff.,JBG SMITH,JBGS,Diversified,2025-11-21,https://www.glassdoor.com/Reviews/JBG-SMITH-Reviews-E1747097.htm
Good company,4.0,"Oct 21, 2016",-benefits are great -coworker atmosphere is good -several employee events througout year -major holidays off and extra days off for working holidays -upper management gets to know everyone -training available,-compensation is not always the greatest -sometimes they try to save money too much and don't want to spend money to fix issues on site -sometimes willing to overlook vendor issues in order to save money,JBG SMITH,JBGS,Diversified,2025-11-21,https://www.glassdoor.com/Reviews/JBG-SMITH-Reviews-E1747097.htm
Great Company!,5.0,"Mar 9, 2017","JBG offers Unbeatable Benefits, they have a great management team, friendly environment, consistent training, plenty of growth opportunities and amazing teams.","I can't think of any cons for this company. Mindy, Duanne, Michelle and Cynthia need to keep being great leaders!",JBG SMITH,JBGS,Diversified,2025-11-21,https://www.glassdoor.com/Reviews/JBG-SMITH-Reviews-E1747097.htm
I truly love my job…,4.0,"Apr 22, 2022","From leasing consultant to senior community manager, I have always felt supported and valued as an employee.","The company’s portfolio is growing fast, I fear corporate support won’t be able to keep up with on-site needs to be as successful as they could be.",JBG SMITH,JBGS,Diversified,2025-11-21,https://www.glassdoor.com/Reviews/JBG-SMITH-Reviews-E1747097.htm
Great company,5.0,"Jan 28, 2022","If you have a great team then it helps a lot. The accounting department is large so you will encounter a variety of personalities and work styles. Depending on the person that could be a bad thing, but for me it felt like a pro because it was great exposure.","I stayed as long as I have because I enjoyed my team, but not much room for advancement, and the work doesn't change much as you transition from entry to senior.",JBG SMITH,JBGS,Diversified,2025-11-21,https://www.glassdoor.com/Reviews/JBG-SMITH-Reviews-E1747097.htm
Great company who values their employees,5.0,"Jan 30, 2015",one of the things that stood out to me during my tenure at JBG is how down to earn upper management was. I truly felt valued as an employee. JBG invest a lot of time and resources into their employee therefore making you a better at your job. Not to mention the benefits are fantastic and salary competitive to other property management companies,None that i can think of,JBG SMITH,JBGS,Diversified,2025-11-21,https://www.glassdoor.com/Reviews/JBG-SMITH-Reviews-E1747097.htm
Minimal support and non existent training.,2.0,"Jan 6, 2014","Good benefits and vacation, however management gets frustrated when you take it because they have to support you while you are gone.","Support to the properties is minimal, you are expected to work with staff shortages for long periods of time, hiring process is very slow and does not benefit employees or residents.",JBG SMITH,JBGS,Diversified,2025-11-21,https://www.glassdoor.com/Reviews/JBG-SMITH-Reviews-E1747097.htm
"Of all the great organizations I've worked for, JBG SMITH is the best of the best",5.0,"Mar 15, 2022","From the top down, everyone cares for and respects everyone else. Everyone focuses on helping our customers and helping each other help our customers.","The pace is fast. There is always a lot to do. Mostly this is just a part of the challenge of being part of a successful team, but it can be very challenging sometimes.",JBG SMITH,JBGS,Diversified,2025-11-21,https://www.glassdoor.com/Reviews/JBG-SMITH-Reviews-E1747097.htm
Great place to work and start your career,5.0,"Oct 19, 2016","Incredible access to deal-level experience and key decision makers. Very flat organization run by the best in the business in the DC market. No hierarchy, will be given as much responsibility as you can handle.","Work hard play hard environment. Exactly what you should expect from a PE shop. Base pay is low for the hours, but made up for in year-end bonus if you are a high performer.",JBG SMITH,JBGS,Diversified,2025-11-21,https://www.glassdoor.com/Reviews/JBG-SMITH-Reviews-E1747097.htm
Great Culture with the Ability to Advance,5.0,"Jun 5, 2022","JBG SMITH offers a great culture with a collaborative environment in a beautiful office setting with perks such as being able to wear shorts and bringing your dog to work. If you work hard, you will be rewarded.","JBG SMITH offers lots of opportunities to be involved in unique and challenging transactions. If you are looking for an easy job, this is not the place for you.",JBG SMITH,JBGS,Diversified,2025-11-21,https://www.glassdoor.com/Reviews/JBG-SMITH-Reviews-E1747097.htm
"Toxic environment, poor management, & lack of advancement",1.0,"Dec 19, 2021",The new office & decent benefits (unlimited PTO & good insurance coverage),"I’m surprised by the amount of positive on this company considering the large turnover it has experience over the last couple of years, and the turnover continues even more so recently since the merger. This company loses quality employees because it lacks proper training structures within teams, an actual career path for many employees who are not in either accounting or development (as they are treated much differently than other teams), nepotism, negative/toxic work culture, and lack of work/life balance. The churn and burn from their field employees are even worse than corporate. They’re often left on their own and feel forgotten, unsupported, and less than next to corporate employees. There’s zero room for growth and this company has made it known they will keep their employee base status quo. Their retention strategies are to either offer to transfer an employee or promote them when it is too late. I see reviews that make claims about the positive direction the company is taking on diversity but it STILL severely lacks that across their executive management on down. Most of the executive leadership are there to stay and that makes it hard for others to attain upward movement unless those at the top leave. Not to mention, the executives and senior managers perpetuate the toxic culture, which was carried over from pre-merger. You’re seeing turnover in development, accounting, marketing, and HR. Very concerning to me, but not surprised. The management overseeing these groups are who cultivated and continue to perpetuate the negativity and toxicity. I don’t expect that to change unless they leave. You’ll either be pushed out or reach your breaking point here. It’s not worth it, especially for the below market pay that you’re given for the lack of work life balance. I would be cautious when reading these very vague, scripted positive reviews as it doesn’t reflect the current turn over they’re experiencing. Talk to any employee who is currently at the company and those who have left because you will hear the truth behind what goes on and this company is not headed in a positive, upward direction. Sad since this company has potential but I don’t see it succeeding.",JBG SMITH,JBGS,Diversified,2025-11-21,https://www.glassdoor.com/Reviews/JBG-SMITH-Reviews-E1747097.htm
Fast Paced,3.0,"May 13, 2022",Great team and great coworker's. hyrbid schedule and the company is working on some amazing projects that have HUGE impacts within the community. Tech is always changing and staying up to date .,"The company has a lot of big projects down the pipe line which is resulting in a very fast paced environment. There are long hours and lots of opportunities however, the team is under staffed with this transactions occurring.",JBG SMITH,JBGS,Diversified,2025-11-21,https://www.glassdoor.com/Reviews/JBG-SMITH-Reviews-E1747097.htm
Amazing company,5.0,"Feb 7, 2023",Many amazing corporate executives. Donna is beyond amazing and truly cares for everyone. They believe in you and will push you to grow as long as you want it. For anyone that works hard and wants to grow in the property management industry…this is the company for you.,I can’t think of any. It’s an amazing company with great benefits and policies.,JBG SMITH,JBGS,Diversified,2025-11-21,https://www.glassdoor.com/Reviews/JBG-SMITH-Reviews-E1747097.htm
Leasing,1.0,"Jul 10, 2017",I work for JGB company well-known in DMV establish company,No training! Upper management was a task master! My hours was from 8am to 9pm I was the first to work and last to leave constantly picking up the next employee slack! I believe In team work! But that was and understatement. The lynbrook and meadow creek office is manage very unorganized! Resident very aggressive and disrespectful no employee protection. You just left out there to fend for yourself! Resident would over crowd the leasing office with all kinds of demands. Management will not assisted would disappear from the office every time.,JBG SMITH,JBGS,Diversified,2025-11-21,https://www.glassdoor.com/Reviews/JBG-SMITH-Reviews-E1747097.htm
