title,rating,date,pros,cons,company,ticker,property_type,scrape_date,glassdoor_url
"Toxic work environment, lack of advancement, poor management",1.0,"Jul 2, 2021",Office space (new) & healthcare benefits,"Extremely toxic work environment where employees are overworked, under appreciated, under paid, and treated poorly by their managers (particularly if you are in accounting and HR). Very much an ‘old boys club’ or ‘frat’ culture, especially in development where employees of this department act entitled, pretentious, and have overinflated egos because of their Ivy League degrees. Other departments have a ‘bully’ culture within their teams, showing favoritism and promoting inappropriate office behavior (I.e. gossip and poor treatment towards their employees). The accounting department has very high turnover, lacking proper management and training of their new employees. HR has had a lot of turnover since the change in their management. HR executives have replaced many long standing employees with their friends or colleagues from Marriott. Hiring and recruiting practices are questionable — a lot of favoritism and nepotism occur and are mostly driven by executives and managers who hire employees as a favor. Discrimination and biased hiring decisions happen often here (I.e. hiring managers give preference to candidates with Ivy League degrees or specific brick & mortar universities versus hiring a candidate based on skills and experience). Executives hire employees in secret and make drastic changes to their staff without notice, which creates distrust amongst their employees and reflects poor recruiting practices. Their recruiting team experienced high turnover and what once was a positive team that cared about their employees, has been replaced with employees who further perpetuate the toxic work culture and don’t seem to know what they’re doing. The company has made slight improvements to their diversity and inclusion when looking at their demographics, but there’s still a lack of female and minority representation at the executive and management level. For non-corporate positions — there is an extremely high turnover rate at the property sites. The company lacks competitive pay and strong work culture that extends to their field employees. This company doesn’t provide you with any advancement or a clear career path. Onboarding and training don’t exist. You will sink or swim. One day you’re ‘in’ the next day you are ‘out’ without warning. Don’t let the fancy new office space fool you, you’re better off at a company that is employee-centric with stronger values and ethics.",JBG SMITH,JBGS,Diversified,2025-11-21,https://www.glassdoor.com/Reviews/JBG-SMITH-Reviews-E1747097.htm
Learned a lot,4.0,"May 8, 2018",They like to promote within the company so there’s a lot of opportunity for growth.,Heavy work load and does not match the pay.. and your experience is really based on who your manager is. There’s no consistency in the properties and every property manager does things differently.,JBG SMITH,JBGS,Diversified,2025-11-21,https://www.glassdoor.com/Reviews/JBG-SMITH-Reviews-E1747097.htm
Great culture with a focus on customer service,5.0,"Feb 7, 2022",The company will make small gestures toward employees showing appreciation. With a focus on customer service there is pride to work for a great company.,Expanding rapidly and hard to keep up with. Centralized model does not always consider individual objectives or obstacles.,JBG SMITH,JBGS,Diversified,2025-11-21,https://www.glassdoor.com/Reviews/JBG-SMITH-Reviews-E1747097.htm
High Quality Company,4.0,"Sep 26, 2014","Great company! Intelligent employees, great work-life balance, excellent benefits, interesting projects, free snacks and endless peanut butter.","Very political, often have to jump through very unnecessary hoops to get anything accomplished. Poor onboarding and training process.",JBG SMITH,JBGS,Diversified,2025-11-21,https://www.glassdoor.com/Reviews/JBG-SMITH-Reviews-E1747097.htm
Customer Service Representantive,5.0,"Jul 10, 2015","Amicable company, multiple properties, and virtually seamless between properties. Management shows their appreciation for the first line employees, and the surrounding communities. The compensation is livable, with opportunities for growth. Excellent work-life balance.","Only if you have a pessimistic outlook on work in general, with anyone there's always something to complain about at work...",JBG SMITH,JBGS,Diversified,2025-11-21,https://www.glassdoor.com/Reviews/JBG-SMITH-Reviews-E1747097.htm
Pretty Cool Company,4.0,"Jun 10, 2015",-Lots of room for advancement -Good networking opportunities -Generous benefits and pay,"-Lots of micromanagement from the higher ups which conflicts a lot with work life balance, one of them in particular loves to start drama -""Marketing Department"" is basically operations coordinators and actual marketing is done third party, which makes this department difficult to plan any marketing with",JBG SMITH,JBGS,Diversified,2025-11-21,https://www.glassdoor.com/Reviews/JBG-SMITH-Reviews-E1747097.htm
A look back,3.0,"Jan 24, 2018","JBG Smith has many smart, personable employees in a competitive environment. Benefits are top-notch. They are a company that does things first in a first class manner for the most part.",Leadership can be disconnected from most employees. Too much chaos in the merger with Vornado/Smith. Atmosphere of backstabbing at times.,JBG SMITH,JBGS,Diversified,2025-11-21,https://www.glassdoor.com/Reviews/JBG-SMITH-Reviews-E1747097.htm
JBG is amazing!,5.0,"Jul 5, 2014","JBG is an awesome company to work for. There is plenty of room for growth, they're benefits are great, and everyone is so welcoming and knowledgeable!!! They also offer a 20% discount if you chose to live at a JBG property which is decent.",First place I've worked with no cons.,JBG SMITH,JBGS,Diversified,2025-11-21,https://www.glassdoor.com/Reviews/JBG-SMITH-Reviews-E1747097.htm
"Great company, constantly growing and cares about employees.",4.0,"Jan 28, 2015","Company is continually growing and management tries to create a culture where everyone feels part of something bigger. The corporate office has breakfast out daily, frequent lunches, learning events, family events, etc... A fun place to work.","Depending on what department you work in, you may run out of space to grow/advance.",JBG SMITH,JBGS,Diversified,2025-11-21,https://www.glassdoor.com/Reviews/JBG-SMITH-Reviews-E1747097.htm
Over worked and underpaid,3.0,"Feb 16, 2021",learned a lot and was able to work independently,There was more than 8hours worth of work in a day and I was expected to have all of my work completed within the 8 hours and was not offered overtime or fully supported with any other incentive.,JBG SMITH,JBGS,Diversified,2025-11-21,https://www.glassdoor.com/Reviews/JBG-SMITH-Reviews-E1747097.htm
Great Company,5.0,"Jul 23, 2017",Work/Life Balance focused Competitive Salaries Generous Benefits Great group of people to work with The company truly cares about the welfare of each of its employees and it shows.,"As hard as it may seem to believe, working at JBG has been one of, if not the only company I've worked where I have no complaints.",JBG SMITH,JBGS,Diversified,2025-11-21,https://www.glassdoor.com/Reviews/JBG-SMITH-Reviews-E1747097.htm
Real Estate Manager,4.0,"Sep 5, 2017",Company Moral good; President cares about work life balance; days off; market leader.,Challenging integration; High level competition; Pace too high.,JBG SMITH,JBGS,Diversified,2025-11-21,https://www.glassdoor.com/Reviews/JBG-SMITH-Reviews-E1747097.htm
"Great Experience, Poor Work/Life Balance",4.0,"Sep 13, 2018","Great management, dress code includes jeans, lots of opportunities within company, industry leader, fun culture, gorgeous buildings.",7-8 day work weeks come with the leasing consultant position. 9 hour office days M-F. It gets exhausting and doesn't make a difference to your bonus anyway.,JBG SMITH,JBGS,Diversified,2025-11-21,https://www.glassdoor.com/Reviews/JBG-SMITH-Reviews-E1747097.htm
Wonderful Company,5.0,"Apr 24, 2019",Great people to work with. Openness to share ideas w/ any level of management. Growth Possibilities. Best CEO in the business.,"Diversity could be better, but realizing this is a predominately male industry I think they do the best they can.",JBG SMITH,JBGS,Diversified,2025-11-21,https://www.glassdoor.com/Reviews/JBG-SMITH-Reviews-E1747097.htm
"Self-absorbed management at corporate, office politics and blatant favoritism",1.0,"Jun 11, 2017","Onsite employee perks (coffee, drinks, ice cream parties, breakfast).","Management is self-absorbed. Limited promotion opportunities are given to favourites rather than actual performance & abilities. Corporate inbreeding will be a determent to the company. Don't be fooled the HR department is there to protect the company, not for looking at the best interests of the employee.",JBG SMITH,JBGS,Diversified,2025-11-21,https://www.glassdoor.com/Reviews/JBG-SMITH-Reviews-E1747097.htm
Good employer overall and progressive,4.0,"Oct 18, 2021","Generous with PTO, diversity & inclusion is important, fantastic health benefits!","Huge difference between corporate and on-site employees. On-site have been back to work for many months while corporate just got back to working in the office. Major difference in PTO and holidays, too.",JBG SMITH,JBGS,Diversified,2025-11-21,https://www.glassdoor.com/Reviews/JBG-SMITH-Reviews-E1747097.htm
Accounting department is a revolving door,3.0,"Jul 7, 2019","Contemporary corporate environment. Management is friendly, plenty of company outings.",Workload is overbearing. Always working short staffed. Management does not listen to feedback. Accounting team is a revolving door. Not much room to grow.,JBG SMITH,JBGS,Diversified,2025-11-21,https://www.glassdoor.com/Reviews/JBG-SMITH-Reviews-E1747097.htm
Amazing Company,5.0,"Mar 31, 2022",JBG Smith truly values their employees. They ensure everybody has a healthy work/life balance which is essential in order to successfully perform tasks. They have amazing benefits and compensation! Senior leadership is phenomenal and easy to talk to.,JBG is a phenomenal company- so happy to be here :-),JBG SMITH,JBGS,Diversified,2025-11-21,https://www.glassdoor.com/Reviews/JBG-SMITH-Reviews-E1747097.htm
Great job for learning and growth.,5.0,"Jan 9, 2023","Team members, training, support, sales, learning, JBG Cares initiative","Had a great experience but the are very neighborhood focused with only working in the DMV so when I moved, I had to change company's. However, I was set up with good knowledge in the industry.",JBG SMITH,JBGS,Diversified,2025-11-21,https://www.glassdoor.com/Reviews/JBG-SMITH-Reviews-E1747097.htm
Best overall PMGT IMO,5.0,"Apr 15, 2021","Benefits, exposure, advancement opportunities and stock options.","Overall company is great, but your day to day boils down to the property manager. Daily elements are the difference between a tolerable time and a great productive time at work.",JBG SMITH,JBGS,Diversified,2025-11-21,https://www.glassdoor.com/Reviews/JBG-SMITH-Reviews-E1747097.htm
AN AMAZING COMPANY!!!,5.0,"Apr 3, 2022",-Care for their employees -Not overwhelming -Lots of training -Salary above industry standard,-Managers are everything. Their word final -They'll fire you in a heartbeat. A.k.a your manager,JBG SMITH,JBGS,Diversified,2025-11-21,https://www.glassdoor.com/Reviews/JBG-SMITH-Reviews-E1747097.htm
JBG SMITH is a great company to work for and live in A JBG Smith community,5.0,"Jan 4, 2022",JBG Smith really take good care of all the company employee's,"Never had a problem with JBG Smith, very happy",JBG SMITH,JBGS,Diversified,2025-11-21,https://www.glassdoor.com/Reviews/JBG-SMITH-Reviews-E1747097.htm
Great place to work,4.0,"Dec 12, 2022","Smart, driven, and hard working employees, competitive benefits and pay, interesting work, fast paced environment, lots of growth potential, strong and competent leadership","Must be in office 3 days each week, long hours, some turnover due to changes in the organization and market conditions",JBG SMITH,JBGS,Diversified,2025-11-21,https://www.glassdoor.com/Reviews/JBG-SMITH-Reviews-E1747097.htm
First year in leasing,4.0,"Jul 12, 2021","Great company. The leadership care, staff is very friendly and they have a great culture. They want you to move up and have many opportunities to move up . Great benefits",Pay is very low for the area.,JBG SMITH,JBGS,Diversified,2025-11-21,https://www.glassdoor.com/Reviews/JBG-SMITH-Reviews-E1747097.htm
Great company,5.0,"Dec 11, 2021","Excellent benefits: unlimited PTO, 16 weeks maternity, insurance through United Healthcare and Delta Dental, all government holidays",Work-life balance can vary depending on your team. No opportunity for full-time remote work (but they do have a flexible office schedule).,JBG SMITH,JBGS,Diversified,2025-11-21,https://www.glassdoor.com/Reviews/JBG-SMITH-Reviews-E1747097.htm
Takes care of employees,5.0,"Jan 26, 2022",Paid front-line workers extra during COVID. Would send us gift boxes of goodies during Pandemic. Treats employees very well.,Some properties marketed as Class A do need a little bit more attention in upkeep and maintenance.,JBG SMITH,JBGS,Diversified,2025-11-21,https://www.glassdoor.com/Reviews/JBG-SMITH-Reviews-E1747097.htm
Best Company Ever !,5.0,"Mar 18, 2022",-they care about their employees - encourages internal growth at the residential level (unsure about residential to corporate) -great insurance benefits and metro benefits !,corporate may be a little disconnected from the onsite residential team at times,JBG SMITH,JBGS,Diversified,2025-11-21,https://www.glassdoor.com/Reviews/JBG-SMITH-Reviews-E1747097.htm
Feeling right at home from day 1,5.0,"Mar 31, 2022",The culture and professionalism makes you feel welcomed and wanted.,No cons to share here.,JBG SMITH,JBGS,Diversified,2025-11-21,https://www.glassdoor.com/Reviews/JBG-SMITH-Reviews-E1747097.htm
This has been the best company I have ever worked for.,5.0,"Jul 10, 2014","This company cares about its employees, customers and community. Pay is great and so is the opportunity for advancement.",I have nothing bad to say about JBG,JBG SMITH,JBGS,Diversified,2025-11-21,https://www.glassdoor.com/Reviews/JBG-SMITH-Reviews-E1747097.htm
Awesome Company to work for.,5.0,"Apr 26, 2017","Great office environments. Employees are nice, considerate and fun to work with.",None so far that I can think of.,JBG SMITH,JBGS,Diversified,2025-11-21,https://www.glassdoor.com/Reviews/JBG-SMITH-Reviews-E1747097.htm
Great place to work!,5.0,"Oct 1, 2021","Everyone is incredibly bright and hardworking, interesting work, great benefits",Team members seem to switch projects often and needs more mentorship,JBG SMITH,JBGS,Diversified,2025-11-21,https://www.glassdoor.com/Reviews/JBG-SMITH-Reviews-E1747097.htm
Real Estate Admin,4.0,"Dec 13, 2017","Great team, awsome tenants and nice property. Pay is good as well as bonuses. Plenty of vacation, sick, personal time.",Not enough support from upper mgmt. No coverage for time off.,JBG SMITH,JBGS,Diversified,2025-11-21,https://www.glassdoor.com/Reviews/JBG-SMITH-Reviews-E1747097.htm
Mediocre pay for outstanding performance.,2.0,"Feb 15, 2023",The tenants especially long term residents who were so grateful and kind.,The staff-more specifically the long term employees who would get away with bad customer service all the time.,JBG SMITH,JBGS,Diversified,2025-11-21,https://www.glassdoor.com/Reviews/JBG-SMITH-Reviews-E1747097.htm
Leasing Consultanat,1.0,"Jan 16, 2018",Nothing at all really. Maybe the employees were ok to get along with.,ultanat,JBG SMITH,JBGS,Diversified,2025-11-21,https://www.glassdoor.com/Reviews/JBG-SMITH-Reviews-E1747097.htm
Hardworking Culture,4.0,"Dec 16, 2020","Very talented, intelligent, and driven employees. JBG is the best of the best as far as DC Real Estate goes.","Very heavy workload throughout the company. Lots of software/systems are out-of-date, resulting in inefficiencies.",JBG SMITH,JBGS,Diversified,2025-11-21,https://www.glassdoor.com/Reviews/JBG-SMITH-Reviews-E1747097.htm
Low Pay,3.0,"Jun 16, 2022","Benefits, a lot of room for growth","Over work people, low wage for the amount of stress. Many people quitting at once and they expected people to pick up the slack with no extra incentive.",JBG SMITH,JBGS,Diversified,2025-11-21,https://www.glassdoor.com/Reviews/JBG-SMITH-Reviews-E1747097.htm
Leasing Consulting,3.0,"May 29, 2015","Very professional, clean cut, and large company.",ulting,JBG SMITH,JBGS,Diversified,2025-11-21,https://www.glassdoor.com/Reviews/JBG-SMITH-Reviews-E1747097.htm
Admin,4.0,"Oct 25, 2018",Great company culture. The work/life balance was wonderful. The managers really cares about the success of their employees,Not much room for growth. This was not the place to climb the ladder,JBG SMITH,JBGS,Diversified,2025-11-21,https://www.glassdoor.com/Reviews/JBG-SMITH-Reviews-E1747097.htm
"Good learning, but poor work/life balance",4.0,"Sep 27, 2021","Lots of hands-on development learning experience, especially for an entry-level role","The work-life balance is uniquely bad, and can be overwhelming and challenging",JBG SMITH,JBGS,Diversified,2025-11-21,https://www.glassdoor.com/Reviews/JBG-SMITH-Reviews-E1747097.htm
Nice company to work with!,4.0,"Oct 4, 2022",Really great vacation and leave options. Health insurance is outstanding.,The pay is low compared to competing companies.,JBG SMITH,JBGS,Diversified,2025-11-21,https://www.glassdoor.com/Reviews/JBG-SMITH-Reviews-E1747097.htm
Property Manager,5.0,"Apr 22, 2015","Great Benefits, Family oriented, great pay, collaborative environment","Honestly, this company values all employees and does its best to keep them all.",JBG SMITH,JBGS,Diversified,2025-11-21,https://www.glassdoor.com/Reviews/JBG-SMITH-Reviews-E1747097.htm
Great Company!,4.0,"Sep 24, 2021","Great people, very bright, high profile projects","Really enjoyed my time, only wish they promoted a little faster",JBG SMITH,JBGS,Diversified,2025-11-21,https://www.glassdoor.com/Reviews/JBG-SMITH-Reviews-E1747097.htm
Concierge is not for the faint of heart,4.0,"Apr 27, 2021","Friendly residents, every day looks different.",Work-life balance. No time to decompress/no breaks. Very very demanding.,JBG SMITH,JBGS,Diversified,2025-11-21,https://www.glassdoor.com/Reviews/JBG-SMITH-Reviews-E1747097.htm
Great opportunity to learn right out of school,5.0,"Mar 15, 2019",Amazing hands on the ground development experience,Company is going through big transitions,JBG SMITH,JBGS,Diversified,2025-11-21,https://www.glassdoor.com/Reviews/JBG-SMITH-Reviews-E1747097.htm
Great Place to Work,5.0,"Jan 10, 2021",The people. The hours are not that bad compared to other companies in the real estate industry.,Somedays are long. But rarely.,JBG SMITH,JBGS,Diversified,2025-11-21,https://www.glassdoor.com/Reviews/JBG-SMITH-Reviews-E1747097.htm
Great place to work!,5.0,"Nov 2, 2022",JBG Smith offers a great work life balance.,"The amount of work that is involved in leasing, the pay could be better.",JBG SMITH,JBGS,Diversified,2025-11-21,https://www.glassdoor.com/Reviews/JBG-SMITH-Reviews-E1747097.htm
Oversee multiple assets ranging in class profile,5.0,"May 8, 2015","Family oriented, stellar support, promote from within, exceptional upper management",There are none to share - amazing organization!,JBG SMITH,JBGS,Diversified,2025-11-21,https://www.glassdoor.com/Reviews/JBG-SMITH-Reviews-E1747097.htm
Awesome,4.0,"Jan 28, 2017",Great Company with even better culture. Benefits and bonuses are very generous.,"currently merging with another company, curious to see how that will play out.",JBG SMITH,JBGS,Diversified,2025-11-21,https://www.glassdoor.com/Reviews/JBG-SMITH-Reviews-E1747097.htm
Amazing,5.0,"Oct 19, 2021","They are a great company to work for. Great benefits, great people! They really do care about the employees",I can’t think of anything.,JBG SMITH,JBGS,Diversified,2025-11-21,https://www.glassdoor.com/Reviews/JBG-SMITH-Reviews-E1747097.htm
could be better,3.0,"Jan 31, 2022",facilities Engineers are union with local 99,Felling that the company doesn't care much about their employees as they used to.,JBG SMITH,JBGS,Diversified,2025-11-21,https://www.glassdoor.com/Reviews/JBG-SMITH-Reviews-E1747097.htm
Unethical Practices,1.0,"Jan 27, 2016",salary and benefit packages is competitive,"could use an extensive amount of training in diversity. extremely political and favoritism isn't blatant, even when the staff member doesn't perform. training of staff when hired would alleviate time wasted",JBG SMITH,JBGS,Diversified,2025-11-21,https://www.glassdoor.com/Reviews/JBG-SMITH-Reviews-E1747097.htm
"Smart, talented workforce",5.0,"Feb 6, 2020",Great pay and benefits. Access to leaders. Entrepreneurial feel. Beautiful workplaces close to public transportation.,None to add at this time.,JBG SMITH,JBGS,Diversified,2025-11-21,https://www.glassdoor.com/Reviews/JBG-SMITH-Reviews-E1747097.htm
Very flexible during the COVID 19 pandemic,5.0,"Sep 21, 2021","Pay 
Flexible 
Good Communication to Employees 
Listens to employee feedback",Not enough positions available in my field,JBG SMITH,JBGS,Diversified,2025-11-21,https://www.glassdoor.com/Reviews/JBG-SMITH-Reviews-E1747097.htm
Great Place to grow!,5.0,"Dec 17, 2021",The people and the variety of work are the best part.,"No issues working here, I enjoy everything about it!",JBG SMITH,JBGS,Diversified,2025-11-21,https://www.glassdoor.com/Reviews/JBG-SMITH-Reviews-E1747097.htm
Great firm,5.0,"May 14, 2019",solid pay; good people; great experience,less entrepreneurial since going public,JBG SMITH,JBGS,Diversified,2025-11-21,https://www.glassdoor.com/Reviews/JBG-SMITH-Reviews-E1747097.htm
Is Just Business,2.0,"Mar 17, 2021",Big Company with strong financials.,Managers with low confidence and fragile egos motivated by higher salaries.,JBG SMITH,JBGS,Diversified,2025-11-21,https://www.glassdoor.com/Reviews/JBG-SMITH-Reviews-E1747097.htm
Great Training and Experience,5.0,"Sep 14, 2022","Deep market knowledge, reputation, training",Compensation just okay (had friends in comparable role making more and some making less),JBG SMITH,JBGS,Diversified,2025-11-21,https://www.glassdoor.com/Reviews/JBG-SMITH-Reviews-E1747097.htm
Leasing Consultant at JBG,5.0,"Feb 9, 2017",Great management team. Good salary and benefits. Flexible work schedule.,ultant at JBG,JBG SMITH,JBGS,Diversified,2025-11-21,https://www.glassdoor.com/Reviews/JBG-SMITH-Reviews-E1747097.htm
"Great team, fair time off!",4.0,"Jan 19, 2018","Good time off, decent pay, nice people to work with!","Focused on developing and selling, not maintaining management.",JBG SMITH,JBGS,Diversified,2025-11-21,https://www.glassdoor.com/Reviews/JBG-SMITH-Reviews-E1747097.htm
Great work environment and leadership.,5.0,"May 26, 2021",Great work environment and leadership.,There are no real cons. Experience may differ from group to group.,JBG SMITH,JBGS,Diversified,2025-11-21,https://www.glassdoor.com/Reviews/JBG-SMITH-Reviews-E1747097.htm
Best real estate company in the DC area,5.0,"Sep 15, 2021","Teamwork, collegiality, supportive and inclusive culture",Demanding culture with very high expectations for performance,JBG SMITH,JBGS,Diversified,2025-11-21,https://www.glassdoor.com/Reviews/JBG-SMITH-Reviews-E1747097.htm
Great experience,5.0,"Feb 10, 2014","JBG has great benefits, promotes within, training and a family feel.",I don't have any cons for the company,JBG SMITH,JBGS,Diversified,2025-11-21,https://www.glassdoor.com/Reviews/JBG-SMITH-Reviews-E1747097.htm
Awesome,2.0,"Jul 10, 2018",This is a company that is quickly making strides to n the industry both residential and commercial.,Few opportunities for advancement,JBG SMITH,JBGS,Diversified,2025-11-21,https://www.glassdoor.com/Reviews/JBG-SMITH-Reviews-E1747097.htm
It’s Okay,4.0,"Dec 14, 2021",The company is more progressive than many real estate companies.,Career development and professional growth do not get much attention.,JBG SMITH,JBGS,Diversified,2025-11-21,https://www.glassdoor.com/Reviews/JBG-SMITH-Reviews-E1747097.htm
Lead Building Engineer,5.0,"Oct 19, 2016",Great Company that really takes care of their employees,Retirement package isn't the best but its okay.,JBG SMITH,JBGS,Diversified,2025-11-21,https://www.glassdoor.com/Reviews/JBG-SMITH-Reviews-E1747097.htm
Great company,4.0,"Mar 3, 2019","Room for growth, Numerous locations, several departments",Company completely changed once merging and going public,JBG SMITH,JBGS,Diversified,2025-11-21,https://www.glassdoor.com/Reviews/JBG-SMITH-Reviews-E1747097.htm
Pretty Good Overview,4.0,"Feb 14, 2022",Retirement Benefits Residents Holiday Parties Company Care Packages Upward Mobility OT opportunities Tutition Remission,At times 'too urban' properties (if you get my drift).,JBG SMITH,JBGS,Diversified,2025-11-21,https://www.glassdoor.com/Reviews/JBG-SMITH-Reviews-E1747097.htm
Great Company,5.0,"Jul 20, 2022","Great perks, work/life balance, beautiful office","Slow moving with key decisions, not marketing-centric",JBG SMITH,JBGS,Diversified,2025-11-21,https://www.glassdoor.com/Reviews/JBG-SMITH-Reviews-E1747097.htm
Complete Staff Turnover within 3 Months,2.0,"Mar 2, 2017",None I can think of.,"Company cannot retain employees, high turnover! Poorly managed.",JBG SMITH,JBGS,Diversified,2025-11-21,https://www.glassdoor.com/Reviews/JBG-SMITH-Reviews-E1747097.htm
There are worse companies to work for.,3.0,"Apr 20, 2018",Still trying to figure that out.,Pay is not that great.,JBG SMITH,JBGS,Diversified,2025-11-21,https://www.glassdoor.com/Reviews/JBG-SMITH-Reviews-E1747097.htm
Great company,5.0,"Nov 11, 2020","Great benefits, pay and time off.",Hours can vary on a tech,JBG SMITH,JBGS,Diversified,2025-11-21,https://www.glassdoor.com/Reviews/JBG-SMITH-Reviews-E1747097.htm
