title,rating,date,pros,cons,company,ticker,property_type,scrape_date,glassdoor_url
Great place to work,5.0,"Oct 23, 2025",Great place to work. Highly recommend,No complaints- this is a great job.,JBG SMITH,JBGS,Diversified,2025-11-21,https://www.glassdoor.com/Reviews/JBG-SMITH-Reviews-E1747097.htm
Great place to work,5.0,"Nov 2, 2025","benefits, work life balance, culture",strict deadlines given it's a public company; limited growth potential without CPA.,JBG SMITH,JBGS,Diversified,2025-11-21,https://www.glassdoor.com/Reviews/JBG-SMITH-Reviews-E1747097.htm
Great place to learn!,4.0,"Aug 13, 2025",Institutional real estate shop with storied DC roots.,"Underpaid for many positions, particularly in finance / investing roles.",JBG SMITH,JBGS,Diversified,2025-11-21,https://www.glassdoor.com/Reviews/JBG-SMITH-Reviews-E1747097.htm
Professional and Employee Oriented,5.0,"Dec 3, 2024","Great company with a positive work environment. I learned a lot during my time as a maintenance tech and really enjoyed the team I worked with. I was able to develop my skills and take on new challenges, which ultimately led to a promotion at another company. I'm grateful for the experience I gained at JBG Smith and look forward to potentially returning in the future.","While my overall experience at JBG Smith was positive, I did encounter a challenging situation with a new manager. Their behavior towards both myself and other employees was unprofessional and often disrespectful. Despite this, I appreciate that HR took action after I raised my concerns, even though it was during my departure. It's encouraging to hear that the situation improved for the remaining team members.",JBG SMITH,JBGS,Diversified,2025-11-21,https://www.glassdoor.com/Reviews/JBG-SMITH-Reviews-E1747097.htm
Great benefits but..,1.0,"Jun 24, 2025",Benefits are unmatched and management is usually friendly,Opportunity for growth pretty much doesn't exist. Management would rather promote someone from outside your portfolio than those that work in the same office,JBG SMITH,JBGS,Diversified,2025-11-21,https://www.glassdoor.com/Reviews/JBG-SMITH-Reviews-E1747097.htm
Accountant,2.0,"May 28, 2025",Opportunities for collaboration between departments.,Lots of office politics that are hard to navigate.,JBG SMITH,JBGS,Diversified,2025-11-21,https://www.glassdoor.com/Reviews/JBG-SMITH-Reviews-E1747097.htm
Strong Leader in DC Real Estate,5.0,"Mar 26, 2025","Very intelligent and talented employees/leadership, well-respected firm in DC/MD/VA and throughout the region, fantastic corporate office, high-quality and high-profile buildings/projects.","Along with many other real estate firms nationally and in the region, firm has struggled financially since COVID.",JBG SMITH,JBGS,Diversified,2025-11-21,https://www.glassdoor.com/Reviews/JBG-SMITH-Reviews-E1747097.htm
Decent Company,4.0,"Feb 10, 2025","Regionally focused company
Opportunity for advancement","Slow promotion
Power being taken away from onsite staff",JBG SMITH,JBGS,Diversified,2025-11-21,https://www.glassdoor.com/Reviews/JBG-SMITH-Reviews-E1747097.htm
Best Company to Work For,5.0,"Dec 20, 2024","I absolutely loved how work/life balance was huge part of the company. Pay was great, commission was good, they gave back to their employees with nice events.",Didn’t experience any…well other than they sold one of their properties & that can be a risk.,JBG SMITH,JBGS,Diversified,2025-11-21,https://www.glassdoor.com/Reviews/JBG-SMITH-Reviews-E1747097.htm
"Good benefits, horrible management",2.0,"Sep 26, 2024","Loved employee benefits like our health insurance. Summer Fridays. Once you move up, you get work from home days, and flexibility with that.","The upper management hates the little guy. Common, but it's depressing and unnecessary, as well as my reason for quitting. Lots of shuffling as well. I had 3 managers in 18 months.",JBG SMITH,JBGS,Diversified,2025-11-21,https://www.glassdoor.com/Reviews/JBG-SMITH-Reviews-E1747097.htm
"Good company, Great benefits",5.0,"Oct 30, 2024",health insurance benefits and premiums were low. Lots of properties to choose from. Up to date on technology.,in 2015 I was making $100 per commission. Hopefully it is more now.,JBG SMITH,JBGS,Diversified,2025-11-21,https://www.glassdoor.com/Reviews/JBG-SMITH-Reviews-E1747097.htm
"Fine Company, Supportive Team, Difficult Job",4.0,"Jul 24, 2024",The SVP who leads is talented and extremely smart. I enjoyed working with her and thought that she led the team in a professional manner.,"I did not have the experience to do this job properly and it showed as this is an extremely specialized area of tax. I can't blame JBG Smith, this was mostly on me. I'm glad I ended up leaving and finding a job that was more compatible with my skills.",JBG SMITH,JBGS,Diversified,2025-11-21,https://www.glassdoor.com/Reviews/JBG-SMITH-Reviews-E1747097.htm
Good,3.0,"Nov 15, 2024",Good place to work and nice environment,no formal training to develop new hires,JBG SMITH,JBGS,Diversified,2025-11-21,https://www.glassdoor.com/Reviews/JBG-SMITH-Reviews-E1747097.htm
Admin,2.0,"Oct 22, 2024","Great people, cool office, good benefits","Diversity, work culture in some departments",JBG SMITH,JBGS,Diversified,2025-11-21,https://www.glassdoor.com/Reviews/JBG-SMITH-Reviews-E1747097.htm
Love the company,4.0,"Sep 30, 2024","Great benefits, leave accrual, and sense of community.",Difficult to move up without the right internal connections.,JBG SMITH,JBGS,Diversified,2025-11-21,https://www.glassdoor.com/Reviews/JBG-SMITH-Reviews-E1747097.htm
Great Place to Learn,4.0,"Jul 18, 2024","You will be challenged. Lots of very smart, motivated people in the department. Great learning experience as you advance in your career.","A bit stressful at times. Even with efficiencies gained in automating processes, there's always more work to do,",JBG SMITH,JBGS,Diversified,2025-11-21,https://www.glassdoor.com/Reviews/JBG-SMITH-Reviews-E1747097.htm
Good Place To Work,4.0,"May 30, 2024",JBG Smith was a great social environment to work in - people were friendly. The office is beautiful.,The open office setup of the main office is tough for daily desk work. When I joined there was a lot of work from home flexibility which they started to roll back in 2023. Commuting was tough. They made employees pay for parking in a building that they owned and managed.,JBG SMITH,JBGS,Diversified,2025-11-21,https://www.glassdoor.com/Reviews/JBG-SMITH-Reviews-E1747097.htm
Just OK,3.0,"Aug 5, 2024",Pay is Ok and free bagels,No upward communications. Managers arent trained at all. Some lack people skills,JBG SMITH,JBGS,Diversified,2025-11-21,https://www.glassdoor.com/Reviews/JBG-SMITH-Reviews-E1747097.htm
Great place to work,5.0,"Jun 26, 2024","Benefits, culture, pay, work life balance (unlimited PTO, Summer Fridays)",Company is going through a tough time due to office market. I’m sure it will be rebound.,JBG SMITH,JBGS,Diversified,2025-11-21,https://www.glassdoor.com/Reviews/JBG-SMITH-Reviews-E1747097.htm
great culture,3.0,"Jul 1, 2024",it's a good place to work and offers great benefits and connections,can be a limiting place,JBG SMITH,JBGS,Diversified,2025-11-21,https://www.glassdoor.com/Reviews/JBG-SMITH-Reviews-E1747097.htm
Good place to start,3.0,"Jun 1, 2024",JBG Smith is a great place to build your skillset as an analyst,Comp could be better and there seems to be some concerns about job security.,JBG SMITH,JBGS,Diversified,2025-11-21,https://www.glassdoor.com/Reviews/JBG-SMITH-Reviews-E1747097.htm
No Interaction with Corporate,2.0,"Apr 30, 2024",The compensation and benefits offered are strong.,"The turnover is very very high. In my short time at a JBG property, there have been six firings on a staff of nine.",JBG SMITH,JBGS,Diversified,2025-11-21,https://www.glassdoor.com/Reviews/JBG-SMITH-Reviews-E1747097.htm
Great place to develop your career,5.0,"Apr 25, 2024",Great learning experience and given a lot of autonomy,Very faced paced and need to be able to multitask,JBG SMITH,JBGS,Diversified,2025-11-21,https://www.glassdoor.com/Reviews/JBG-SMITH-Reviews-E1747097.htm
Safe Place,3.0,"Apr 27, 2024","Great benefits, pay, and flexibility",Not totally sure where the company is headed,JBG SMITH,JBGS,Diversified,2025-11-21,https://www.glassdoor.com/Reviews/JBG-SMITH-Reviews-E1747097.htm
Worst company I ever worked for,1.0,"Mar 14, 2024",Absolutely none. Nothing positive about this company to share!,"I left a 10 year carrier job, competed with over 500 qualified candidates for the position. Got the job, only to get laid off 6 months later. Very toxic work environment. Leadership is a disaster. HR is a disgrace.",JBG SMITH,JBGS,Diversified,2025-11-21,https://www.glassdoor.com/Reviews/JBG-SMITH-Reviews-E1747097.htm
Would not recommend,1.0,"May 10, 2024",Nice office with amenities and benefits are decent.,"Poor management, micromanaging, underpaid for the work expected of you in the position.",JBG SMITH,JBGS,Diversified,2025-11-21,https://www.glassdoor.com/Reviews/JBG-SMITH-Reviews-E1747097.htm
Overall good place to work,3.0,"Nov 27, 2023",The physical office has excellent perks and HR tries to make employees feel appreciated often.,"The ""streamlined"" approaches to some of the work are actually more cumbersome and can lead to an increased work load or the need to double check things.",JBG SMITH,JBGS,Diversified,2025-11-21,https://www.glassdoor.com/Reviews/JBG-SMITH-Reviews-E1747097.htm
Its ok,4.0,"Feb 27, 2024",nice office and nice people,"commute, poor communication, too many meetings",JBG SMITH,JBGS,Diversified,2025-11-21,https://www.glassdoor.com/Reviews/JBG-SMITH-Reviews-E1747097.htm
Great place to work,5.0,"Jan 30, 2024",Great culture and the best company I have worked at.,Inclusiveness within the departments. It could get clicky,JBG SMITH,JBGS,Diversified,2025-11-21,https://www.glassdoor.com/Reviews/JBG-SMITH-Reviews-E1747097.htm
cool,3.0,"Feb 9, 2024","Decent hours, good time off, benefits","bad management, no accountability, low bonus pay",JBG SMITH,JBGS,Diversified,2025-11-21,https://www.glassdoor.com/Reviews/JBG-SMITH-Reviews-E1747097.htm
It was great... until it wasn't,2.0,"Oct 31, 2023","Fun environment for the employees, young executives with open minds, diverse inclusive culture, breakfast, snacks and drinks provided daily.","Employees laid off or leaving and not replaced which leaves more work and stress on those left. Very worrisome for remaining staff, ""will I be the next one cut?""",JBG SMITH,JBGS,Diversified,2025-11-21,https://www.glassdoor.com/Reviews/JBG-SMITH-Reviews-E1747097.htm
A place to work,4.0,"Dec 29, 2023",Large portfolio of commercial buildings.,Impacted by commercial office vacancy due to hybrid and work from home policies brought on by Covid-19.,JBG SMITH,JBGS,Diversified,2025-11-21,https://www.glassdoor.com/Reviews/JBG-SMITH-Reviews-E1747097.htm
JBG SMITH,4.0,"Nov 15, 2023","Jbg is a diverse, open and welcoming company. I hit the ground running with a team in place to help every step of the way.",knowledge before delegating . but that's most management companies.,JBG SMITH,JBGS,Diversified,2025-11-21,https://www.glassdoor.com/Reviews/JBG-SMITH-Reviews-E1747097.htm
Great Employer,5.0,"Dec 29, 2023",Great flexible schedule. Independent work.,More internal communication would be nice.,JBG SMITH,JBGS,Diversified,2025-11-21,https://www.glassdoor.com/Reviews/JBG-SMITH-Reviews-E1747097.htm
Property Manager,4.0,"Nov 14, 2023","Benefits, paid leave, support from corporate.","Location of assets, work life balance",JBG SMITH,JBGS,Diversified,2025-11-21,https://www.glassdoor.com/Reviews/JBG-SMITH-Reviews-E1747097.htm
Great team and great benefits,4.0,"Oct 2, 2023","A lot of support, great team and training opportunities",Compensation was low but fair was commission,JBG SMITH,JBGS,Diversified,2025-11-21,https://www.glassdoor.com/Reviews/JBG-SMITH-Reviews-E1747097.htm
JBG Smith,4.0,"Oct 17, 2023",Nice office space in Bethesda.,Executive heavy real estate company.,JBG SMITH,JBGS,Diversified,2025-11-21,https://www.glassdoor.com/Reviews/JBG-SMITH-Reviews-E1747097.htm
Hmmmm,2.0,"Jun 10, 2023",Property was walking distance from my place.,"I turned in my 2 week notice before leaving, and recently found out when a new employer called to verify my employment that I am ineligible for rehire due to not having given a 2 week notice. Called and emailed for clarification, still awaiting a response.",JBG SMITH,JBGS,Diversified,2025-11-21,https://www.glassdoor.com/Reviews/JBG-SMITH-Reviews-E1747097.htm
JBG SMITH,5.0,"Aug 12, 2023",Intelligent people and great projects,Lots of turnover and few employees in office,JBG SMITH,JBGS,Diversified,2025-11-21,https://www.glassdoor.com/Reviews/JBG-SMITH-Reviews-E1747097.htm
Great place to learn,5.0,"Jul 22, 2023",Great place to learn with opportunities for advancement Collaborative environment with strong teams,Must enjoy working for a public company,JBG SMITH,JBGS,Diversified,2025-11-21,https://www.glassdoor.com/Reviews/JBG-SMITH-Reviews-E1747097.htm
ASSULT,1.0,"Jun 21, 2023",Great residential property with great views,I was let go from jbg after being Assaulted with a deadly weapon in hand by the front desk. Which they have footage of. I was told that they don’t support assault of any kind but they have to let me go. Last time I checked my life was at risk and instead of protecting me they fired me! Insane!!!,JBG SMITH,JBGS,Diversified,2025-11-21,https://www.glassdoor.com/Reviews/JBG-SMITH-Reviews-E1747097.htm
Great Company for stability if you keep your head down,3.0,"Jun 7, 2023",- Stable - Opportunities for Growth - Bonuses and incentives - Wide range of properties,- Culture of favoritism among portfolios - Pay raises limited - High turnover results on overwork and burnout,JBG SMITH,JBGS,Diversified,2025-11-21,https://www.glassdoor.com/Reviews/JBG-SMITH-Reviews-E1747097.htm
Great Company,5.0,"Jun 16, 2023",I learned a lot and promoted working within this company (formerly The JBG Companies).,My commute was 70 miles one way,JBG SMITH,JBGS,Diversified,2025-11-21,https://www.glassdoor.com/Reviews/JBG-SMITH-Reviews-E1747097.htm
Great buildings and vision,3.0,"May 23, 2023",Jbg is a well oiled machine. The company is full of support and great mentors.,Once old employees leave it’s hard to return.,JBG SMITH,JBGS,Diversified,2025-11-21,https://www.glassdoor.com/Reviews/JBG-SMITH-Reviews-E1747097.htm
Pay estimate,4.0,"Jun 12, 2023","Growth opportunities, job security, training","High turnover, low pay, tight deadlines",JBG SMITH,JBGS,Diversified,2025-11-21,https://www.glassdoor.com/Reviews/JBG-SMITH-Reviews-E1747097.htm
Okay,4.0,"May 8, 2023","Good benefits, nice team members","Poor communication from leadership, corporate staff treated better than on-site staff with separate events, nicer office perks",JBG SMITH,JBGS,Diversified,2025-11-21,https://www.glassdoor.com/Reviews/JBG-SMITH-Reviews-E1747097.htm
Great company,4.0,"May 2, 2023",Excellent company to work for!,Communication from upper management isn't always transparent,JBG SMITH,JBGS,Diversified,2025-11-21,https://www.glassdoor.com/Reviews/JBG-SMITH-Reviews-E1747097.htm
Great Place to Work,5.0,"Mar 26, 2023",Hard working people. Lots of growth to come. Relatively flat structure.,None that I can think of.,JBG SMITH,JBGS,Diversified,2025-11-21,https://www.glassdoor.com/Reviews/JBG-SMITH-Reviews-E1747097.htm
Great place to work for a few months if you're unemployed and hate yourself,2.0,"Jul 24, 2019","The salary and benefits are average for the market. They are not allowed to keep you against your will. Given the high turnover rate, you'll always have new co-workers to help you through the misery.","Highly toxic environment. The accounting and tax departments struggle to retain people, with turnover greater than what is typically seen in the Big 4. People staying longer than a year is rare. Given the company's poor reputation in the employment marketplace, they cannot attract the level of talent necessary to function so dysfunction continues unabated. Long hours (more than what is typically seen in public accounting) with no end in sight given the poor management of people, process, and information systems from the merger in mid-2017 (more than 2 years later, it's still a mess).",JBG SMITH,JBGS,Diversified,2025-11-21,https://www.glassdoor.com/Reviews/JBG-SMITH-Reviews-E1747097.htm
Poor Department Management,2.0,"Aug 27, 2019","There is a lot to learn, employees at lower levels are generally are a very nice hard-working group of people, compensation is fair, stock-option program, lots of company perks/initiatives when you are allowed to participate","Accounting department head is controlling and makes staffing decisions for employees at all levels. If you want to move up you must brown nose and show face in the office after hours and on weekends. Quantity of hours is more important than quality of work. Environment is competitive and toxic, resulting in high turnover of staff. Employees at the next level down avoid making decisions and prefer to throw their own team under the bus than to stick up for them. They create an environment that discourages teamwork and encourages unhealthy competition. With 30%+ staff turnover in 6 months there’s clearly a problem with upper management that is not being addressed.",JBG SMITH,JBGS,Diversified,2025-11-21,https://www.glassdoor.com/Reviews/JBG-SMITH-Reviews-E1747097.htm
"Not terrible, not great",3.0,"Mar 21, 2022","JBGS offers good corporate benefits and was great about COVID response (for corporate employees). If your managers value you, you'll go far. The work was varied, but not challenging. My co-workers were lovely people, who I formed great relationships with, and who would go out of their way to help out.","There is a huge disparity between the treatment, benefits, salaries, diversity, etc. of corporate vs. site level staff, and a good amount of eye rolls when site level staff ask for better. It's very transparent what teams and departments are valued (i.e. asset management is a priority, accounting is not, etc.) and if you're not in one of the favored departments you won't have any room for growth. The only way to get your value recognized is to a) be a favorite of the executive over your department or b) threaten to leave. Communication between departments is abysmal. You'll be overworked and severely underpaid. Your work life balance depends on your manager; some are better than others. If you get a bad manager, emails came in at all hours and there were times where I saw people get reprimanded for not responding to something at 12 AM.",JBG SMITH,JBGS,Diversified,2025-11-21,https://www.glassdoor.com/Reviews/JBG-SMITH-Reviews-E1747097.htm
I Want To Believe This Is A Great Company,4.0,"May 23, 2017","Well known company. Mention JBG to anyone in this industry and they'll know exactly who we are and will probably be impressed. -Plenty room for growth, flexibility, and variety. -Great benefits.","-Commission structure can use some vast improvement. -Immediate managers will purposefully give you low evaluation scores to keep you under the radar. -Favoritism is definitely shown and your hard work will go unnoticed if you are not in the fold with the right ppl. -Being creative, residing in the grey areas, and thinking outside of the box in your approach to Leasing and/or Management are frowned upon. If you're more edgy and not as ""cookie cutter"" as everyone else, don't hope to make many connections here.",JBG SMITH,JBGS,Diversified,2025-11-21,https://www.glassdoor.com/Reviews/JBG-SMITH-Reviews-E1747097.htm
Poor culture/practices,1.0,"Jul 18, 2021",Resident experience is a high priority. PTO is good but high turnover and being short staffed means you never get to use it.,"Our office was acquired by JBG and everyone’s offer to stay with the community contained flat out lies; there were huge pay cuts, the job itself got far more difficult and unorganized, and 45-50 hour work weeks with no lunch breaks became the norm. Borderline Fair Housing violations were common in bad practices that allowed opportunities for some residents and not others in obscure “customer service gestures”. Over time, management implemented a cycle of requiring lower staff to enforce policies that they would then waive entirely when speaking to residents themselves, as if to deliberately make subordinate staff appear incompetent, uncaring, and mean in the eyes of residents. This created an environment in which constant negative reviews for leasing staff diminished any possibility of upward mobility no matter how strong their work ethic or sales skills.",JBG SMITH,JBGS,Diversified,2025-11-21,https://www.glassdoor.com/Reviews/JBG-SMITH-Reviews-E1747097.htm
Great potential to be and do better,2.0,"Sep 23, 2018","Learning a lot, great onsite team, knowledgeable co-workers","Way too much work. Since the merger, PM office staff has been given a lot more tasks, with little direction and/or support. Although the workload has increased significantly, there is no additional support offered. It is impossible to keep up. Working from home off hours to just stay afloat. Also, Glassdoor keeps sending me emails telling me how underpaid I am. That stings for how hard I work. I would like to mention that these are not legacy VNO legacy changes, as another person said. This is a completely different structures for both legacy teams. It was not like this before.",JBG SMITH,JBGS,Diversified,2025-11-21,https://www.glassdoor.com/Reviews/JBG-SMITH-Reviews-E1747097.htm
"Work life balance, caring management",5.0,"Aug 5, 2021","The regional managers/VPs are always willing to assist with questions and they keep an open dialogue with their managers. JBG Smith genuinely cares about work-life balance, they lead the charge in Diversity + Inclusion, and they sincerely want every one of their team members to succeed. The vacation time is substantial (and they love it when you take it!), we received free Calm subscriptions to help us relax, and they have departments of every kind to assist with tasks so you can focus on working with your team and improving the customer experience. They're constantly developing and acquiring new communities and the future of a career trajectory is limitless. It was hard for me to leave my old company, but I didn't realize how much better my work life could be with a new company until I came on board with JBG Smith.",I wouldn't change a thing!,JBG SMITH,JBGS,Diversified,2025-11-21,https://www.glassdoor.com/Reviews/JBG-SMITH-Reviews-E1747097.htm
Not terrible but not transparent,2.0,"Jan 6, 2022","offers covid sick pay, pretty good health insurance,","the benefits provided to corporate staff are excellent and very holistic while the same benefits are not available to residential staff. also this is not made very clear when being offered employment. corporate staff get ""rest & recharge"" time which allows them to take sick/personal time as needed while all other staff must accrue time which forces staff to come to work when sick (unless it's actually covid) and does not support staff wellness especially mental wellness during the most stressful time in recent human history.",JBG SMITH,JBGS,Diversified,2025-11-21,https://www.glassdoor.com/Reviews/JBG-SMITH-Reviews-E1747097.htm
Excellent employer!,5.0,"May 17, 2022","I joined almost ten years ago and have been able to grow my career with this company. They foster an environment that grows employee skillsets from within for future career growth, and I've seen colleague after colleague be able to move up here over the past few years. We're experiencing rapid growth, so there seem to be new opportunities to advance regularly. Very optimistic about the future here! Great benefits, great time off package, very low insurance copays, competitive pay (above average, in my opinion), diverse culture, and a company that seems to truly value each employee. Extremely supportive upper management. Probably the best company culture I have ever worked in.",- Short staffing can be a challenge when we have to operate with less than a full staff. Rapid growth has created a lot of openings that don't seem to get filled fast enough in this economy.,JBG SMITH,JBGS,Diversified,2025-11-21,https://www.glassdoor.com/Reviews/JBG-SMITH-Reviews-E1747097.htm
Leasing Consultant,3.0,"Nov 1, 2018","Every person I’ve met and worked with is great. The environment is great. I had no prior experience in this industry, and I believe this has been a great way to get my foot in the door.",ultant,JBG SMITH,JBGS,Diversified,2025-11-21,https://www.glassdoor.com/Reviews/JBG-SMITH-Reviews-E1747097.htm
Project accountant,2.0,"May 30, 2018",Generous PTO. Friendly coworkers. Leader in the dc metro RE industry.,Very stressful and competitive in accounting department. This competition is unnecessary in my opinion and leads to drama sometimes. But CAO seems to promote this trend. Very high turnover since the merger. Basically farewell happy hour every two weeks. And no award for the hardworking. Lack a growing space in the company. Management rather pay 10k more to use a consultant than promoting someone from inside. one day a week working from home policy is a jk. Very stingy on compensation.,JBG SMITH,JBGS,Diversified,2025-11-21,https://www.glassdoor.com/Reviews/JBG-SMITH-Reviews-E1747097.htm
