title,rating,date,pros,cons,company,ticker,property_type,scrape_date,glassdoor_url
Great place to work!,5.0,"Oct 21, 2025",I learned a lot and worked directly with my team. Great culture. Awesome benefits. They really care about their employees!,In office full time 5 days a week.,Regency Centers Corporation,REG,Retail,2025-11-20,https://www.glassdoor.com/Reviews/Regency-Centers-Reviews-E2379.htm
Leadership Issues,3.0,"Oct 6, 2025","benefits are wonderful, lots of fun corporate events, work is interesting and ever evolving","Leadership in Bellevue needs drastic improvement. Toxic leadership leading to unhappy employees, expectations unclear.",Regency Centers Corporation,REG,Retail,2025-11-20,https://www.glassdoor.com/Reviews/Regency-Centers-Reviews-E2379.htm
"Company was great, Leadership not so much",3.0,"May 25, 2025","The company overall is great with top leadership! They offer tons of benefits and options for 401k, PTO, flex time, etc.","The office I worked in was very toxic. Lack of training or advancement, was stuck in. about and never allowed to do more even when my job description stated I should have been doing more. All requests for more work fell on deaf ears. I ended up leaving because of it. Gave them over two years and no advancement. Was only ever told that I would never be promoted because there are no positions. Literally would have had to wait for someone to leave.",Regency Centers Corporation,REG,Retail,2025-11-20,https://www.glassdoor.com/Reviews/Regency-Centers-Reviews-E2379.htm
Great company!,4.0,"Jul 7, 2025","Great benefits, good pay. Decent WLB (hybrid schedule).",Management makes decisions quickly without communicating w/teams first.,Regency Centers Corporation,REG,Retail,2025-11-20,https://www.glassdoor.com/Reviews/Regency-Centers-Reviews-E2379.htm
Arrist,5.0,"Jun 3, 2025",Great company to work for,Too much work when peak time,Regency Centers Corporation,REG,Retail,2025-11-20,https://www.glassdoor.com/Reviews/Regency-Centers-Reviews-E2379.htm
Terrible leader,1.0,"Apr 28, 2025",Good company poor department Accounting,"JM is a horrible team leader, she sighs really loud if you ask a question & not welcoming. HR has been notified & does nothing.",Regency Centers Corporation,REG,Retail,2025-11-20,https://www.glassdoor.com/Reviews/Regency-Centers-Reviews-E2379.htm
Awesome Company,4.0,"Mar 13, 2025",Work life balance is amazing!,During the busy times it's rough but that's with any company.,Regency Centers Corporation,REG,Retail,2025-11-20,https://www.glassdoor.com/Reviews/Regency-Centers-Reviews-E2379.htm
"Great benefits, poor management",3.0,"Nov 20, 2024","Benefits, easy work, fun people","It's well known that half of your work is just meetings. You will literally have meetings about other meetings, just to reschedule the current meeting to discuss a different meeting. People are promoted to management that shouldn't be, just because they're great at ""company culture"". Lack of upward mobility for most positions.",Regency Centers Corporation,REG,Retail,2025-11-20,https://www.glassdoor.com/Reviews/Regency-Centers-Reviews-E2379.htm
No opportunity,3.0,"Nov 20, 2024","Great benefits, good place to work for non motivated people who want to sit in the same job and same position for a lot time","Average salary, no advancement opportunities, only hire based on who you know not based on performance. Laying paople off even when company is doing great.",Regency Centers Corporation,REG,Retail,2025-11-20,https://www.glassdoor.com/Reviews/Regency-Centers-Reviews-E2379.htm
Great company to work for,5.0,"Nov 14, 2024","Excellent pay, PTO, work-life balance, and company culture. This company continues to grow and thrive and it was a pleasure being a part of such a great organization.",It would behoove upper management to respond to more feedback from their field employees regarding strategic decisions in staffing placement.,Regency Centers Corporation,REG,Retail,2025-11-20,https://www.glassdoor.com/Reviews/Regency-Centers-Reviews-E2379.htm
Great company,4.0,"Jan 8, 2025",Good people with a great culture,Lack of growth depending on area,Regency Centers Corporation,REG,Retail,2025-11-20,https://www.glassdoor.com/Reviews/Regency-Centers-Reviews-E2379.htm
Not what it used to be,3.0,"Dec 4, 2024",They provide a great benefits package,"Act like they care, but in reality your just another number. Lots of favoritism. No growth",Regency Centers Corporation,REG,Retail,2025-11-20,https://www.glassdoor.com/Reviews/Regency-Centers-Reviews-E2379.htm
Great company to work for,4.0,"Aug 7, 2024","Great TOP leadership (CEO, CFO). They are very knowledgeable and make sound financial decisions for the company.","For corporate- depending on which department you are in, it can be a difference of day and night. Same with other offices. SVP’s, VP’s, Sr. Managers have been there for a long time… sometimes that’s a good thing and sometimes not.",Regency Centers Corporation,REG,Retail,2025-11-20,https://www.glassdoor.com/Reviews/Regency-Centers-Reviews-E2379.htm
Great Company,5.0,"Aug 2, 2024","Lots of opportunities to grow, great work life balance","Pay could be a little higher, seems like they lag a little behind the market pay for positions.",Regency Centers Corporation,REG,Retail,2025-11-20,https://www.glassdoor.com/Reviews/Regency-Centers-Reviews-E2379.htm
Lower then average salary,3.0,"Aug 2, 2024","Great Benefits for health, dental and vision",Definitely a place where they play favorites.,Regency Centers Corporation,REG,Retail,2025-11-20,https://www.glassdoor.com/Reviews/Regency-Centers-Reviews-E2379.htm
Great Place to work,5.0,"Jul 12, 2024",Everyone is sooo helpful and nice and they actually want you to succeed,Honestly nothing comes to mind.,Regency Centers Corporation,REG,Retail,2025-11-20,https://www.glassdoor.com/Reviews/Regency-Centers-Reviews-E2379.htm
Good Culture,4.0,"Jul 16, 2024","Good Company Culture.
Friendly Coworkers.
Great Benefits",High Turn over in department,Regency Centers Corporation,REG,Retail,2025-11-20,https://www.glassdoor.com/Reviews/Regency-Centers-Reviews-E2379.htm
Fantastic Company!,5.0,"Apr 30, 2024","It feels like family. Amazing insurance, 401K, 23 days of PTO plus holidays, super flexible schedules, leadership is friendly and welcoming.",The company is small but operates like a large corporation. It seems like employees don't leave so not alot of room for promotions.,Regency Centers Corporation,REG,Retail,2025-11-20,https://www.glassdoor.com/Reviews/Regency-Centers-Reviews-E2379.htm
"The Good, The Bad, The Ugly",5.0,"Nov 19, 2023",The culture The Pay The Incentives The Work/ Life balance,"I can not say all Department are like this, I hope not. AR Department management style is UGLY. TRIES to intimate, condescending, Wants respect but doesn't give respect because they are old and unwilling to renew leadership skills. Abusive behavior",Regency Centers Corporation,REG,Retail,2025-11-20,https://www.glassdoor.com/Reviews/Regency-Centers-Reviews-E2379.htm
Friendly people,4.0,"Jun 11, 2024",People are very friendly. Hybrid schedule.,"Almost too much praise for every little thing. Seems inauthentic.
Bad pay.",Regency Centers Corporation,REG,Retail,2025-11-20,https://www.glassdoor.com/Reviews/Regency-Centers-Reviews-E2379.htm
"Good people, good leadership",5.0,"Mar 1, 2024",Enjoy working with everyone here. The company offers great flexibility.,None that I can think of. Only thing would be more pay.,Regency Centers Corporation,REG,Retail,2025-11-20,https://www.glassdoor.com/Reviews/Regency-Centers-Reviews-E2379.htm
Good Company - Good Work Life,5.0,"Mar 13, 2024",Great Work Life Balance. Great Management,Potentially difficult upward mobility. Hard advancement.,Regency Centers Corporation,REG,Retail,2025-11-20,https://www.glassdoor.com/Reviews/Regency-Centers-Reviews-E2379.htm
Good company to work for,4.0,"Feb 20, 2024",Good work life balance and great team.,Sometimes the company leadership can be difficult,Regency Centers Corporation,REG,Retail,2025-11-20,https://www.glassdoor.com/Reviews/Regency-Centers-Reviews-E2379.htm
Good place to work,4.0,"Jan 24, 2024",Good company - great leaders,Hard to navigate up the ladder internally,Regency Centers Corporation,REG,Retail,2025-11-20,https://www.glassdoor.com/Reviews/Regency-Centers-Reviews-E2379.htm
Great Place,5.0,"Dec 20, 2023","Great company culture, great benefits",Nothing I can think of,Regency Centers Corporation,REG,Retail,2025-11-20,https://www.glassdoor.com/Reviews/Regency-Centers-Reviews-E2379.htm
Disconnect Between Rhetoric and Actions,1.0,"Aug 8, 2023","Easy hours (9:30-3:30), average benefits","No communication regarding business decisions - they forced all employees to return to a hybrid schedule without providing any substantive reason for doing so. It was commonplace have department-wide zoom meetings on work from home days, then the next day when required to be in-office I would work the entire day with my headphones on and not speak to a soul, direct manager included. It was completely counterintuitive and came off as a “power play” to force people to be in the office when they didn’t want to or need to be there. It could have also been to appease shareholders showing that they were “doing their part” to prop up spiraling commercial real estate values, but we will never know because they would never explain their intentions. Lack of diverse views by leadership - this company is huge on diversity equity and inclusion. It is very important to have diverse views, backgrounds, and viewpoints, but Regency has gone overboard and in the wrong way. They act as if diversity is only skin-deep which comes off as inherently racist, intentionally giving special resume-boosting projects, the easiest portfolios to manage, and making special exceptions of employment (special ergonomic chairs, promotions in less than 12 months, and additional unapproved time off were just three examples I personally witnessed) for employees based on what they look like and how they identify rather than how they perform. Ironically, the vast majority of the leadership team and upper-level management all grew up in Jacksonville and attended UNF for college, meaning that there is in fact little to no diversity of backgrounds, education, viewpoints, or life experiences. Weak compensation - since going public, this company heavily bends the knee to their institutional investors rather than focusing on their stated values. They say their employees are their greatest asset, but give rank-and-file employees meager 3-4% annual pay raises, while rewarding the executive team with compensation raises of 50% or more each year. When I started at Regency, my compensation was $60,000 per year, and left when it had barely cracked $64,000 two years later. In contrast, the CEO’s publicly reported compensation when I started was $3.9 million per year, and the last reported compensation when I left was well over $8 million. All the benefits are getting funneled to the top. Lack of regard for workers rights - I received retaliation for discussions regarding compensation. I was finally offered a promotion after two years (I was one of only two applicants for the job, I can’t imagine why) and discussed the promotion offer with my manager. Someone overheard the conversation, reported it to the hiring manager, then the hiring manager rescinded the promotion offer due to “public and private conversations regarding compensation” according to the confirmation email after the promotion was rescinded. Exactly one week later HR served me a notice regarding my “unprofessional conduct” and told me I was not allowed to discuss my compensation except behind closed doors. They say they do what is right, but this was absolutely unacceptable and the most unprofessional business action I have witnessed in my professional career. I would not recommend working here. It’s a toxic culture",Regency Centers Corporation,REG,Retail,2025-11-20,https://www.glassdoor.com/Reviews/Regency-Centers-Reviews-E2379.htm
Awesome company,5.0,"Oct 6, 2023","Company culture is great. Management seems to legitimately care, especially the CEO.","The role I was in changed a lot during my time, the uncertainty was not the best",Regency Centers Corporation,REG,Retail,2025-11-20,https://www.glassdoor.com/Reviews/Regency-Centers-Reviews-E2379.htm
Typical Real Estate Firm,4.0,"Sep 14, 2023","Good benefits, time off, mediocre pay, work life could be improved. Depends on the market you operate","lack of growth opportunity, low transparency on pay, promotion inconsistency.",Regency Centers Corporation,REG,Retail,2025-11-20,https://www.glassdoor.com/Reviews/Regency-Centers-Reviews-E2379.htm
Friendly Place to Work,4.0,"Sep 21, 2023",Paid time off health benefits department outings,not feeling valued not being paid enough for basic needs,Regency Centers Corporation,REG,Retail,2025-11-20,https://www.glassdoor.com/Reviews/Regency-Centers-Reviews-E2379.htm
mixed,2.0,"Sep 23, 2023","great portfolio, got to wear many hats","systems kept changing, disorganized teams",Regency Centers Corporation,REG,Retail,2025-11-20,https://www.glassdoor.com/Reviews/Regency-Centers-Reviews-E2379.htm
Great Place to work,5.0,"Aug 13, 2023",Great Team Great Work Life Balance,Slower Promotion Slower Learning and Growth,Regency Centers Corporation,REG,Retail,2025-11-20,https://www.glassdoor.com/Reviews/Regency-Centers-Reviews-E2379.htm
Great work culture,5.0,"Jul 5, 2023",Small family feel; inspiring managers and friendly co-workers,Too large to be truly flexible,Regency Centers Corporation,REG,Retail,2025-11-20,https://www.glassdoor.com/Reviews/Regency-Centers-Reviews-E2379.htm
"Great benefits, PTO",5.0,"Mar 19, 2023","Hybrid work (3 days in office, 2 remote) Approachable Senior Management",Downtown Jacksonville is not a great place to work three days a week,Regency Centers Corporation,REG,Retail,2025-11-20,https://www.glassdoor.com/Reviews/Regency-Centers-Reviews-E2379.htm
Review,4.0,"Apr 15, 2023",Benefits and work life balance,No growth in the company,Regency Centers Corporation,REG,Retail,2025-11-20,https://www.glassdoor.com/Reviews/Regency-Centers-Reviews-E2379.htm
Could be better - Could have been worse,3.0,"Jul 26, 2013","Great PTO, 401k and profit sharing plans. Pay is okay. They do invest in their properties so you can be proud of what you're offering to the market. Good place to gain experience and take elsewhere.","Not a lot of feedback from managers regarding job performance, they seem to promote based on appearances and hobnobbing instead of quality of work and experience, not a lot of openness between managers and normal employees led to feelings of us vs. them - low morale. I heard this from corporate and field offices.",Regency Centers Corporation,REG,Retail,2025-11-20,https://www.glassdoor.com/Reviews/Regency-Centers-Reviews-E2379.htm
ZERO job security,2.0,"Feb 26, 2017","Most of the employees are nice. Great benefits (if you ever get them). Nicely stocked kitchen (drinks, snacks)","They just acquired another company (it is public knowledge) and it seems that things are in a state of flux at the moment. I was hired and then two months later, told my position was being eliminated. So they didn't know two months ago when they hired for the position that it was going to be eliminated? I canceled my unemployment for this job and now I'm no longer eligible to receive it. I don't know what kind of sick game they are playing, but it just isn't right to treat people this way.",Regency Centers Corporation,REG,Retail,2025-11-20,https://www.glassdoor.com/Reviews/Regency-Centers-Reviews-E2379.htm
Not all it's cracked up to be.,2.0,"Apr 14, 2014",Great place to start and move on.,"They claim a big emphasis on people and culture, but when it comes right down to it it's just like any other big corporation. You need to kick and scream for a promotion within, very little room for real advancement.. It was an extremely frustrating experience to be a part of a 360 review process (""high potential employee""), apply for every possible opportunity to advance my career and let down over and over again. I personally felt led on by upper management during my 3.5 year tenure and my career was stalled.",Regency Centers Corporation,REG,Retail,2025-11-20,https://www.glassdoor.com/Reviews/Regency-Centers-Reviews-E2379.htm
"Great people, great company",5.0,"Dec 8, 2014","Upward mobility available Great company culture For a large REIT where things can start to become mundane, Regency is a pretty fun place to work.","Any company of this size is going to have some measure of bs politics and regency is no different. You know pretty quickly you're going to have to play the ""game,"" and if you're not willing to do that at a small measure, work somewhere else.",Regency Centers Corporation,REG,Retail,2025-11-20,https://www.glassdoor.com/Reviews/Regency-Centers-Reviews-E2379.htm
Great company,4.0,"Sep 6, 2012","Regency Centers has great benefits and excellent people to work with. When I started working for Regency Centers in 2004, Regency Centers was a great company to work for and there was a lot of upper management support from the Jacksonville office as well as direct management support from the office I worked in.","After some restructuring and downsizing, I felt there was less support from upper management to the satellite offices. I only had contact with the regional officer directly above my manager about 3-4 times in the 8 years I worked there. During this time, I felt unmotivated and underutilized by direct management and had no real avenues to express my dissatisfaction.",Regency Centers Corporation,REG,Retail,2025-11-20,https://www.glassdoor.com/Reviews/Regency-Centers-Reviews-E2379.htm
Be careful - hidden issues,2.0,"Dec 13, 2021","Good benefits, some of the people are very nice","The leadership engages in rampant favoritism. There’s no room to grow after a couple of years. They want you to often be in office doing busy work even if your job could easily be done from home, but they let their favorites work from home, and not others. They claim to listen to employees but when you speak out, there is punishment, unfortunately. There are a lot of old school people in leadership who are disconnected from current needs & wont listen. Boys club, if you will.",Regency Centers Corporation,REG,Retail,2025-11-20,https://www.glassdoor.com/Reviews/Regency-Centers-Reviews-E2379.htm
Best company I have worked for,4.0,"Mar 23, 2017","Great executive leadership, vision and open communication. They track and communicate progress on strategic goals every quarter. Everyone really cares about work-life balance and leaving a healthy life. I was presented with great training opportunities and learning opportunities and was always treated well. The President of the company texts me, stop by my office or calls me every year on my birthday even if it falls on a weekend.","My direct supervisor could spend more time getting to know the entire team and coaching his direct reports but it isn't really a horrible situation. VP level gets what they want, no questions ask. No advancement available.",Regency Centers Corporation,REG,Retail,2025-11-20,https://www.glassdoor.com/Reviews/Regency-Centers-Reviews-E2379.htm
Accounting,2.0,"Feb 22, 2020","Decent pay, philanthropic company, semi-flex work schedule.","Upper management is not what it used to be. The exec level has shifted focus from viewing employees as their most important asset to shady business practices. Hard work no longer pays off... everyone is replaceable and the loyalty isn’t reciprocated. Departments are constantly going through reorganizations. Also, don’t be fooled by a female CEO, it is a boys club and lacks diversity in all areas. Very sad because it used to be one of the best companies around. The culture has taken a major nose dive.",Regency Centers Corporation,REG,Retail,2025-11-20,https://www.glassdoor.com/Reviews/Regency-Centers-Reviews-E2379.htm
"""Loved working for Regency""",4.0,"Apr 9, 2017",Excellent paid time off. Benefits and pay are decent. Great work-to-life balance. Executive Management team is AWESOME! Flexible schedules. Fun company outings and holiday party. Executive team keeps you up-to-date about the business through Town Halls.,High turn-over in Real Estate Accounting Department. Some of the management team in Real Estate Accounting are impersonable and there is some favoritism. Not a lot of opportunity for advancement within the department.,Regency Centers Corporation,REG,Retail,2025-11-20,https://www.glassdoor.com/Reviews/Regency-Centers-Reviews-E2379.htm
Property Manager,5.0,"Mar 31, 2019","The emphasis on company culture and employee well-being is simply remarkable and refreshing. The vetting process HR gave was thorough, and longer than expected. But, I actually appreciated the process, as it gave me time to ensure it was a great fit both ways, and it showed they truly care who joins the team.","No company is perfect, and I am sure I could list a few minor ones that every company has, but no cons worth listing.",Regency Centers Corporation,REG,Retail,2025-11-20,https://www.glassdoor.com/Reviews/Regency-Centers-Reviews-E2379.htm
Great Company and Executive Leadership,4.0,"Aug 30, 2022","Great benefits, lots of PTO and paid holidays, company outings, flex/hybrid work schedule, paid parking, and SOME really great people. Volunteering/community involvement is encouraged.",Limited opportunity for advancement. Not 100% remote. Some managers and team leads are toxic and create a hostile environment.,Regency Centers Corporation,REG,Retail,2025-11-20,https://www.glassdoor.com/Reviews/Regency-Centers-Reviews-E2379.htm
Brainless corporation lucky to have so many good properties.,2.0,"Jan 5, 2009","There is a lot of paid time off, but it is sometimes detrimental because the work doesn't go away just because you do.",There is very little leadership shown during these tough times. You would think someone would share their overall vision for what is expected. Individuality doesn't seem to be rewarded. Lower level employees get the exact same wage increases regardless of performance or effort.,Regency Centers Corporation,REG,Retail,2025-11-20,https://www.glassdoor.com/Reviews/Regency-Centers-Reviews-E2379.htm
Best Company I've worked for,5.0,"Dec 22, 2022","-Great company culture. They really take the time to vet people with multiple interviews before they are hired to make sure that they fit in to the culture. Lots of happy hours, lunches/dinners, teambuilding events, etc - Great Pay, Benefits, PTO, Work Life Balance - Large company so there is tons of support","Not really any. You do get a lot of PTO, but it's sometimes hard to use it all because you will have a huge workload when you get back from vacation.",Regency Centers Corporation,REG,Retail,2025-11-20,https://www.glassdoor.com/Reviews/Regency-Centers-Reviews-E2379.htm
"Some good aspects, some very negative",2.0,"Mar 18, 2019","Health benefits are good, paid time off is pretty good.","There is unfortunately a lot of favoritism. Very little room for growth/promotion, and when available, does not seem fairly administered. A lot of closed off private discussions and mistrust in some departments. We also have to work in close and loud conditions which isn't easy at times. Company is said to be big on treating people right, but it does not translate internally, which is a shame.",Regency Centers Corporation,REG,Retail,2025-11-20,https://www.glassdoor.com/Reviews/Regency-Centers-Reviews-E2379.htm
Not too shabby,4.0,"Jun 11, 2008",The people are great to work with. Fantastic software and IT department.,The salary is too low and not enough perks for it.,Regency Centers Corporation,REG,Retail,2025-11-20,https://www.glassdoor.com/Reviews/Regency-Centers-Reviews-E2379.htm
Great Company,5.0,"Nov 4, 2016","I have worked for many different companies and Regency Centers was my favorite employer. Kind, generous, great work environment and great employees. Executives knew every employee by name and genuinely cared about each employee.","Working in a one of their smaller offices, there weren't as many opportunities for advancement as their larger offices, but that is not their fault.",Regency Centers Corporation,REG,Retail,2025-11-20,https://www.glassdoor.com/Reviews/Regency-Centers-Reviews-E2379.htm
An O.K. experience......,3.0,"Apr 22, 2014",Great parties and celebrations. Team members are great people. Salary is competitive.,"I've seen better insurance. A small company like this means everyone knows your business - even HR. People focus so much on their title and position in the company. Overall, not a very diverse company. Inexperienced and power-abusing lower-level management.",Regency Centers Corporation,REG,Retail,2025-11-20,https://www.glassdoor.com/Reviews/Regency-Centers-Reviews-E2379.htm
Amazing Leaders and Quality Culture,5.0,"Mar 4, 2019",The leaders are of great integrity and they actually care for their employees. Each person is treated with care and is recognized as an individual. Team work is encouraged and it definitely is modeled from top down. Great benefits. Culture is wonderful. One of the best places I have worked.,Regional offices are intimate (which is a great PRO) but the growth in departments are minimum.,Regency Centers Corporation,REG,Retail,2025-11-20,https://www.glassdoor.com/Reviews/Regency-Centers-Reviews-E2379.htm
I am enjoying my time here.,3.0,"Jan 18, 2010",In a good economy it was a nice place to work. Would recommend for employment. Benefits package was very good.,In a bad economy it was not a nice place to work. There was a lot of job cuts in the recent downturn.,Regency Centers Corporation,REG,Retail,2025-11-20,https://www.glassdoor.com/Reviews/Regency-Centers-Reviews-E2379.htm
